Entry,Ref,OLDRS,RANK,RS,RAWQP,QPRANK,QP,RANK2,RS2,RAWQP2,QP2,RANK3,RS3,RAWQP3,QP3,RawAvg,RatingYear,Vintage,Qterms,FullName,AppellationLevel,AppellationName,WineryName,Region,EvaluationAvg,Price,Grapes,Pairing,ScoreAvg,EvaluationAIS,ScoreAIS,EvaluationGR,ScoreGR,SLC,TLC,WineTypeIT,WineType,Alcohol,Bottles,AgingMonths,AgingTypeIT,AgingType,Notes,Tasting Notes,Country,VintageNV,Method,Sweetness
2,,,,,,,,,,,,,,,,,2023,2018,,Le Stanze Del Poliziano,,,Poliziano,Toscana,,48,Cabernet sauvignon 90% – Merlot 10%,Gulasch di cervo con patate stufate,,,89,nd,nd,,,,,14,20,,Legno 18 mesi,,,,Italy,,,
2,,,,,,,,,,,,,,,,,2023,2018,,Vino Nobile Di Montepulciano Le Caggiole,,,Poliziano,Toscana,,48,Sangiovese 100%,Cosciotto d’agnello al forno con patate novelle,,,86,nd,nd,,,,,14,20,,Legno 18 mesi,,,,Italy,,,
2,,,,,,,,,,,,,,,,,2023,2019,,Vino Nobile Di Montepulciano,,,Poliziano,Toscana,,48,Sangiovese 85% – altre varietà 15%,Pappardelle al ragù di cinghiale,,,86,nd,nd,,,,,14,20,,Legno 18 mesi,,,,Italy,,,
2,,,,,,,,,,,,,,,,,2023,2018,,Cortona Merlot In Violas,,,Poliziano,Toscana,,48,Merlot 100%,Arista di maiale con salsa di prugne,,,86,nd,nd,,,,,14,20,,Legno 18 mesi,,,,Italy,,,
2,,,,,,,,,,,,,,,,,2023,2019,,Maremma Toscana Cabernet Mandrone Di Lohsa,,,Poliziano,Toscana,,48,Cabernet sauvignon 85% – Petit verdot 8% – Carignano 7%,Stracotto d’asino,,,86,nd,nd,,,,,14,20,,Legno 18 mesi,,,,Italy,,,
2,,,,,,,,,,,,,,,,,2023,2019,,Carmignano Il Circo Rosso Riserva,,,Pratesi,Toscana,,37,Sangiovese 70% – Cabernet sauvignon 15% – Merlot 10% –,Guancia di vitello in umido,,,91,nd,nd,,,,,15,8,,Legno 18 mesi,,,"Rubino luminoso. Impatto intenso di ciliegia, fragolina di bosco e lampone in confettura, giaggiolo e viola, erbe aromatiche, poi mora, mirtillo, macchia mediterranea, garrigue, cacao, note mentolate e tostate. Sorso elegante, balsamico e fresco, tannino vellutato, ottima persistenza al boero.",Italy,,,
2,,,,,,,,,,,,,,,,,2023,2020,,Carmignano Carmione,,,Pratesi,Toscana,,37,Sangiovese 70% – Cabernet sauvignon 15% – Merlot 10% –,Lepre alla cacciatora,,,89,nd,nd,,,,,15,8,,Legno 18 mesi,,,,Italy,,,
2,,,,,,,,,,,,,,,,,2023,2019,,I Sassi Di Lolocco,,,Pratesi,Toscana,,37,Merlot 100%,Agnolotti al piccione con sugo d’arrosto,,,86,nd,nd,,,,,15,8,,Legno 18 mesi,,,,Italy,,,
2,,,,,,,,,,,,,,,,,2023,2018,,Chianti Classico Gran Selezione Vigna Le Cataste,,,Quercia al Poggio,Toscana,,30,Sangiovese 100%,Risotto al tartufo nero,,,91,nd,nd,,,,,14,3,,Legno 24 mesi e,,,"Cemento 24 mesi Livrea carminio dai riflessi granato che rimanda ad amarena e arancia rossa, alternate viola, iris e glicine. Delicatezze di cannella e vaniglia con anse balsamiche di cioccolato alla menta confermano ampiamente l’assaggio fresco, morbido e persistente. Imminente integrazione dei tannini vellutati.",Italy,,,
2,,,,,,,,,,,,,,,,,2023,2018,,Chianti Classico Riserva,,,Quercia al Poggio,Toscana,,30,Sangiovese 100%,Cemento 24 mesi Lumache in umido alle erbette,,,86,nd,nd,,,,,14,3,,Legno 24 mesi e,,,,Italy,,,
2,,,,,,,,,,,,,,,,,2023,2020,,Chianti Classico,,,Quercia al Poggio,Toscana,,30,Sangiovese 80% – altre varietà 20%,Cemento 12 mesi Tigelle e salumi,,,86,nd,nd,,,,,14,3,,Legno 24 mesi e,,,,Italy,,,
2,,,,,,,,,,,,,,,,,2023,2020,,Batàr,,,Querciabella,Toscana,,77,Chardonnay 50% – Pinot bianco 50%,Pollo alle mandorle e curcuma,,,91,nd,nd,,,,,14,20,,Legno 9 mesi,,,"Manto paglierino brillante. Dirompono profumi accattivanti di cedro candito, lime, bergamotto, tiglio, camomilla, santoreggia e ancora cioccolato bianco e ricordi di pâtisserie. Sinuoso e raffinato, esprime grande sapidità e freschezza, sfumando in saporite persistenze di susina gialla.",Italy,,,
2,,,,,,,,,,,,,,,,,2023,2018,,Chianti Classico Gran Selezione,,,Querciabella,Toscana,,77,Sangiovese 100%,Filetto di cervo ai mirtilli,,,91,nd,nd,,,,,14,20,,Legno 9 mesi,,,"Veste rubino lucente. Olfatto esuberante e gustoso di mora e ciliegia in confettura, rosa e viola seguite da erbe aromatiche, sottobosco, eucalipto e cacao. Elegantissimo e di grande impatto gustativo, sprigiona suggestioni fresche e saline che si fondono al tannino di superiore fattezza. Finale dai ritorni balsamici.",Italy,,,
2,,,,,,,,,,,,,,,,,2023,2019,,Palafreno,,,Querciabella,Toscana,,77,Merlot 100%,Capriolo con salsa di ribes rosso,,,89,nd,nd,,,,,14,20,,Legno 9 mesi,,,,Italy,,,
2,,,,,,,,,,,,,,,,,2023,2018,,Camartina,,,Querciabella,Toscana,,77,Cabernet sauvignon 70% – Sangiovese 30%,Straccetti di vitello al rosmarino,,,89,nd,nd,,,,,14,20,,Legno 9 mesi,,,,Italy,,,
2,,,,,,,,,,,,,,,,,2023,2021,,Mongrana Bianco,,,Querciabella,Toscana,,77,Vermentino 70% – Viognier 30%,Crostini con baccalà mantecato,,,86,nd,nd,,,,,14,20,,Legno 9 mesi,,,,Italy,,,
2,,,,,,,,,,,,,,,,,2023,2019,,Chianti Classico Gran Selezione Roncicone,,,Ricasoli,Toscana,,50,Sangiovese 100%,Piccione ai porcini e tartufo nero,,,91,nd,nd,,,,,14,11,,Legno 18 mesi,,,"Carminio appena trasparente. Timbro olfattivo articolato di mora, iris, timo, sigaro, cedro e accenni di cipria. Tattilità nobile e incedere serafico caratterizzano il palato, la parte tannica mostra fibra senza far trapelare asperità e la dotazione calorica risulta ben fusa con la freschezza persistente.",Italy,,,
2,,,,,,,,,,,,,,,,,2023,2019,,Casalferro,,,Ricasoli,Toscana,,50,Merlot 100%,Gulasch di cervo con patate stufate,,,89,nd,nd,,,,,14,11,,Legno 18 mesi,,,,Italy,,,
2,,,,,,,,,,,,,,,,,2023,2019,,Chianti Classico Gran Selezione Ceniprimo,,,Ricasoli,Toscana,,50,Sangiovese 100%,Trippa in umido,,,89,nd,nd,,,,,14,11,,Legno 18 mesi,,,,Italy,,,
2,,,,,,,,,,,,,,,,,2023,2019,,Chianti Classico Gran Selezione Colledilà,,,Ricasoli,Toscana,,50,Sangiovese 100%,Terrina di lepre con salsa di prugne,,,89,nd,nd,,,,,14,11,,Legno 18 mesi,,,,Italy,,,
2,,,,,,,,,,,,,,,,,2023,2019,,Chianti Classico Gran Selezione Castello Di Brolio,,,Ricasoli,Toscana,,50,Sangiovese 100%,Cinghiale in umido,,,89,nd,nd,,,,,14,11,,Legno 18 mesi,,,,Italy,,,
2,,,,,,,,,,,,,,,,,2023,2020,,Chianti Classico Brolio,,,Ricasoli,Toscana,,50,Sangiovese 95% – Colorino 5%,Risotto agli asparagi e provola affumicata,,,86,nd,nd,,,,,14,11,,Legno 18 mesi,,,,Italy,,,
2,,,,,,,,,,,,,,,,,2023,2018,,Chianti Classico Gran Selezione Sergio Zingarelli,,,Rocca delle Macìe,Toscana,,60,Sangiovese 100%,Fiorentina alla brace,,,89,nd,nd,,,,,14,6,,Legno 24 mesi e,,,"Cemento 3 mesi Luminoso rubino. Dapprima mirto, timo, poi pot-pourri, ciliegie sotto spirito, prugna in confettura. E ancora humus, liquirizia, tè nero, anice stellato, rabarbaro. In bocca gioca su freschezza e sapidità, dove il tannino setoso bilancia il calore alcolico. Chiusura agrumata e scia sapida.",Italy,,,
2,,,,,,,,,,,,,,,,,2023,2019,,Chianti Classico Gran Selezione Tenuta Fizzano,,,Rocca delle Macìe,Toscana,,60,Sangiovese 90% – Colorino 10%,Tagliata al pepe verde,,,89,nd,nd,,,,,14,6,,Legno 24 mesi e,,,,Italy,,,
2,,,,,,,,,,,,,,,,,2023,2019,,Chianti Classico Sergioveto Riserva,,,Rocca delle Macìe,Toscana,,60,Sangiovese 100%,Strudel di porcini e zucca con crema al Parmigiano,,,86,nd,nd,,,,,14,6,,Legno 24 mesi e,,,,Italy,,,
2,,,,,,,,,,,,,,,,,2023,2020,,Chianti Classico Tenuta Sant’Alfonso,,,Rocca delle Macìe,Toscana,,60,Sangiovese 100%,Terrina di coniglio,,,86,nd,nd,,,,,14,6,,Legno 24 mesi e,,,,Italy,,,
2,,,,,,,,,,,,,,,,,2023,2020,,Chianti Classico Famiglia Zingarelli,,,Rocca delle Macìe,Toscana,,60,Sangiovese 95% – Merlot 5%,Rotolo di coniglio con pomodorini ed erbe aromatiche,,,82,nd,nd,,,,,14,6,,Legno 24 mesi e,,,,Italy,,,
2,,,,,,,,,,,,,,,,,2023,2015,,Chianti Classico Tempi,,,Rocca di Castagnoli,Toscana,,200,Sangiovese 100%,Pluma di maialino Bellota con cipolle caramellate,,,91,nd,nd,,,,,16,2,,Cemento 12 mesi,,,"e Terracotta 12 mesi Rubino. Bouquet olfattivo attraente di ciliegie e more mature, violetta e fiore del rosmarino, chiodi di garofano, noce moscata, alloro e inchiostro di china. L’ingresso in bocca è snello, la liquidità scorre grazie tannini minuti e saporiti, combinati con la freschezza dell’agrume. Scia finale sapida e persistente.",Italy,,,
2,,,,,,,,,,,,,,,,,2023,2014,,Vin Santo Del Chianti Classico,,,Rocca di Castagnoli,Toscana,,200,Malvasia bianca lunga 80% – Trebbiano 20%,Roquefort,,,89,nd,nd,,,,,16,2,,Cemento 12 mesi,,,,Italy,,,
2,,,,,,,,,,,,,,,,,2023,2018,,Chianti Classico Gran Selezione Effe 55,,,Rocca di Castagnoli,Toscana,,200,Sangiovese 100%,Coniglio alla cacciatora,,,89,nd,nd,,,,,16,2,,Cemento 12 mesi,,,,Italy,,,
2,,,,,,,,,,,,,,,,,2023,2021,,Maremma Toscana Vermentino Torresaline,,,Rocca di Castagnoli,Toscana,,200,Vermentino 100%,Tartare di gamberi,,,86,nd,nd,,,,,16,2,,Cemento 12 mesi,,,,Italy,,,
2,,,,,,,,,,,,,,,,,2023,2021,,Morellino Di Scansano Spiaggiole,,,Rocca di Castagnoli,Toscana,,200,Sangiovese 100%,Porchetta di Ariccia,,,86,nd,nd,,,,,16,2,,Cemento 12 mesi,,,,Italy,,,
2,,,,,,,,,,,,,,,,,2023,2019,,Maremma Toscana Merlot Baffonero,,,Rocca di Frassinello,Toscana,,160,Merlot 100%,Tagliata al pepe verde,,,91,nd,nd,,,,,15,4,,Legno 14 mesi,,,"Manto rubino impenetrabile. Olfatto ampio che apre su mora, china, erbe officinali per poi virare su spezie dolci, corteccia e sandalo. Registro gustativo prestante ma controllato. Il tannino raffinato si affianca un’ottima reattività fresco-sapida e insieme danno vita un sorso concentrato e disteso.",Italy,,,
2,,,,,,,,,,,,,,,,,2023,2020,,Maremma Toscana Rosso Rocca Di Frassinello,,,Rocca di Frassinello,Toscana,,160,Sangiovese 60% – Cabernet sauvignon 20% – Merlot 20%,Capriolo ai porcini,,,89,nd,nd,,,,,15,4,,Legno 14 mesi,,,,Italy,,,
2,,,,,,,,,,,,,,,,,2023,2018,,Maremma Toscana Rosso San Germano,,,Rocca di Frassinello,Toscana,,160,Cabernet sauvignon 45% – Merlot 45% – Sangiovese 10%,Straccetti di vitello al rosmarino,,,89,nd,nd,,,,,15,4,,Legno 14 mesi,,,,Italy,,,
2,,,,,,,,,,,,,,,,,2023,2020,,Maremma Toscana Rosso Ornello,,,Rocca di Frassinello,Toscana,,160,Sangiovese 40% – Cabernet sauvignon 20% – Merlot 20% –,Ravioli al sugo di chianina e tartufo nero,,,89,nd,nd,,,,,15,4,,Legno 14 mesi,,,,Italy,,,
2,,,,,,,,,,,,,,,,,2023,2020,,Maremma Toscana Rosso Le Sughere Di Frassinello,,,Rocca di Frassinello,Toscana,,160,Sangiovese 50% – Cabernet sauvignon 25% – Merlot 25%,Trippa in umido,,,86,nd,nd,,,,,15,4,,Legno 14 mesi,,,,Italy,,,
2,,,,,,,,,,,,,,,,,2023,2021,,Maremma Toscana Vermentino,,,Rocca di Frassinello,Toscana,,160,Vermentino 100%,"Riso, cozze e zafferano",,,86,nd,nd,,,,,15,4,,Legno 14 mesi,,,,Italy,,,
2,,,,,,,,,,,,,,,,,2023,2017,,Chianti Classico Gran Selezione Vigneto San Marcellino,,,Rocca di Montegrossi,Toscana,,44,Sangiovese 90% – Pugnitello 10%,Beccacce allo spiedo,,,89,nd,nd,,,,,14,1,,Legno 25 mesi,,,"Rubino profondo con bordo appena granato. Naso intenso con frutta scura, mirtilli, rosa canina, cannella e tabacco Kentucky. Ingresso in bocca progressivo e rinfrescante, dove il tannino energico si completa con l’acidità, finale saporito che si impreziosisce nella lunga persistenza di note balsamiche.",Italy,,,
2,,,,,,,,,,,,,,,,,2023,2016,,Ridolfo,,,Rocca di Montegrossi,Toscana,,44,Cabernet sauvignon 50% – Pugnitello 50%,Quaglie alla cacciatora,,,89,nd,nd,,,,,14,1,,Legno 25 mesi,,,,Italy,,,
2,,,,,,,,,,,,,,,,,2023,2017,,Geremia,,,Rocca di Montegrossi,Toscana,,44,Merlot 75% – Cabernet sauvignon 25%,Bocconcini di cinghiale con salsa di prugne,,,82,nd,nd,,,,,14,1,,Legno 25 mesi,,,,Italy,,,
2,,,,,,,,,,,,,,,,,2023,2021,,Maremma Toscana Vermentino Calasole,,,Rocca di Montemassi,Toscana,,12,Vermentino 100%,Zuppa di pesce,,,86,nd,nd,,,,,13,80,,Acciaio 6 mesi,,,"Paglierino scintillante. Al naso è ricco di sfumature, si apre su ricordi di maracuja e pesca bianca seguiti da fragranze di salvia, biancospino ed erbe aromatiche. All’assaggio è saporito, la vena acida s’impone al palato abbracciando la persistenza salina e sfumando in un piacevole finale dai ritorni agrumati.",Italy,,,
2,,,,,,,,,,,,,,,,,2023,2021,,Maremma Toscana Rosato Syrosa,,,Rocca di Montemassi,Toscana,,12,Syrah 60% – Sangiovese 40%,Fiori di zucca ripieni di ricotta e acciughe,,,86,nd,nd,,,,,13,80,,Acciaio 6 mesi,,,,Italy,,,
2,,,,,,,,,,,,,,,,,2023,2019,,Modus Primo,,,Ruffino,Toscana,,50,Merlot 37% – Sangiovese 35% – Cabernet sauvignon 28%,Gulasch di cervo con patate stufate,,,89,nd,nd,,,,,16,20,,Legno 18 mesi,,,"Granato impenetrabile. Bouquet ricco e armonioso, dopo un incipit floreale si delineano nitidamente sciroppo di lampone, vaniglia, burro di cacao e cardamomo. Il gusto è intenso e corposo, con ottimi tannini supportati da freschezza vivace; vanta un importante allungo sapido e speziato.",Italy,,,
2,,,,,,,,,,,,,,,,,2023,2018,,Chianti Classico Gran Selezione Riserva Ducale Oro,,,Ruffino,Toscana,,50,Sangiovese 85% – Merlot 10% – Colorino 5%,Carré di maiale con patate al forno,,,86,nd,nd,,,,,16,20,,Legno 18 mesi,,,,Italy,,,
2,,,,,,,,,,,,,,,,,2023,2018,,Alauda,,,Ruffino,Toscana,,50,Cabernet franc 47% – Merlot 47% – Colorino 6%,Blu di capra,,,86,nd,nd,,,,,16,20,,Legno 18 mesi,,,,Italy,,,
2,,,,,,,,,,,,,,,,,2023,2019,,Modus,,,Ruffino,Toscana,,50,Sangiovese 44% – Cabernet sauvignon 37% – Merlot 19%,Filetto al vino rosso e scalogno,,,86,nd,nd,,,,,16,20,,Legno 18 mesi,,,,Italy,,,
2,,,,,,,,,,,,,,,,,2023,2017,,Brunello Di Montalcino Greppone Mazzi,,,Ruffino,Toscana,,50,Sangiovese 100%,e Legno 30 mesi Piccione al forno con cipollotti,,,86,nd,nd,,,,,16,20,,Legno 18 mesi,,,,Italy,,,
2,,,,,,,,,,,,,,,,,2023,2019,,Vino Nobile Di Montepulciano Vecchie Viti Del Salco,,,Salcheto,Toscana,,65,Prugnolo gentile 100%,Lepre alla cacciatora,,,89,nd,nd,,,,,15,3,,Legno 24 mesi,,,"Rubino pieno e vivace. Al naso effluvi balsamici di tamarindo, semi di cola e tè nero accompagnati da un nucleo fruttato di marasca matura, melagrana e arancia insieme una gradevole pungenza di pepe e grafite. In bocca è pieno, ricco e dinamico, il tannino ancora in evoluzione contribuisce alla lunga persistenza.",Italy,,,
2,,,,,,,,,,,,,,,,,2023,2021,,Rosso Di Montepulciano,,,Salcheto,Toscana,,65,Prugnolo gentile 85% – Canaiolo 8% – Merlot 7%,Ravioli di magro con funghi chiodini,,,86,nd,nd,,,,,15,3,,Legno 24 mesi,,,,Italy,,,
2,,,,,,,,,,,,,,,,,2023,2019,,Vino Nobile Di Montepulciano Riserva,,,Salcheto,Toscana,,65,Prugnolo gentile 100%,Cinghiale in umido,,,86,nd,nd,,,,,15,3,,Legno 24 mesi,,,,Italy,,,
2,,,,,,,,,,,,,,,,,2023,2019,,Vino Nobile Di Montepulciano,,,Salcheto,Toscana,,65,Prugnolo gentile 100%,Manzo brasato con olive e porri,,,86,nd,nd,,,,,15,3,,Legno 24 mesi,,,,Italy,,,
2,,,,,,,,,,,,,,,,,2023,2021,,Chianti Biskero,,,Salcheto,Toscana,,65,Sangiovese 85% – Canaiolo 5% – Mammolo 5% – Merlot 5%,e Legno 4 mesi Lasagnette al ragù di faraona e asparagi,,,82,nd,nd,,,,,15,3,,Legno 24 mesi,,,,Italy,,,
2,,,,,,,,,,,,,,,,,2023,2017,,Brunello Di Montalcino,,,Salvioni - La Cerbaiola,Toscana,,130,Sangiovese 100%,Pernici farcite,,,91,nd,nd,,,,,,9,,Legno 36 mesi,,,"Cremisi splendente con cenni granato. Bouquet ampio e prezioso, note di ciliegia in confettura e lampone, poi viola, timo e tè verde. Sullo sfondo emergono tabacco e chiodi di garofano. Ingresso soffuso, ottima freschezza con tannino estremamente elegante e serico. Riverberi di arancia sanguinella nel finale.",Italy,,,
2,,,,,,,,,,,,,,,,,2023,2020,,Rosso Di Montalcino,,,Salvioni - La Cerbaiola,Toscana,,130,Sangiovese 100%,Pappardelle con funghi porcini,,,89,nd,nd,,,,,,9,,Legno 36 mesi,,,,Italy,,,
2,,,,,,,,,,,,,,,,,2023,2019,,Vernaccia Di San Gimignano Riserva,,,San Benedetto,Toscana,,18,Vernaccia di San Gimignano 100%,Rombo al forno ai sapori mediterranei,,,89,nd,nd,,,,,14,2,,Legno 12 mesi,,,"Giallo paglierino con nuance dorate. Naso pulito e leggibile che richiama limone maturo, scorza arancia candita e anice, poi mandorla e vaniglia. Gusto pieno e progressivo. Vi si trovano sostanza glicerica impreziosita da ritorni di pompelmo maturo e pietra focaia. Sapidità nel lungo finale.",Italy,,,
2,,,,,,,,,,,,,,,,,2023,2019,,Japigo,,,San Benedetto,Toscana,,18,Sangiovese 50% – Cabernet sauvignon 25% – Merlot 25%,Melanzane e peperoni ripieni,,,86,nd,nd,,,,,14,2,,Legno 12 mesi,,,,Italy,,,
2,,,,,,,,,,,,,,,,,2023,2021,,Vernaccia Di San Gimignano,,,San Benedetto,Toscana,,18,Vernaccia di San Gimignano 100%,Torta salata ai broccoli,,,86,nd,nd,,,,,14,2,,Legno 12 mesi,,,,Italy,,,
2,,,,,,,,,,,,,,,,,2023,2021,,Vermentino,,,San Benedetto,Toscana,,18,Vermentino 100%,Risotto ai frutti di mare,,,82,nd,nd,,,,,14,2,,Legno 12 mesi,,,,Italy,,,
2,,,,,,,,,,,,,,,,,2023,2017,,Brunello Di Montalcino,,,San Carlo,Toscana,,37,Sangiovese 100%,Pappardelle con sugo di lepre,,,89,nd,nd,,,,,,6,,Legno 39 mesi,,,"Rubino intenso con riflessi granato. Attacco olfattivo di ciliegia sotto spirito, arancia sanguinella, violetta e pepe nero, che si adagiano su uno sfondo di tabacco e liquirizia. Sorso robusto in virtù della dote glicerica e della tannicità dinamica e vigorosa. Delicatamente fresco e sapido nella persistente chiusura.",Italy,,,
2,,,,,,,,,,,,,,,,,2023,2020,,Rosso Di Montalcino,,,San Carlo,Toscana,,37,Sangiovese 100%,Legno 6 mesi Costolette di maiale alla brace,,,86,nd,nd,,,,,,6,,Legno 39 mesi,,,,Italy,,,
2,,,,,,,,,,,,,,,,,2023,2021,,Ciliegiolo,,,San Ferdinando,Toscana,,11,Ciliegiolo 100%,Beccacce allo spiedo,,,89,nd,nd,,,,,13,10,,Acciaio 5 mesi,,,"Veste porpora lucente. Attacco olfattivo brioso su note caratteriali di amarena fresca, aghi di pino ed erbette nobilitati da sbuffi di incenso. Si presenta disinvolto e succoso al palato, con tannini appena granulosi ma che non tolgono gusto e spessore. Vena rinfrescante e persistente dai ritorni di canfora.",Italy,,,
2,,,,,,,,,,,,,,,,,2023,2019,,Chianti Podere Gamba,,,San Ferdinando,Toscana,,11,Sangiovese 85% – Pugnitello 15%,Tagliata al pepe verde,,,86,nd,nd,,,,,13,10,,Acciaio 5 mesi,,,,Italy,,,
2,,,,,,,,,,,,,,,,,2023,2021,,Ciliegiolo Rosato,,,San Ferdinando,Toscana,,11,Ciliegiolo 100%,Linguine agli scampi,,,86,nd,nd,,,,,13,10,,Acciaio 5 mesi,,,,Italy,,,
2,,,,,,,,,,,,,,,,,2023,2018,,Sangiovese,,,San Ferdinando,Toscana,,11,Sangiovese 100%,Pasta alla Norma,,,86,nd,nd,,,,,13,10,,Acciaio 5 mesi,,,,Italy,,,
2,,,,,,,,,,,,,,,,,2023,2021,,Vermentino,,,San Ferdinando,Toscana,,11,Vermentino 100%,Sushi e sashimi,,,86,nd,nd,,,,,13,10,,Acciaio 5 mesi,,,,Italy,,,
2,,,,,,,,,,,,,,,,,2023,2018,,Percarlo,,,San Giusto a Rentennano,Toscana,,60,Sangiovese 100%,Manzo brasato con funghi,,,91,nd,nd,,,,,15,18,,Legno 22 mesi,,,"Rubino con luccicanti lampi carminio. Lampone, mora di gelso, tabacco essiccato e liquirizia. Effluvi di rosmarino e aghi di pino. Potente nel sorso, con tannini cesellati, che insieme una freschezza agrumata di tamarindo bilanciano la beva. Progressivo l’allungo con echi di rabarbaro sul finale.",Italy,,,
2,,,,,,,,,,,,,,,,,2023,2019,,Chianti Classico Le Baròncole Riserva,,,San Giusto a Rentennano,Toscana,,60,Sangiovese 97% – Canaiolo 3%,Fagiano arrosto,,,89,nd,nd,,,,,15,18,,Legno 22 mesi,,,,Italy,,,
2,,,,,,,,,,,,,,,,,2023,2020,,Chianti Classico,,,San Giusto a Rentennano,Toscana,,60,Sangiovese 95% – Canaiolo 5%,Pappardelle al ragù di cervo,,,86,nd,nd,,,,,15,18,,Legno 22 mesi,,,,Italy,,,
2,,,,,,,,,,,,,,,,,2023,2017,,Brunello Di Montalcino Vignavecchia,,,San Polo,Toscana,,320,Sangiovese 100%,Pappardelle con sugo di capriolo,,,91,nd,nd,,,,,14,3,,Legno 30 mesi,,,"Carminio luminoso di media intensità con riflessi granato. Ammaliante il richiamo odoroso: viola, lavanda, rosmarino, timo, pino, mora e melagrana. Cenni di vaniglia, noce moscata, pepe nero e note empireumatiche. Dinamico in bocca con una decisa freschezza e un tannino tenace. Lungheggia con richiami di ciliegia.",Italy,,,
2,,,,,,,,,,,,,,,,,2023,2017,,Brunello Di Montalcino Podernovi,,,San Polo,Toscana,,320,Sangiovese 100%,Capriolo con salsa di ribes rosso,,,89,nd,nd,,,,,14,3,,Legno 30 mesi,,,,Italy,,,
2,,,,,,,,,,,,,,,,,2023,2017,,Brunello Di Montalcino,,,San Polo,Toscana,,320,Sangiovese 100%,Stracotto d’asino,,,86,nd,nd,,,,,14,3,,Legno 30 mesi,,,,Italy,,,
2,,,,,,,,,,,,,,,,,2023,2020,,Rosso Di Montalcino,,,San Polo,Toscana,,320,Sangiovese 100%,Pappardelle al ragù di cinghiale,,,82,nd,nd,,,,,14,3,,Legno 30 mesi,,,,Italy,,,
2,,,,,,,,,,,,,,,,,2023,2020,,Rubio,,,San Polo,Toscana,,320,Sangiovese 100%,"Minestra di riso, patate, porri, sedano e speck",,,82,nd,nd,,,,,14,3,,Legno 30 mesi,,,,Italy,,,
2,,,,,,,,,,,,,,,,,2023,2016,,Brunello Di Montalcino Bramante Riserva,,,Sanlorenzo,Toscana,,100,Sangiovese 100%,Filetto di vitello alla Rossini,,,91,nd,nd,,,,,,2,,Acciaio 6 mesi e,,,"Legno 48 mesi Carminio luminoso. Variopinta tavolozza di giaggiolo e amarena matura, arricchita da chiodi di garofano, garriga, tabacco e pirite. Il sorso si contraddistingue per il carattere signorile del tannino, coadiuvato dalla spalla acida bilanciare un calore alcolico, presente ma mai eccessivo. Persistenza da manuale.",Italy,,,
2,,,,,,,,,,,,,,,,,2023,2017,,Brunello Di Montalcino,,,Sanlorenzo,Toscana,,100,Sangiovese 100%,Legno 36 mesi Cinghiale in umido,,,89,nd,nd,,,,,,2,,Acciaio 6 mesi e,,,,Italy,,,
2,,,,,,,,,,,,,,,,,2023,2020,,Rosso Di Montalcino,,,Sanlorenzo,Toscana,,100,Sangiovese 100%,Legno 12 mesi Rigatoni al ragù bianco di carne,,,86,nd,nd,,,,,,2,,Acciaio 6 mesi e,,,,Italy,,,
2,,,,,,,,,,,,,,,,,2023,2021,,Rosato,,,Sanlorenzo,Toscana,,100,Sangiovese 100%,Crostini al lardo di Colonnata,,,86,nd,nd,,,,,,2,,Acciaio 6 mesi e,,,,Italy,,,
2,,,,,,,,,,,,,,,,,2023,2020,,L’Etrange,,,Sant’Agnese,Toscana,,22,Vermentino 100%,Sarde in saor,,,91,nd,nd,,,,,14,2,,Legno 24 mesi,,,"Paglierino solare. Attacco di susina mirabelle, stevia e zenzero, poi l’olfatto si espande su ricordi di mango, frutto della passione e foglia di tè, chiudendo con effluvi di miele di millefiori. In bocca primeggia la freschezza della frutta esotica, protagonista fino al piacevole allungo di caramella d’orzo.",Italy,,,
2,,,,,,,,,,,,,,,,,2023,2017,,I Fiori Blu,,,Sant’Agnese,Toscana,,22,Cabernet sauvignon 100%,Stufato di daino,,,89,nd,nd,,,,,14,2,,Legno 24 mesi,,,,Italy,,,
2,,,,,,,,,,,,,,,,,2023,2021,,A Rose Is A Rose,,,Sant’Agnese,Toscana,,22,Merlot 100%,Tartare di gamberi,,,86,nd,nd,,,,,14,2,,Legno 24 mesi,,,,Italy,,,
2,,,,,,,,,,,,,,,,,2023,2020,,Ubu Rua’,,,Sant’Agnese,Toscana,,22,Merlot 100%,Salame di cinta senese,,,86,nd,nd,,,,,14,2,,Legno 24 mesi,,,,Italy,,,
2,,,,,,,,,,,,,,,,,2023,2021,,Vermentino Kalendamaia,,,Sant’Agnese,Toscana,,22,Vermentino 100%,Crostini con burro e alici,,,86,nd,nd,,,,,14,2,,Legno 24 mesi,,,,Italy,,,
2,,,,,,,,,,,,,,,,,2023,2019,,Maremma Toscana Ciliegiolo San Lorenzo,,,Sassotondo,Toscana,,35,Ciliegiolo 100%,Bocconcini di cinghiale con salsa di prugne,,,91,nd,nd,,,,,13,3,,Legno 24 mesi,,,"Rubino intenso e luminoso. Apre con profumi di confettura di frutti di bosco, prugna fresca e ciclamino, proseguendo su ricordi di olive al forno, pepe nero, peperone crusco e caffè, con note finali di carruba. Sorso rigoglioso di tannini fruttati e freschezza. Chiusura lunga e saporita, di angostura e salsa di soia.",Italy,,,
2,,,,,,,,,,,,,,,,,2023,2017,,Bianco Di Pitigliano Superiore Isolina 5 Anni In Bottiglia,,,Sassotondo,Toscana,,35,Trebbiano 70% – Sauvignon 20% – Greco 10%,Vellutata di ceci con gamberi croccanti,,,89,nd,nd,,,,,13,3,,Legno 24 mesi,,,,Italy,,,
2,,,,,,,,,,,,,,,,,2023,2020,,Monte Rosso,,,Sassotondo,Toscana,,35,Nocchianello nero 100%,Pasta e fagioli,,,89,nd,nd,,,,,13,3,,Legno 24 mesi,,,,Italy,,,
2,,,,,,,,,,,,,,,,,2023,2020,,Maremma Toscana Ciliegiolo Poggio Pinzo,,,Sassotondo,Toscana,,35,Ciliegiolo 100%,Risotto alla parmigiana,,,86,nd,nd,,,,,13,3,,Legno 24 mesi,,,,Italy,,,
2,,,,,,,,,,,,,,,,,2023,2020,,Numero Sei,,,Sassotondo,Toscana,,35,Sauvignon 34% – Greco 33% – Viognier 33%,Pappardelle con coda di rospo e carciofi,,,86,nd,nd,,,,,13,3,,Legno 24 mesi,,,,Italy,,,
2,,,,,,,,,,,,,,,,,2023,2019,,Bolgheri Superiore Marianova,,,Michele Satta,Toscana,,170,Sangiovese 50% – Syrah 50%,Stinco di maiale al forno in pancetta affumicata,,,91,nd,nd,,,,,14,3,,Legno 18 mesi,,,"Rubino luminoso. Debutto elegante di ciliegia e ribes nero in confettura, pirite, santoreggia, poi muschio, menta, maggiorana, pepe di Sichuan, incenso, arancia sanguinella. Al palato il raffinato tannino e la dinamica freschezza tracciano i connotati di una struttura saporita e persistente, dal finale agrumato.",Italy,,,
2,,,,,,,,,,,,,,,,,2023,2019,,Cavaliere,,,Michele Satta,Toscana,,170,Sangiovese 100%,Pappardelle al ragù di cervo,,,89,nd,nd,,,,,14,3,,Legno 18 mesi,,,,Italy,,,
2,,,,,,,,,,,,,,,,,2023,2019,,Bolgheri Superiore Piastraia,,,Michele Satta,Toscana,,170,Cabernet 40% – Merlot 30% – Sangiovese 20% – Syrah 10%,Petto di germano reale al balsamico,,,86,nd,nd,,,,,14,3,,Legno 18 mesi,,,,Italy,,,
2,,,,,,,,,,,,,,,,,2023,2020,,Giovin Re,,,Michele Satta,Toscana,,170,Viognier 100%,,,,86,nd,nd,,,,,14,3,,Legno 18 mesi,,,,Italy,,,
2,,,,,,,,,,,,,,,,,2023,2020,,Bolgheri Rosso,,,Michele Satta,Toscana,,170,Cabernet 30% – Sangiovese 30% – Merlot 20% – Syrah 10% –,Porchetta di Ariccia,,,86,nd,nd,,,,,14,3,,Legno 18 mesi,,,,Italy,,,
2,,,,,,,,,,,,,,,,,2023,2019,,Collegonzi,,,Sensi,Toscana,,19,Sangiovese 100%,Fiorentina alla brace,,,86,nd,nd,,,,,15,8,,Acciaio 8 mesi e,,,"Legno 14 mesi Rubino di attraente luminosità. Ventaglio olfattivo di sciroppo di amarene, granatina, arancia sanguinella, viola, propoli, pepe di Timut e scatola di sigari. Ingresso gustativo opulento, rotondo e caldo. Il sorso scorre sulla tannicità dinamica e sulla rinfrescante acidità agrumata. Finale ancora caldo e persistente.",Italy,,,
2,,,,,,,,,,,,,,,,,2023,2019,,Lungarno,,,Sensi,Toscana,,19,Cabernet sauvignon 60% – Merlot 30% – Colorino 10%,,,,86,nd,nd,,,,,15,8,,Acciaio 8 mesi e,,,,Italy,,,
2,,,,,,,,,,,,,,,,,2023,2019,,Bolgheri Rosso Sabbiato,,,Sensi,Toscana,,19,Cabernet 60% – Merlot 30% – Sangiovese 10%,Legno 12 mesi Cinghiale in umido,,,86,nd,nd,,,,,15,8,,Acciaio 8 mesi e,,,,Italy,,,
