Entry,Ref,OLDRS,RANK,RS,RAWQP,QPRANK,QP,RANK2,RS2,RAWQP2,QP2,RANK3,RS3,RAWQP3,QP3,RawAvg,RatingYear,Vintage,Qterms,FullName,AppellationLevel,AppellationName,WineryName,Region,EvaluationAvg,Price,Grapes,Pairing,ScoreAvg,EvaluationAIS,ScoreAIS,EvaluationGR,ScoreGR,SLC,TLC,WineTypeIT,WineType,Alcohol,Bottles,AgingMonths,AgingTypeIT,AgingType,Notes,Tasting Notes,Country,VintageNV,Method,Sweetness
2,,,,,,,,,,,,,,,,,2022,2017,,Franciacorta Brut Satèn Millesimato Ziliani C,,,Cantina Chiara Ziliani,Lombardia,,19,Chardonnay 65% – Pinot nero 35%,Piatti di pesce,,,,nd,nd,,,,,"12,5%",2,Acciaio 6 mesi | 31 mesi sui lieviti,,,,,Italy,,,
2,,,,,,,,,,,,,,,,,2022,2019,,Citari San Martino Della Battaglia Vecchio Vigneto,,,Citari,Lombardia,,19,Chardonnay 100%,,,,,nd,nd,,,,,"12,5%",10,Acciaio 6 mesi e Legno 6 mesi | 31 mesi sui lieviti,,,,abbinamento Piatti di verdure ettari 30  bottiglie 350.000 produzione olearia No proprietà Giovanna Gettuli conduzione enologica Emiliano Rossi conduzione agronomica Staff aziendale vendita diretta Sì  visita in azienda Sì,Italy,,,
2,,,,,,,,,,,,,,,,,2022,2020,,Riviera Del Garda Classico Chiaretto 18 E Quarantacinque,,,Citari,Lombardia,,18,Tocai friulano 100%,Bouillabaisse.,,,,nd,nd,,,,,13%,4,Acciaio 3 mesi,,,,"Screziature verdoline ingentiliscono il paglierino. Vigorose folate di mela renetta, ananas, mandarino e pera unite a fiori di sambuco  e  biancospino,  salvia  e  menta  piperita.  Accenti  minerali d'ardesia nel finale. Spiccata la sapidità, ben bilanciata da calore e freschezza.",Italy,,,
2,,,,,,,,,,,,,,,,,2022,2020,,Lugana Torre,,,Citari,Lombardia,,12,,Primi piatti di pasta o pasta fresca ripiena,,,,nd,nd,,,,,"12,5%",20,Acciaio 3 mesi,,,,,Italy,,,
2,,,,,,,,,,,,,,,,,2022,2019,,Eretico,,,Citari,Lombardia,,14,Trebbiano di Lugana 100%,Carni bianche o da cortile,,,,nd,nd,,,,,13%,10,Acciaio 6 mesi,,,,,Italy,,,
2,,,,,,,,,,,,,,,,,2022,2020,,Lugana Conchiglia,,,Citari,Lombardia,,16,Trebbiano di Lugana 100%,Piatti di pesce,,,,nd,nd,,,,,13%,20,Acciaio 6 mesi,,,,,Italy,,,
2,,,,,,,,,,,,,,,,,2022,2022,,L,,,Citari,Lombardia,,12,Trebbiano di Lugana 100%,Piatti di verdure o m b a r d i a,,,,nd,nd,,,,,13%,40,Acciaio 6 mesi,,,,,Italy,,,
2,,,,,,,,,,,,,,,,,2022,2016,,Club Del Buttafuoco Storico (91)  Buttafuoco Storico Collezione 25 Anni,,,Club Del Buttafuoco,Lombardia,,,,,,,,nd,nd,,,,,,,,,,,,Italy,,,
2,,,,,,,,,,,,,,,,,2022,2020,,Cobue Lugana Monte Lupo,,,Cobue,Lombardia,,100,,"ettari 16,5  bottiglie 90.000 produzione olearia Sì proprietà Laura Gettuli conduzione enologica Emiliano Rossi conduzione agronomica Massimiliano Perazzoli vendita diretta Sì  visita in azienda Sì",,,,nd,nd,,,,,"15,5%",750,Acciaio 6 mesi e Legno 18 mesi,,,,"Rubino lucente. Percezioni balsamiche e lievemente salmastre aprono a piccoli frutti rossi e neri, sbuffi speziati di pepe e noce moscata, e tratti mentolati. La freschezza rende dinamico il sorso, dotato sia di un tannino rotondo che di morbidezza. Cotoletta di manzo con salsa di fichi e menta.",Italy,,,
2,,,,,,,,,,,,,,,,,2022,2019,,Lugana Vendemmia Tardiva 31 Ottobre,,,Cobue,Lombardia,,16,Trebbiano di Lugana 100%,Ravioli di magro burro e salvia.,,,,nd,nd,,,,,13%,26,Acciaio 4 mesi,,,,"Giallo paglierino. Naso gessoso, quasi salino, che si arricchisce con  riconoscimenti  di  salvia  e  maggiorana,  sfumature  di  mela gialla e pesca bianca. Menta e pompelmo introducono all'assaggio che, ben corroborato da freschezza e sapidità, ritrova la parte agrumata in un epilogo terso.",Italy,,,
2,,,,,,,,,,,,,,,,,2022,2020,,Riviera Del Garda Classico Chiaretto 29 Agosto,,,Cobue,Lombardia,,33,Trebbiano di Lugana 100%,"Pasticceria secca, torte o cioccolato",,,,nd,nd,,,,,"12,5%",2,Acciaio 12 mesi,,,,,Italy,,,
2,,,,,,,,,,,,,,,,,2022,2019,,San Martino Della Battaglia Monte Olivi,,,Cobue,Lombardia,,17,,Piatti di pesce,,,,nd,nd,,,,,13%,3,Acciaio 4 mesi,,,,,Italy,,,
2,,,,,,,,,,,,,,,,,2022,2019,,Riviera Del Garda Classico Rosso Il Poggio,,,Cobue,Lombardia,,18,Tocai friulano 100%,Risotti di pesce,,,,nd,nd,,,,,13%,13,Acciaio 6 mesi,,,,,Italy,,,
2,,,,,,,,,,,,,,,,,2022,2022,,Albis Dosaggio Zero,,,Cobue,Lombardia,,15,,Piatti di pesce,,,,nd,nd,,,,,13%,7,Acciaio 6 mesi,,,,,Italy,,,
2,,,,,,,,,,,,,,,,,2022,2017,,Cola Battista Franciacorta Brut Satèn,,,Cola Battista,Lombardia,,27,Groppello 100%,,,,,nd,nd,,,,,"12,5%",5,Acciaio 6 mesi | 24 mesi sui lieviti,,,,abbinamento Piatti di verdure ettari 8  bottiglie 50.000 produzione olearia No proprietà Battista Cola conduzione enologica Andrea Rudelli conduzione agronomica Staff aziendale vendita diretta No  visita in azienda Sì,Italy,,,
2,,,,,,,,,,,,,,,,,2022,2016,,Franciacorta Brut Millesimato,,,Cola Battista,Lombardia,,23,Chardonnay 100%,Tartine al salmone.,,,,nd,nd,,,,,"12,5%",8,Acciaio 6 mesi e Legno 6 mesi | 36 mesi sui lieviti,,,,"Sfoggia  un  perlage  sottile,  persistente;  complesso  il  bouquet  di caprifoglio,  giunchiglia,  nettarina  bianca,  mela,  pera,  vaniglia, cioccolato bianco e pan brioche. Di ineccepibile coerenza al gusto, rivela soave freschezza e delicata sapidità.",Italy,,,
2,,,,,,,,,,,,,,,,,2022,2017,,Franciacorta Brut Rosé Athena,,,Cola Battista,Lombardia,,23,Chardonnay 100%,Risotti di terra,,,,nd,nd,,,,,"12,5%",3,Acciaio 6 mesi e Legno 6 mesi | 48 mesi sui lieviti,,,,,Italy,,,
2,,,,,,,,,,,,,,,,,2022,2015,,Franciacorta Dosaggio Zero Millesimato,,,Cola Battista,Lombardia,,23,Chardonnay 50% – Pinot nero 50%,,,,,nd,nd,,,,,"12,5%",3,Acciaio,,,,"6 mesi e Legno 6 mesi | 39 mesi sui lieviti abbinamento Crostacei, molluschi o crudità",Italy,,,
2,,,,,,,,,,,,,,,,,2022,2018,,Conte Vistarino L (91)  Pinot Nero Dell'Oltrepò Pavese Bertone,,,Conte Vistarino,Lombardia,,23,Chardonnay 100%,,,,,nd,nd,,,,,"12,5%",3,Acciaio 6 mesi e Legno 6 mesi | 55 mesi sui lieviti,,,,"abbinamento Primi piatti di pasta o pasta fresca ripiena o m b a r d i a ettari 200  bottiglie 300.000 produzione olearia No proprietà Ottavia Giorgi di Vistarino conduzione enologica Vittorio Merlo, Giuseppe Caviola conduzione agronomica Marco Cau vendita diretta Sì  visita in azienda Sì",Italy,,,
2,,,,,,,,,,,,,,,,,2022,2018,,Pinot Nero Dell'Oltrepò Pavese Pernice,,,Conte Vistarino,Lombardia,,33,Pinot nero 100%,Agnolotti di stufato di manzo.,,,,nd,nd,,,,,"13,5%",5,Legno 12 mesi,,,,"Lucente manto rubino dai riflessi granato, di buona consistenza. Il ventaglio odoroso è ricco di viole, ribes, ciliegie duracine,  su  una  base  di  caffè,  eucalipto  e  pepe.  La  beva  è  succosa, delicatamente sapida, con un tannino levigato, finemente equilibrato. Lascia un'indimenticabile scia speziata.",Italy,,,
2,,,,,,,,,,,,,,,,,2022,2022,,Cépage Brut,,,Conte Vistarino,Lombardia,,40,Pinot nero 100%,Carni rosse o selvaggina,,,,nd,nd,,,,,"13,5%",6,Legno 12 mesi,,,,,Italy,,,
2,,,,,,,,,,,,,,,,,2022,2018,,Pinot Nero Dell'Oltrepò Pavese Tavernetto,,,Conte Vistarino,Lombardia,,18,Pinot nero 80% – Chardonnay 20%,Piatti di pesce,,,,nd,nd,,,,,13%,6,Acciaio 6 mesi | 30 mesi sui lieviti,,,,,Italy,,,
2,,,,,,,,,,,,,,,,,2022,2022,,Oltrepò Pavese Metodo Classico Brut Rosé Saignée Della Rocca,,,Conte Vistarino,Lombardia,,24,Pinot nero 100%,Carni rosse o selvaggina,,,,nd,nd,,,,,"13,5%",5,Legno 12 mesi,,,,,Italy,,,
2,,,,,,,,,,,,,,,,,2022,2022,,Costaripa Mattia Vezzola Brut Rosé,,,Costaripa,Lombardia,,21,Pinot nero 100%,,,,,nd,nd,,,,,"12,5%",5,Acciaio 6 mesi | 30 mesi sui lieviti,,,,"abbinamento Crostacei, molluschi o crudità ettari 65  bottiglie 480.000 produzione olearia Sì proprietà Mattia Vezzola conduzione enologica Mattia Vezzola conduzione agronomica Staff aziendale vendita diretta Sì  visita in azienda Sì",Italy,,,
2,,,,,,,,,,,,,,,,,2022,2020,,Valtènesi Riviera Del Garda Classico Rosamara,,,Costaripa,Lombardia,,20,,Ventresca di tonno al sesamo.,,,,nd,nd,,,,,"12,5%",80,Acciaio,,,,"6 mesi e Legno 6 mesi | 24 mesi sui lieviti Sofisticato rosa tenue, impreziosito da un perlage copioso e raffinato. All’olfatto, immediati toni di pesca bianca, albicocca, ciliegia e pompelmo anticipano nuance di salvia, pasta di mandorla e rosa. Di corpo, l’assaggio è dinamico e in perfetto equilibrio tra freschezza e sapidità.",Italy,,,
2,,,,,,,,,,,,,,,,,2022,2022,,Garda Spumante Brut Crémant Mattia Vezzola,,,Costaripa,Lombardia,,15,,Risotti di terra,,,,nd,nd,,,,,13%,160,Acciaio 6 mesi e Legno 6 mesi,,,,,Italy,,,
2,,,,,,,,,,,,,,,,,2022,2017,,Valtènesi Riviera Del Garda Classico Campostarne,,,Costaripa,Lombardia,,20,,,,,,nd,nd,,,,,"12,5%",30,,,,,Acciaio 6 mesi e Legno 6 mesi | 24 mesi sui lieviti abbinamento Primi piatti di pasta o pasta fresca ripiena,Italy,,,
2,,,,,,,,,,,,,,,,,2022,2017,,Valtènesi Riviera Del Garda Classico Chiaretto Molmenti,,,Costaripa,Lombardia,,15,,Carni bianche o da cortile,,,,nd,nd,,,,,13%,6,Legno 12 mesi,,,,,Italy,,,
2,,,,,,,,,,,,,,,,,2022,2017,,"De Toma (91,5)  Moscato Di Scanzo",,,De Toma,Lombardia,,,,,,,,nd,nd,,,,,,,,,,,,Italy,,,
2,,,,,,,,,,,,,,,,,2022,2022,,Cardinale,,,De Toma,Lombardia,,55,Moscato di Scanzo 100%,Praline di cioccolato fondente.,,,,nd,nd,,,,,15%,5,Acciaio 24 mesi,,,,"Granato fitto e lucente. Un caleidoscopio olfattivo di straordinaria complessità e finezza prelude all’estasi del sorso, dove la dolcezza cede all'acidità e all’eleganza. La persistenza è un lungo viaggio tra frutti, spezie, legni aromatici e note fumé.",Italy,,,
2,,,,,,,,,,,,,,,,,2022,2022,,Franciacorta Extra Brut Blanc De Blancs,,,De Toma,Lombardia,,28,,Carni rosse o selvaggina,,,,nd,nd,,,,,13%,2,Acciaio 24 mesi e Legno 6 mesi,,,,,Italy,,,
2,,,,,,,,,,,,,,,,,2022,2009,,Derbusco Cives (93)  Franciacorta Pas Dosé Decem Annis Riserva,,,Derbusco Cives,Lombardia,,35,Chardonnay 100%,,,,,nd,nd,,,,,"12,5%",2,,,,,,Italy,,,
2,,,,,,,,,,,,,,,,,2022,2015,,"(92,5)  Franciacorta Brut Blanc De Noir Crisalis",,,Derbusco Cives,Lombardia,,85,Pinot nero 100%,,,,,nd,nd,,,,,12%,1,,,,,,Italy,,,
2,,,,,,,,,,,,,,,,,2022,2014,,Franciacorta Brut Le Millesime,,,Derbusco Cives,Lombardia,,37,Pinot nero 100%,,,,,nd,nd,,,,,12%,4,,,,,,Italy,,,
2,,,,,,,,,,,,,,,,,2022,2015,,Franciacorta Brut Rosé,,,Derbusco Cives,Lombardia,,31,Chardonnay 80% – Pinot nero 20%,,,,,nd,nd,,,,,12%,10,,,,,,Italy,,,
2,,,,,,,,,,,,,,,,,2022,2014,,Franciacorta Extra Brut Grande Taille,,,Derbusco Cives,Lombardia,,38,Pinot nero 100%,,,,,nd,nd,,,,,12%,9,,,,,,Italy,,,
2,,,,,,,,,,,,,,,,,2022,2022,,Franciacorta Brut Doppio Erre Di,,,Derbusco Cives,Lombardia,,39,Chardonnay 55% – Pinot nero 45%,,,,,nd,nd,,,,,12%,8,,,,,,Italy,,,
2,,,,,,,,,,,,,,,,,2022,2022,,Enrico Gatti Franciacorta Brut Nature,,,Enrico Gatti,Lombardia,,25,Chardonnay 85% – Pinot nero 15%,,,,,nd,nd,,,,,12%,40,,,,,,Italy,,,
2,,,,,,,,,,,,,,,,,2022,2022,,Franciacorta Brut Rosé,,,Enrico Gatti,Lombardia,,25,Chardonnay 85% – Pinot nero 15%,Pizza fritta ricotta e pomodoro.,,,,nd,nd,,,,,"12,5%",19,Acciaio 6 mesi | 24 mesi sui lieviti,,,,"Paglierino chiaro contornato da esuberante effervescenza. Profumi di gelso e glicine avvolti da sensazioni di panetteria e orzo. Bocca di grande impatto, capace di mantenere un notevole equilibrio tra la morbidezza e la freschezza esaltata dall'ottima effervescenza.",Italy,,,
2,,,,,,,,,,,,,,,,,2022,2017,,Franciacorta Brut Satèn,,,Enrico Gatti,Lombardia,,27,Pinot nero 100%,Primi piatti di pasta o pasta fresca ripiena,,,,nd,nd,,,,,"12,5%",8,Acciaio 6 mesi | 21 mesi sui lieviti,,,,,Italy,,,
2,,,,,,,,,,,,,,,,,2022,2022,,Franciacorta Brut,,,Enrico Gatti,Lombardia,,30,Chardonnay 100%,36 mesi sui lieviti  Piatti di verdure,,,,nd,nd,,,,,"12,5%",19,Acciaio 6 mesi e Legno 6 mesi,,,,,Italy,,,
2,,,,,,,,,,,,,,,,,2022,2022,,L,,,Enrico Gatti,Lombardia,,22,Chardonnay 100%,"Crostacei, molluschi o crudità o m b a r d i a",,,,nd,nd,,,,,"12,5%",66,Acciaio 6 mesi | 24 mesi sui lieviti,,,,,Italy,,,
2,,,,,,,,,,,,,,,,,2022,2011,,Faccoli (92)  Franciacorta Extra Brut Riserva,,,Faccoli,Lombardia,,,,,,,,nd,nd,,,,,,,,,,,,Italy,,,
2,,,,,,,,,,,,,,,,,2022,2022,,Franciacorta Extra Brut,,,Faccoli,Lombardia,,65,,,,,,nd,nd,,,,,"12,5%",900,,,,,,Italy,,,
2,,,,,,,,,,,,,,,,,2022,2015,,Franciacorta Extra Brut Zerotre,,,Faccoli,Lombardia,,25,,,,,,nd,nd,,,,,"12,5%",22,,,,,,Italy,,,
2,,,,,,,,,,,,,,,,,2022,2022,,Franciacorta Brut Rosé,,,Faccoli,Lombardia,,35,,,,,,nd,nd,,,,,"12,5%",3,,,,,,Italy,,,
2,,,,,,,,,,,,,,,,,2022,2018,,Fay (91)  Valtellina Superiore Valgella Cà Moréi,,,Fay,Lombardia,,25,,,,,,nd,nd,,,,,"12,5%",10,,,,,,Italy,,,
2,,,,,,,,,,,,,,,,,2022,2017,,Valtellina Superiore Valgella Carterìa Riserva,,,Fay,Lombardia,,28,Nebbiolo 100%,Maiale  con  salsa  ai frutti di bosco e aceto balsamico.,,,,nd,nd,,,,,"14,5%",12,Legno 12 mesi,,,,"Rubino  compatto  dalle  striature  granato.  La  prime  suggestioni sono dominate da ribes e lamponi su sfondo di rose e viole, poi si  rivelano  nuance  di  noce  moscata,  legno  di  sandalo  e  cacao. Scorre pulito, fresco, sapido, con un tannino ancora giovane ma gentile,  preludio  di  una  buona  evoluzione.",Italy,,,
2,,,,,,,,,,,,,,,,,2022,2018,,Valtellina Superiore Sassella Il Glicine,,,Fay,Lombardia,,32,Nebbiolo 100%,Carni rosse o selvaggina,,,,nd,nd,,,,,"13,5%",11,Legno 12 mesi,,,,,Italy,,,
2,,,,,,,,,,,,,,,,,2022,2018,,Valtellina Superiore Valgella Costa Bassa,,,Fay,Lombardia,,28,Nebbiolo 100%,Primi piatti di pasta o pasta fresca ripiena,,,,nd,nd,,,,,14%,7,Legno 12 mesi,,,,,Italy,,,
2,,,,,,,,,,,,,,,,,2022,2022,,Fejoia Bianco Elisa,,,Fejoia,Lombardia,,20,Nebbiolo 100%,,,,,nd,nd,,,,,14%,26,Legno 12 mesi,,,,abbinamento Carni bianche o da cortile ettari 2  bottiglie 4.000 produzione olearia No proprietà Stefano Locatelli conduzione enologica Roberto Ravelli conduzione agronomica Roberto Ravelli vendita diretta No  visita in azienda Sì,Italy,,,
2,,,,,,,,,,,,,,,,,2022,2013,,Moscato Di Scanzo,,,Fejoia,Lombardia,,29,Malvasia 100%,Strachitunt.,,,,nd,nd,,,,,15%,1,Acciaio 24 mesi,,,,"Splendente  giallo  ambrato,  luminoso  e  accattivante.  Al  naso spinte agrumate, di frutta secca, noce e nocciola in particolare, e di miele evolvono verso memorie di cannella e cenni di zafferano e camomilla. La freschezza ben strutturata sostiene un sorso dolce e di corpo.",Italy,,,
2,,,,,,,,,,,,,,,,,2022,2017,,Ferghettina L Franciacorta Brut Rosé,,,Ferghettina,Lombardia,,45,Moscato di Scanzo 100%,"Pasticceria secca, torte o cioccolato o m b a r d i a",,,,nd,nd,,,,,14%,1,Acciaio 36 mesi,,,,,Italy,,,
2,,,,,,,,,,,,,,,,,2022,2013,,Franciacorta Extra Brut Eronero,,,Ferghettina,Lombardia,,35,Pinot nero 100%,,,,,nd,nd,,,,,"12,5%",55,,,,,,Italy,,,
2,,,,,,,,,,,,,,,,,2022,2013,,Franciacorta Pas Dosé Riserva 33,,,Ferghettina,Lombardia,,40,Pinot nero 100%,,,,,nd,nd,,,,,"12,5%",5,,,,,,Italy,,,
2,,,,,,,,,,,,,,,,,2022,2022,,Franciacorta Brut,,,Ferghettina,Lombardia,,40,Chardonnay 100%,,,,,nd,nd,,,,,"12,5%",4,,,,,,Italy,,,
2,,,,,,,,,,,,,,,,,2022,2017,,Franciacorta Brut Satèn,,,Ferghettina,Lombardia,,23,Chardonnay 85% – Pinot nero 15%,,,,,nd,nd,,,,,"12,5%",290,,,,,,Italy,,,
2,,,,,,,,,,,,,,,,,2022,2017,,"Fiamberti (91,5)  Buttafuoco Storico Vigna Sacca Del Prete",,,Fiamberti,Lombardia,,30,Chardonnay 100%,,,,,nd,nd,,,,,"12,5%",75,,,,,,Italy,,,
2,,,,,,,,,,,,,,,,,2022,2020,,Sangue Di Giuda Lella,,,Fiamberti,Lombardia,,26,,Cinghiale alla cacciatora.,,,,nd,nd,,,,,"15,5%",3,Legno 24 mesi,,,,"more, prugna, cioccolato, tabacco, poi noce moscata, chiodi di garofano e intarsi balsamici delineano un profilo caratteristico, che invoglia alla beva. Il tannino è carnoso, la struttura avvolgente. Fresco, equilibrato e persistente.",Italy,,,
2,,,,,,,,,,,,,,,,,2022,2017,,Buttafuoco Storico Vigna Solenga,,,Fiamberti,Lombardia,,10,,Dolci al cucchiaio o a base di frutta,,,,nd,nd,,,,,"7,5%",8,Acciaio 4 mesi,,,,,Italy,,,
2,,,,,,,,,,,,,,,,,2022,2022,,Oltrepò Pavese Metodo Classico Pinot Nero Brut Rosé Caristoro,,,Fiamberti,Lombardia,,39,,Primi piatti di pasta o pasta fresca ripiena,,,,nd,nd,,,,,"15,5%",1,Legno 24 mesi,,,,,Italy,,,
2,,,,,,,,,,,,,,,,,2022,2019,,Buttafuoco Il Cacciatore,,,Fiamberti,Lombardia,,22,Pinot nero 100%,,,,,nd,nd,,,,,"12,5%",2,,,,,,Italy,,,
2,,,,,,,,,,,,,,,,,2022,2020,,Bonarda Dell'Oltrepò Pavese Frizzante La Briccona,,,Fiamberti,Lombardia,,14,,Carni rosse o selvaggina,,,,nd,nd,,,,,14%,12,Legno 24 mesi,,,,,Italy,,,
2,,,,,,,,,,,,,,,,,2022,2014,,Fratelli Campagnari Campagnari Brut Millesimato,,,Fratelli Campagnari,Lombardia,,10,Croatina 100%,,,,,nd,nd,,,,,13%,8,Acciaio 3 mesi,,,,"abbinamento Salumi o insaccati ettari 9,5  bottiglie 40.000 produzione olearia No proprietà Maria Campagnari conduzione enologica Michele Campagnari, Maria Campagnari conduzione agronomica Michele Campagnari, Maria Campagnari vendita diretta Sì  visita in azienda Sì",Italy,,,
2,,,,,,,,,,,,,,,,,2022,2022,,Campagnari Brut Elegant,,,Fratelli Campagnari,Lombardia,,20,,Ali di pollo con sal- sa al curry.,,,,nd,nd,,,,,"12,5%",5,Acciaio 8 mesi | 60 mesi sui lieviti,,,,"Paglierino  con  nuance  oro.  Esordio  su  note  di  panificazione  e pasticceria, seguono i frutti tropicali, papaia e ananas, e infine un intreccio di fiori bianchi, mandorle e fieno. Fresco, con ritorni di erbe aromatiche e un epilogo bilanciato.",Italy,,,
2,,,,,,,,,,,,,,,,,2022,2022,,Campagnari Brut Rosé,,,Fratelli Campagnari,Lombardia,,15,,Piatti di pesce,,,,nd,nd,,,,,"12,5%",5,Acciaio 8 mesi | 36 mesi sui lieviti,,,,,Italy,,,
2,,,,,,,,,,,,,,,,,2022,2022,,Campagnari Brut Extreme,,,Fratelli Campagnari,Lombardia,,18,Pinot nero 80% – Pinot bianco 20%,"Crostacei, molluschi o crudità",,,,nd,nd,,,,,"12,5%",5,Acciaio 8 mesi | 36 mesi sui lieviti,,,,,Italy,,,
2,,,,,,,,,,,,,,,,,2022,2017,,Frecciarossa Pinot Nero Dell'Oltrepò Pavese Giorgio Odero,,,Frecciarossa,Lombardia,,30,,Formaggi stagionati o erborinati,,,,nd,nd,,,,,"12,5%",5,Acciaio 8 mesi | 120 mesi sui lieviti,,,,,Italy,,,
2,,,,,,,,,,,,,,,,,2022,2019,,Oltrepò Pavese Riesling Gli Orti,,,Frecciarossa,Lombardia,,35,Pinot nero 100%,Arrosto di vitello con cipol- line borretane glassate.,,,,nd,nd,,,,,14%,8,Acciaio 6 mesi e Legno 12 mesi,,,,"Seducente rubino dai riflessi granato. Superba l'apertura: un intreccio di fresia, piccoli frutti rossi, clementina e ciliegia anticipa mentuccia, aghi di pino, spezie dolci e pepe rosa. In bocca è lungo  e  slanciato,  con  tannini  vellutati  e  una  spinta  fresco-sapida che bilancia la morbidezza del sorso.",Italy,,,
2,,,,,,,,,,,,,,,,,2022,2018,,Metodo Classico Extra Brut Rosato,,,Frecciarossa,Lombardia,,15,Riesling renano 100%,Piatti di pesce,,,,nd,nd,,,,,13%,3,Acciaio 12 mesi,,,,,Italy,,,
2,,,,,,,,,,,,,,,,,2022,2018,,Metodo Classico Extra Brut,,,Frecciarossa,Lombardia,,20,Pinot nero 100%,"Crostacei, molluschi o crudità",,,,nd,nd,,,,,"12,5%",10,Acciaio 6 mesi | 18 mesi sui lieviti,,,,,Italy,,,
2,,,,,,,,,,,,,,,,,2022,2018,,Oltrepò Pavese Rosso Anamari Riserva,,,Frecciarossa,Lombardia,,20,Pinot nero 100%,Primi piatti di pasta o pasta fresca ripiena,,,,nd,nd,,,,,"12,5%",10,Acciaio 6 mesi | 18 mesi sui lieviti,,,,,Italy,,,
2,,,,,,,,,,,,,,,,,2022,2020,,Pinot Nero Dell'Oltrepò Pavese Carillo,,,Frecciarossa,Lombardia,,30,,Carni rosse o selvaggina,,,,nd,nd,,,,,"13,5%",3,Acciaio 3 mesi e Legno 12 mesi,,,,,Italy,,,
2,,,,,,,,,,,,,,,,,2022,2022,,Giorgi L (92)  T.O.P. Zero Pas Dosé,,,Giorgi,Lombardia,,16,Pinot nero 100%,Carni bianche o da cortile o m b a r d i a,,,,nd,nd,,,,,"12,5%",22,Acciaio 6 mesi e Legno 3 mesi,,,,,Italy,,,
2,,,,,,,,,,,,,,,,,2022,2012,,Antonio Giorgi Riserva Del Fondatore Extra Brut,,,Giorgi,Lombardia,,22,Pinot nero 100%,Polpo ubriaco.,,,,nd,nd,,,,,"12,5%",15,Acciaio 4 mesi | 70 mesi sui lieviti,,,,"Giallo animato da bollicine raffinate e persistenti. Naso contraddistinto da copiose sfumature di mandarino, piccoli frutti rossi, melagrana,  timo,  alloro  e  citronella.  Invitante,  sapido,  in  equilibrio con la struttura e la fine carbonica. Si congeda con una lunga scia di frutti rossi e veli balsamici.",Italy,,,
2,,,,,,,,,,,,,,,,,2022,2017,,Buttafuoco Storico Vigna Casa Del Corno,,,Giorgi,Lombardia,,48,Pinot nero 100%,,,,,nd,nd,,,,,"12,5%",10,,,,,,Italy,,,
2,,,,,,,,,,,,,,,,,2022,1870,,Oltrepò Pavese Metodo Classico Pinot Nero Brut Gran Cuvée Storica Giorgi  2017,,,Giorgi,Lombardia,,25,,Carni rosse o selvaggina,,,,nd,nd,,,,,14%,3,Legno 24 mesi,,,,,Italy,,,
2,,,,,,,,,,,,,,,,,2022,2019,,Oltrepò Pavese Riesling Il Bandito,,,Giorgi,Lombardia,,20,Pinot nero 100%,Piatti di pesce,,,,nd,nd,,,,,"12,5%",45,Acciaio 4 mesi | 36 mesi sui lieviti,,,,,Italy,,,
2,,,,,,,,,,,,,,,,,2022,2020,,Bonarda Dell'Oltrepò Pavese Frizzante La Brughera,,,Giorgi,Lombardia,,10,Riesling renano 100%,Piatti di verdure,,,,nd,nd,,,,,13%,40,Acciaio 6 mesi,,,,,Italy,,,
2,,,,,,,,,,,,,,,,,2022,2016,,Oltrepò Pavese Metodo Classico Pinot Nero Brut Gianfranco Giorgi S.A. |,,,Giorgi,Lombardia,,10,Croatina 95% – Barbera 5%,Salumi o insaccati,,,,nd,nd,,,,,"12,5%",60,Acciaio 6 mesi,,,,,Italy,,,
2,,,,,,,,,,,,,,,,,2022,2019,,Grazioli Angelo Pietro Mio,,,Grazioli Angelo Pietro,Lombardia,,,,,,,,nd,nd,,,,,,,,,,,,Italy,,,
2,,,,,,,,,,,,,,,,,2022,2019,,Pinot Nero,,,Grazioli Angelo Pietro,Lombardia,,25,Croatina 70% – Barbera 30%,Salsiccia e patate al forno.,,,,nd,nd,,,,,"15,5%",1,Acciaio 20 mesi,,,,"sotto spirito, pera cotta e cannella che sfumano su un soffio etereo. Un tannino vigoroso asciuga la bocca, lasciando dietro di sé una scia di aromi di frutta e spezie.",Italy,,,
2,,,,,,,,,,,,,,,,,2022,2019,,Oraterra,,,Grazioli Angelo Pietro,Lombardia,,25,Pinot nero 100%,Carni rosse o selvaggina,,,,nd,nd,,,,,13%,300,Legno 12 mesi,,,,,Italy,,,
2,,,,,,,,,,,,,,,,,2022,2019,,Nildo,,,Grazioli Angelo Pietro,Lombardia,,20,,"Crostacei, molluschi o crudità",,,,nd,nd,,,,,"12,5%",300,Acciaio 12 mesi,,,,,Italy,,,
2,,,,,,,,,,,,,,,,,2022,2015,,I Gessi (91)  Oltrepò Pavese Metodo Classico Pinot Nero Pas Dosé Rosé Mariacristina,,,I Gessi,Lombardia,,9,Croatina 65% – Barbera 25% – Uva rara 10%,Carni rosse o selvaggina,,,,nd,nd,,,,,14%,4,Legno 12 mesi,,,,,Italy,,,
2,,,,,,,,,,,,,,,,,2022,2015,,Oltrepò Pavese Metodo Classico Pinot Nero Pas Dosé Mariacristina,,,I Gessi,Lombardia,,38,Pinot nero 100%,Granseole al vapore con salsa olandese.,,,,nd,nd,,,,,12%,1,Acciaio 6 mesi | 65 mesi sui lieviti,,,,"Tenue rosa illuminato da un perlage puntiforme e continuo. Raffinato  il  bouquet  di  rosa,  glicine  e  pompelmo,  contornato  dalla freschezza  delle  erbe  aromatiche  e  dalla  fragolina  di  bosco.  Il sorso, dalla lunga scia minerale e agrumata, conferma l’eleganza gentile dei profumi.",Italy,,,
2,,,,,,,,,,,,,,,,,2022,2020,,Riesling Fabbio,,,I Gessi,Lombardia,,35,Pinot nero 100%,Risotti di pesce,,,,nd,nd,,,,,12%,2,Acciaio 4 mesi | 65 mesi sui lieviti,,,,,Italy,,,
2,,,,,,,,,,,,,,,,,2022,1933,,Nebbiolo  2017,,,I Gessi,Lombardia,,9,Riesling renano 100%,Piatti di pesce,,,,nd,nd,,,,,13%,6,Acciaio 6 mesi,,,,,Italy,,,
2,,,,,,,,,,,,,,,,,2022,2022,,Brut Mariacristina,,,I Gessi,Lombardia,,15,Nebbiolo 100%,Primi piatti di pasta o pasta fresca ripiena,,,,nd,nd,,,,,14%,1,Acciaio 3 mesi e Legno 18 mesi,,,,,Italy,,,
2,,,,,,,,,,,,,,,,,2022,2020,,Tassia,,,I Gessi,Lombardia,,18,Pinot nero 100%,"Zuppe, minestre o vellutate",,,,nd,nd,,,,,12%,6,Acciaio 3 mesi | 24 mesi sui lieviti,,,,,Italy,,,
2,,,,,,,,,,,,,,,,,2022,2022,,Oltrepò Pavese,,,I Gessi,Lombardia,,9,Pinot nero 100%,Salumi o insaccati,,,,nd,nd,,,,,12%,6,Acciaio 6 mesi,,,,,Italy,,,
2,,,,,,,,,,,,,,,,,2022,2016,,Il Calepino Kalos,,,Il Calepino,Lombardia,,,,,,,,nd,nd,,,,,,,,,,,,Italy,,,
2,,,,,,,,,,,,,,,,,2022,2015,,Il Calepino Brut,,,Il Calepino,Lombardia,,30,Cabernet sauvignon 100%,Pâté di cacciagione.,,,,nd,nd,,,,,"14,5%",8,Legno 36 mesi,,,,"cordi di mirtillo, prugna e ciliegia. Sbuffi speziati di cannella, vaniglia e noce moscata, aliti di tabacco biondo e note più verdi di peperone. Al palato spiccano un'appagante traccia mentolata e una trama tannica ben delineata.",Italy,,,
2,,,,,,,,,,,,,,,,,2022,2017,,Il Cipresso L Moscato Di Scanzo Serafino,,,Il Cipresso,Lombardia,,18,,,,,,nd,nd,,,,,13%,45,,,,,,Italy,,,
2,,,,,,,,,,,,,,,,,2022,2014,,Valcalepio Rosso Bartolomeo Riserva,,,Il Cipresso,Lombardia,,43,Moscato di Scanzo 100%,Mousse di cioccolato.,,,,nd,nd,,,,,"14,5%",1,Acciaio 24 mesi,,,,"Sfoggia un manto granato scuro e impenetrabile. La complessità odorosa muove dal floreale di rosa damascena, viola mammola, lavanda, garofano e ciclamino alla frutta rossa macerata, spezie dolci e cioccolato fondente. Invitante e gentile la beva, vellutato il tannino; sorso fresco e persistente.",Italy,,,
2,,,,,,,,,,,,,,,,,2022,2020,,Valcalepio Bianco Biologico Melardo,,,Il Cipresso,Lombardia,,25,Cabernet sauvignon 60% – Merlot 40%,Carni rosse o selvaggina,,,,nd,nd,,,,,"13,5%",1,Acciaio 6 mesi e Legno 30 mesi,,,,,Italy,,,
2,,,,,,,,,,,,,,,,,2022,2020,,Terre Del Colleoni Manzoni Bianco Bio Faustino,,,Il Cipresso,Lombardia,,15,,Piatti di verdure,,,,nd,nd,,,,,"13,5%",3,Acciaio 6 mesi,,,,,Italy,,,
2,,,,,,,,,,,,,,,,,2022,2018,,Valcalepio Rosso Dionisio,,,Il Cipresso,Lombardia,,16,Manzoni bianco 100%,Piatti di pesce,,,,nd,nd,,,,,14%,2,Acciaio 6 mesi,,,,,Italy,,,
2,,,,,,,,,,,,,,,,,2022,2019,,Isimbarda (91)  Oltrepò Pavese Riesling Superiore Vigna Martina Le Fleur,,,Isimbarda,Lombardia,,15,Merlot 60% – Cabernet sauvignon 40%,,,,,nd,nd,,,,,13%,7,Acciaio 6 mesi e Legno 12 mesi,,,,"abbinamento Carni rosse o selvaggina ettari 40  bottiglie 130.000 produzione olearia No proprietà Claudio Battaini conduzione enologica Daniele Zangelmi, Mauro Suario conduzione agronomica Daniele Zangelmi vendita diretta Sì  visita in azienda Sì",Italy,,,
2,,,,,,,,,,,,,,,,,2022,2020,,Oltrepò Pavese Riesling Superiore Vigna Martina,,,Isimbarda,Lombardia,,17,Riesling renano 100%,Linguine al pesto di pistacchi e gamberetti.,,,,nd,nd,,,,,"13,5%",3,Acciaio 6 mesi,,,,"Un cuore giallo paglierino. Il ventaglio odoroso è allettante: limone, ananas, pesca tabacchiera, albicocca e mela, miele di acacia e frutta secca. Abbrivio gustativo morbido ed equilibrato, si distende con grazia parlando di sapidità e freschezza. Ritorna il fruttato, che accompagna la lunga persistenza.",Italy,,,
