Entry,Ref,OLDRS,RANK,RS,RAWQP,QPRANK,QP,RANK2,RS2,RAWQP2,QP2,RANK3,RS3,RAWQP3,QP3,RawAvg,RatingYear,Vintage,Qterms,FullName,AppellationLevel,AppellationName,WineryName,Region,EvaluationAvg,Price,Grapes,Pairing,ScoreAvg,EvaluationAIS,ScoreAIS,EvaluationGR,ScoreGR,SLC,TLC,WineTypeIT,WineType,Alcohol,Bottles,AgingMonths,AgingTypeIT,AgingType,Notes,Tasting Notes,Country,VintageNV,Method,Sweetness
2,,,,,,,,,,,,,,,,,2023,2021,,Romagna Albana Secco Alle Dodici A Monte Tondo,,,Terre della Rocca,Romagna,,22,Albana 100%,Gnocchetti al sugo d’astice,,,86,nd,nd,,,,,13,1,,Acciaio 3 mesi,,,"Cangiante paglierino particolarmente invitante. Bouquet olfattivo che comprende pesca bianca e ginestra, sentori di lime ed erbe mediterranee. L’ingresso è sferico e di spessore, piacevolmente bilanciato da freschezza e sapidità che conducono un finale saporito dai ritorni agrumati.",Italy,,,
2,,,,,,,,,,,,,,,,,2023,2020,,Romagna Sangiovese Superiore La Furha Del Basino,,,Terre della Rocca,Romagna,,22,Sangiovese 100%,Bigoli con l'anatra,,,86,nd,nd,,,,,13,1,,Acciaio 3 mesi,,,,Italy,,,
2,,,,,,,,,,,,,,,,,2023,2020,,Romagna Sangiovese Superiore Il Trinzano Del Basino,,,Terre della Rocca,Romagna,,22,Sangiovese 100%,Reale di vitello alla senape antica,,,86,nd,nd,,,,,13,1,,Acciaio 3 mesi,,,,Italy,,,
2,,,,,,,,,,,,,,,,,2023,2020,,Terra Dei Gessi Bianco,,,Tozzi,Romagna,,10,Manzoni bianco 60% – Chardonnay 30% – Albana 10%,Catalana di crostacei,,,89,nd,nd,,,,,14,4,,Acciaio 6 mesi,,,"Un sipario dai tenui toni del giallo. Traiettorie aromatiche inebrianti e primaverili di zagare, pesca bianca e bergamotto, seguire limone e stille di idrocarburo. Il sorso è coinvolgente, succoso, con un fresco agrume che allunga il piacere dell’assaggio. Carezzevole e in continua evoluzione.",Italy,,,
2,,,,,,,,,,,,,,,,,2023,2018,,Romagna Albana Passito Ally,,,Tozzi,Romagna,,10,Albana 100%,Formaggio di fossa di Sogliano,,,86,nd,nd,,,,,14,4,,Acciaio 6 mesi,,,,Italy,,,
2,,,,,,,,,,,,,,,,,2023,2020,,Terra Dei Gessi Rosso,,,Tozzi,Romagna,,10,Pinot nero 85% – Sangiovese 10% – Merlot 5%,Legno 6 mesi Lombata di vitello su letto di cipolline saltate,,,82,nd,nd,,,,,14,4,,Acciaio 6 mesi,,,,Italy,,,
2,,,,,,,,,,,,,,,,,2023,2021,,Romagna Albana Secco Vitalba,,,Tre Monti,Romagna,,18,Albana 100%,Aragosta in bellavista,,,91,nd,nd,,,,,14,8,,Terracotta 10 mesi,,,"Oro antico lucente. Al naso è un caleidoscopio di profumi: albicocca disidratata, datteri, agrumi canditi, tracce mielate, effluvi resinosi e macchia mediterranea. Bocca vellutata, galvanizzata da un brillante contrasto acido e di lieve astringenza. L’essenza di agrume accompagna lungo.",Italy,,,
2,,,,,,,,,,,,,,,,,2023,2021,,Piuttosto,,,Tre Monti,Romagna,,18,Trebbiano romagnolo 100%,Coniglio al forno con funghi,,,91,nd,nd,,,,,14,8,,Terracotta 10 mesi,,,"Oro splendente. Frutta sciroppata, fiori di camomilla e mela Golden, impreziosite da scorze di agrumi canditi e miele. Vino di volume, galvanizzato da una tonica freschezza e da un delicato tocco tannico che conduce un convincente saluto dai rintocchi agrumati.",Italy,,,
2,,,,,,,,,,,,,,,,,2023,2020,,Thea Passito,,,Tre Monti,Romagna,,18,Petit manseng 70% – Albana 30%,Montasio stravecchio,,,89,nd,nd,,,,,14,8,,Terracotta 10 mesi,,,,Italy,,,
2,,,,,,,,,,,,,,,,,2023,2021,,Romagna Albana Secco Vigna Rocca,,,Tre Monti,Romagna,,18,Albana 100%,Lasagnette con ragù di coniglio e crema di piselli,,,89,nd,nd,,,,,14,8,,Terracotta 10 mesi,,,,Italy,,,
2,,,,,,,,,,,,,,,,,2023,2019,,Romagna Sangiovese Superiore Petrignone Riserva,,,Tre Monti,Romagna,,18,Sangiovese 100%,Guancia di vitello in umido,,,89,nd,nd,,,,,14,8,,Terracotta 10 mesi,,,,Italy,,,
2,,,,,,,,,,,,,,,,,2023,2019,,Romagna Sangiovese Superiore Thea Riserva,,,Tre Monti,Romagna,,18,Sangiovese 100%,e Legno 9 mesi Fagiano arrosto,,,89,nd,nd,,,,,14,8,,Terracotta 10 mesi,,,,Italy,,,
2,,,,,,,,,,,,,,,,,2023,2021,,Romagna Albana Secco Arlùs,,,Trerè,Romagna,,10,Albana 100%,Catalana di crostacei,,,89,nd,nd,,,,,,10,,Acciaio 5 mesi,,,Un calice giallo paglierino che rivela un naso intenso e complesso. Dalla pesca nettarina all’albicocca e alle erbe aromatiche. Vino dal carattere solido nel quale ritroviamo la maturità del frutto e l’acidità tipica del vitigno. Finale equilibrato e dal tono tradizionalmente asciutto.,Italy,,,
2,,,,,,,,,,,,,,,,,2023,2018,,Colli Di Faenza Rosso Montecorallo Riserva,,,Trerè,Romagna,,10,Cabernet    sauvignon    60% –    Merlot    30% –    Sangiovese,Lepre in salmì,,,89,nd,nd,,,,,,10,,Acciaio 5 mesi,,,,Italy,,,
2,,,,,,,,,,,,,,,,,2023,2021,,Colli Di Faenza Bianco Re Bianco,,,Trerè,Romagna,,10,Sauvignon 60% – Chardonnay 40%,Timballo di riso e gamberi,,,89,nd,nd,,,,,,10,,Acciaio 5 mesi,,,,Italy,,,
2,,,,,,,,,,,,,,,,,2023,2021,,Romagna Sangiovese Superiore Vigna Dello Sperone,,,Trerè,Romagna,,10,Sangiovese 85% – Merlot 10% – Syrah 5%,Gnocchi al ragù,,,89,nd,nd,,,,,,10,,Acciaio 5 mesi,,,,Italy,,,
2,,,,,,,,,,,,,,,,,2023,2019,,Romagna Sangiovese Amarcord D’Un Ross Riserva,,,Trerè,Romagna,,10,Sangiovese 85% – Cabernet sauvignon 15%,Piccione al forno con cipollotti,,,86,nd,nd,,,,,,10,,Acciaio 5 mesi,,,,Italy,,,
2,,,,,,,,,,,,,,,,,2023,2021,,Anam,,,Vigne di San Lorenzo,Romagna,,22,Trebbiano 100%,Rotolo di coniglio con pomodorini ed erbe aromatiche,,,89,nd,nd,,,,,12,1,,Acciaio 12 mesi,,,"Ocra luminoso. Sensazioni originali di frutta macerata con una leggera ossigenazione; mela golden e albicocca, avvolte da foglie di tè. Sorso strutturato e potente, caratterizzato da intensa sapidità, freschezza agrumata e un sottofondo di erbe aromatiche. Lunga persistenza, appena astringente.",Italy,,,
2,,,,,,,,,,,,,,,,,2023,2021,,Gea,,,Vigne di San Lorenzo,Romagna,,22,Albana 100%,"Pasta, patate e cozze",,,86,nd,nd,,,,,12,1,,Acciaio 12 mesi,,,,Italy,,,
2,,,,,,,,,,,,,,,,,2023,2021,,Campaglione Rosso,,,Vigne di San Lorenzo,Romagna,,22,Sangiovese 100%,Tagliatelle al ragù,,,82,nd,nd,,,,,12,1,,Acciaio 12 mesi,,,,Italy,,,
2,,,,,,,,,,,,,,,,,2023,2017,,Romagna Sangiovese Superiore Sorgara,,,Villa Bagnolo,Romagna,,12,Sangiovese 100%,Fesa di vitello al latte,,,89,nd,nd,,,,,15,4,,Legno 12 mesi,,,"Rubino luccicante. Espressione olfattiva di peonia, cannella e tamarindo, unita stuzzicanti grani di pepe nero e foglie mentuccia. Un assaggio di corpo che delinea una progressione in cui l’avvolgenza calorica è spalleggiata da un incisivo nerbo e da un tannino tornito dai risvolti sapidi.",Italy,,,
2,,,,,,,,,,,,,,,,,2023,2019,,Alloro,,,Villa Bagnolo,Romagna,,12,Sangiovese 60% – Cabernet franc 20% – Cabernet sauvignon 20%,Gulasch di manzo alla paprica dolce,,,86,nd,nd,,,,,15,4,,Legno 12 mesi,,,,Italy,,,
2,,,,,,,,,,,,,,,,,2023,2017,,Utis,,,Villa Bagnolo,Romagna,,12,Cabernet franc 50% – Cabernet sauvignon 50%,Lepre alla cacciatora,,,86,nd,nd,,,,,15,4,,Legno 12 mesi,,,,Italy,,,
2,,,,,,,,,,,,,,,,,2023,2021,,Romagna Albana Secco Bianco Bagnolo,,,Villa Bagnolo,Romagna,,12,Albana 100%,Cappesante gratinate,,,86,nd,nd,,,,,15,4,,Legno 12 mesi,,,,Italy,,,
2,,,,,,,,,,,,,,,,,2023,2016,,Romagna Sangiovese Superiore Valdilà Riserva,,,Villa Bagnolo,Romagna,,12,Sangiovese 100%,Guanciale di vitello in umido con patate,,,82,nd,nd,,,,,15,4,,Legno 12 mesi,,,,Italy,,,
2,,,,,,,,,,,,,,,,,2023,2020,,Romagna Sangiovese Brisighella Trecento,,,Villa Liverzano,Romagna,,12,Sangiovese 100%,Filetto di maiale lardellato,,,86,nd,nd,,,,,13,2,,Legno 9 mesi,,,"Carminio con riflessi granato. Tabacco e china sono i protagonisti dell’olfatto con la confettura di amarene. Punto di forza del vino è il tratto sferico e avvolgente dell’impalcatura gustativa, in cui la quota tannica apporta esuberanza e movimento. Deciso e prolungato tratteggio su echi speziati.",Italy,,,
2,,,,,,,,,,,,,,,,,2023,2021,,Ficcanaso,,,Villa Liverzano,Romagna,,12,Sauvignon 100%,Carpaccio di chianina e insalata di porcini,,,86,nd,nd,,,,,13,2,,Legno 9 mesi,,,,Italy,,,
2,,,,,,,,,,,,,,,,,2023,2019,,Romagna Sangiovese Superiore Marnoso,,,Villa Otto Lune,Romagna,,13,Sangiovese 100%,Entrecôte alla griglia con scaglie di formaggio,,,86,nd,nd,,,,,,10,,Legno 12 mesi,,,"Rubino compatto e vivido. Profumi eleganti e tipici di ciliegia matura e prugna, viola e cenni di spezie dolci. Sorso delicato nel profilo tannico, di media struttura e con un’acidità ben integrata. Epilogo tenace, equilibrato e dal polposo ritorno.",Italy,,,
2,,,,,,,,,,,,,,,,,2023,2019,,Romagna Sangiovese Modigliana Vigna Probi Riserva,,,Villa Papiano,Romagna,,20,Sangiovese 100%,Risotto con le quaglie,,,91,nd,nd,,,,,12,12,,Legno 18 mesi,,,"Splendida trasparenza abbellisce il rubino. Naso succoso: marasca, ribes rosso, lampone, viola, lillà, rabarbaro, sottobosco e note speziate. Palato raffinato e intraprendente, equilibrato e con tannini cesellati sostenuti da acidità e salinità che si allungano in un finale con suggestioni rosacee.",Italy,,,
2,,,,,,,,,,,,,,,,,2023,2020,,Romagna Sangiovese Modigliana Vigna Beccaccia,,,Villa Papiano,Romagna,,20,Sangiovese 100%,Agnello al forno con rosmarino,,,89,nd,nd,,,,,12,12,,Legno 18 mesi,,,,Italy,,,
2,,,,,,,,,,,,,,,,,2023,2020,,Romagna Trebbiano Strada Corniolo,,,Villa Papiano,Romagna,,20,Trebbiano 100%,"Terracotta 6 mesi Lasagne con scamorza, funghi e zucca",,,89,nd,nd,,,,,12,12,,Legno 18 mesi,,,"Fritto di paranza. TERRA! 2021 Bianco Igt Albana 100% Alc. 12,5% | € 16 | Bt. 3.000 | Ferm. Terracotta | Mat.",Italy,,,
2,,,,,,,,,,,,,,,,,2023,2018,,Papiano,,,Villa Papiano,Romagna,,20,Centesimino 100%,Faraona arrosto con salsa di frutti di bosco,,,82,nd,nd,,,,,12,12,,Legno 18 mesi,,,,Italy,,,
2,,,,,,,,,,,,,,,,,2023,2018,,Strada Corniolo,,,Villa Papiano,Romagna,,20,,,,,89,nd,nd,,,,,12,12,,Legno 18 mesi,,,,Italy,,,
2,,,,,,,,,,,,,,,,,2023,2019,,Romagna Sangiovese Longiano Riserva,,,Villa Venti,Romagna,,22,Sangiovese 100%,Ravioli di germano con foie gras,,,86,nd,nd,,,,,12,3,,Cemento 12 mesi,,,"Screziature granato su fitto cremisi. Una coreografia di sensazioni: tabacco e ciliegia sotto spirito che s’intrecciano cenni di tamarindo e more. La dinamica gustativa è sferica e vigorosa, grazie una bella acidità e un tannino tornito, integrato. Inarrestabili le sfumature sapide.",Italy,,,
2,,,,,,,,,,,,,,,,,2023,2021,,Tre Albe,,,Villa Venti,Romagna,,22,Trebbiano romagnolo 70% – Albana 30%,"Risotto con zucchine, fiori di zucca e zafferano",,,82,nd,nd,,,,,12,3,,Cemento 12 mesi,,,,Italy,,,
2,,,,,,,,,,,,,,,,,2023,2020,,Romagna Sangiovese Superiore Primo Segno,,,Villa Venti,Romagna,,22,Sangiovese 100%,Carré di maiale alle prugne,,,82,nd,nd,,,,,12,3,,Cemento 12 mesi,,,,Italy,,,
2,,,,,,,,,,,,,,,,,2023,2021,,Serenaro,,,Villa Venti,Romagna,,22,Famoso 100%,Crostini con baccalà mantecato,,,82,nd,nd,,,,,12,3,,Cemento 12 mesi,,,,Italy,,,
2,,,,,,,,,,,,,,,,,2023,2019,,Romagna Sangiovese Superiore Amedeo Riserva,,,Zavalloni,Romagna,,18,Sangiovese 100%,Guancia di vitello in umido,,,89,nd,nd,,,,,15,6,,Legno 24 mesi,,,"Filigrana purpurea, all’olfatto è sfaccettato e generoso, con una base profonda di ginepro e mirto, dal quale s’innalzano prugna in confettura e macchia mediterranea. Secco e caldo, morbido, intenso, con buona partitura fresco-tannica. Chiude con un signorile retrogusto di rabarbaro.",Italy,,,
2,,,,,,,,,,,,,,,,,2023,2021,,Romagna Albana Dolce,,,Zavalloni,Romagna,,18,Albana 100%,Torta delle rose,,,89,nd,nd,,,,,15,6,,Legno 24 mesi,,,,Italy,,,
2,,,,,,,,,,,,,,,,,2023,2021,,Romagna Albana Secco,,,Zavalloni,Romagna,,18,Albana 100%,Linguine agli scampi,,,89,nd,nd,,,,,15,6,,Legno 24 mesi,,,,Italy,,,
2,,,,,,,,,,,,,,,,,2023,2020,,Romagna Sangiovese Superiore Solaris,,,Zavalloni,Romagna,,18,Sangiovese 100%,Cemento 12 mesi Quaglie alla cacciatora,,,89,nd,nd,,,,,15,6,,Legno 24 mesi,,,,Italy,,,
2,,,,,,,,,,,,,,,,,2023,2020,,Romagna Albana Secco Amedeo Bianco,,,Zavalloni,Romagna,,18,Albana 100%,Coniglio al forno con polenta di Storo,,,86,nd,nd,,,,,15,6,,Legno 24 mesi,,,,Italy,,,
2,,,,,,,,,,,,,,,,,2023,2017,,Brut Rosé,,,Zavalloni,Romagna,,18,Sangiovese 100%,30 mesi sui lieviti Frittura di rane e verdure croccanti,,,86,nd,nd,,,,,15,6,,Legno 24 mesi,,,,Italy,,,
