Entry,Ref,OLDRS,RANK,RS,RAWQP,QPRANK,QP,RANK2,RS2,RAWQP2,QP2,RANK3,RS3,RAWQP3,QP3,RawAvg,RatingYear,Vintage,Qterms,FullName,AppellationLevel,AppellationName,WineryName,Region,EvaluationAvg,Price,Grapes,Pairing,ScoreAvg,EvaluationAIS,ScoreAIS,EvaluationGR,ScoreGR,SLC,TLC,WineTypeIT,WineType,Alcohol,Bottles,AgingMonths,AgingTypeIT,AgingType,Notes,Tasting Notes,Country,VintageNV,Method,Sweetness
2,,,,,,,,,,,,,,,,,2023,2021,,Romagna Sangiovese Predappio Il Sangiovese,,,Noelia Ricci,Romagna,,25,Sangiovese 100%,Cemento 6 mesi Tagliata al pepe verde,,,89,nd,nd,,,,,13,8,,Cemento 12 mesi,,,,Italy,,,
2,,,,,,,,,,,,,,,,,2023,2021,,Romagna Trebbiano Brò,,,Noelia Ricci,Romagna,,25,Trebbiano romagnolo 100%,Pollo alle mandorle e curcuma,,,89,nd,nd,,,,,13,8,,Cemento 12 mesi,,,,Italy,,,
2,,,,,,,,,,,,,,,,,2023,2021,,Colli Di Rimini Rebola,,,Enio Ottaviani,Romagna,,20,Grechetto gentile 100%,Triglie in guazzetto,,,91,nd,nd,,,,,13,10,,Acciaio 3 mesi e,,,"Cemento 4 mesi Paglierino vivace. Profumi freschi e aggraziati: gelsomino, pera, pompelmo, mandorla ed erbe spontanee. Altrettanto convincente al gusto, il vino ha morbidezza iniziale, frutto fragrante e verve agrumata. Ben bilanciato, predispone un finale dagli avvincenti richiami minerali.",Italy,,,
2,,,,,,,,,,,,,,,,,2023,2020,,Romagna Sangiovese Superiore Caciara,,,Enio Ottaviani,Romagna,,20,Sangiovese 100%,Risotto con rape rosse e Gorgonzola,,,89,nd,nd,,,,,13,10,,Acciaio 3 mesi e,,,,Italy,,,
2,,,,,,,,,,,,,,,,,2023,2021,,Clemente I,,,Enio Ottaviani,Romagna,,20,Riesling 40% – Bombino bianco 30% – Sauvignon 30%,Ravioli di pesce con sugo di canestrelli,,,86,nd,nd,,,,,13,10,,Acciaio 3 mesi e,,,,Italy,,,
2,,,,,,,,,,,,,,,,,2023,2021,,Romagna Pagadebit Strati,,,Enio Ottaviani,Romagna,,20,Bombino bianco 100%,Risotto ai frutti di mare,,,86,nd,nd,,,,,13,10,,Acciaio 3 mesi e,,,,Italy,,,
2,,,,,,,,,,,,,,,,,2023,2019,,Romagna Sangiovese Superiore Pandolfo Riserva,,,Pandolfa,Romagna,,18,Sangiovese 100%,Quaglie alla cacciatora,,,89,nd,nd,,,,,,10,,Legno 18 mesi,,,"Rosso rubino fitto che vira al granato. Ammalia al naso per le inebrianti allusioni di ciliegia e mora in confettura, seguite da ritornelli speziati dolci e nuance balsamiche. Il sorso è dinamico con tannini in fase di integrazione e spalleggiati da una freschezza fruttata. Lungo finale saporito.",Italy,,,
2,,,,,,,,,,,,,,,,,2023,2021,,Romagna Sangiovese Superiore Federico,,,Pandolfa,Romagna,,18,Sangiovese 95% – Merlot 5%,Pappardelle al ragù di cinghiale,,,86,nd,nd,,,,,,10,,Legno 18 mesi,,,,Italy,,,
2,,,,,,,,,,,,,,,,,2023,2021,,Battista,,,Pandolfa,Romagna,,18,Chardonnay 100%,Fritto di paranza,,,82,nd,nd,,,,,,10,,Legno 18 mesi,,,,Italy,,,
2,,,,,,,,,,,,,,,,,2023,2020,,Il Vento Di Pertinello,,,Pertinello,Romagna,,28,Merlot 100%,Filetto di cervo ai mirtilli,,,89,nd,nd,,,,,,220,,Legno 10 mesi,,,"Rubino compatto. Sprigiona un grazioso bouquet di fiori rossi disidratati e di ciliegia matura, con estrazioni erbacee in chiusura. Corposo al palato, si sviluppa in armonia tra tannino vellutato, freschezza e un giusto apporto calorico. Estensione ragguardevole con guizzi di frutta rossa.",Italy,,,
2,,,,,,,,,,,,,,,,,2023,2020,,Il Pinot Nero Di Pertinello,,,Pertinello,Romagna,,28,Pinot nero 100%,Costoletta di vitello alla milanese,,,89,nd,nd,,,,,,220,,Legno 10 mesi,,,,Italy,,,
2,,,,,,,,,,,,,,,,,2023,2020,,Il Sole Di Pertinello,,,Pertinello,Romagna,,28,Albana 100%,Rigatoni al ragù bianco di carne,,,89,nd,nd,,,,,,220,,Legno 10 mesi,,,,Italy,,,
2,,,,,,,,,,,,,,,,,2023,2018,,Il Metodo Classico Di Pertinello Pas Dosé,,,Pertinello,Romagna,,28,Sangiovese 100%,26 mesi sui lieviti Crostini con burro e salmone,,,86,nd,nd,,,,,,220,,Legno 10 mesi,,,,Italy,,,
2,,,,,,,,,,,,,,,,,2023,2021,,Romagna Albana Secco Nora,,,Podere Baratta,Romagna,,9,Albana 100%,Cotolette di pollo con melanzane e provola,,,89,nd,nd,,,,,15,1,,Acciaio 6 mesi,,,"Sfumature piene, tra il paglierino e l’oro. Fragranze nitide di albicocca e fior di pesco, incalzati da una fresca percezione agrumata. Il sorso è di struttura, dotato di un sontuoso calore alcolico che avvolge un’incisiva acidità, creando contrasto e piacevolezza di beva. Finale sapido.",Italy,,,
2,,,,,,,,,,,,,,,,,2023,2021,,Dardo,,,Podere Baratta,Romagna,,9,Sangiovese 100%,Tagliere di salumi,,,82,nd,nd,,,,,15,1,,Acciaio 6 mesi,,,,Italy,,,
2,,,,,,,,,,,,,,,,,2023,2017,,4 Dicembre,,,Podere Baratta,Romagna,,9,Sangiovese 100%,Crostata di mirtilli,,,82,nd,nd,,,,,15,1,,Acciaio 6 mesi,,,,Italy,,,
2,,,,,,,,,,,,,,,,,2023,2021,,Romagna Albana Secco,,,Podere La Berta,Romagna,,9,Albana 100%,Gnocchi al burro e ricotta affumicata,,,86,nd,nd,,,,,13,3,,Acciaio 6 mesi,,,"Giallo paglierino luminoso. Emergono fin da subito cenni di erbe aromatiche in pianta, salvia e basilico, seguire stille di pesca e fiori bianchi. Una progressione diretta e dinamica, di immediata e piacevole freschezza, che perdura fino una chiusura dal ritorno gradevolmente ammandorlato.",Italy,,,
2,,,,,,,,,,,,,,,,,2023,2019,,Romagna Sangiovese Superiore Olmatello Riserva,,,Podere La Berta,Romagna,,9,Sangiovese 100%,Guanciale di vitello in umido con patate,,,86,nd,nd,,,,,13,3,,Acciaio 6 mesi,,,,Italy,,,
2,,,,,,,,,,,,,,,,,2023,2021,,Romagna Sangiovese Superiore Podere La Berta,,,Podere La Berta,Romagna,,9,Sangiovese 100%,Branzino al cartoccio,,,86,nd,nd,,,,,13,3,,Acciaio 6 mesi,,,,Italy,,,
2,,,,,,,,,,,,,,,,,2023,2020,,Romagna Sangiovese Superiore Solano,,,Podere La Berta,Romagna,,9,Sangiovese 100%,Bigoli con salsiccia,,,86,nd,nd,,,,,13,3,,Acciaio 6 mesi,,,,Italy,,,
2,,,,,,,,,,,,,,,,,2023,2021,,Romagna Pagadebit,,,Podere La Berta,Romagna,,9,Bombino bianco 100%,Linguine con asparagi e calamaretti,,,82,nd,nd,,,,,13,3,,Acciaio 6 mesi,,,,Italy,,,
2,,,,,,,,,,,,,,,,,2023,2021,,Romagna Trebbiano Floresco,,,Podere La Berta,Romagna,,9,Trebbiano 100%,Pollo fritto,,,82,nd,nd,,,,,13,3,,Acciaio 6 mesi,,,,Italy,,,
2,,,,,,,,,,,,,,,,,2023,2021,,Colli Di Rimini Rebola Vigna La Ginestra,,,Podere Vecciano,Romagna,,13,Grechetto gentile 100%,Ostriche Belon,,,89,nd,nd,,,,,14,8,,Acciaio 6,,,"mesi e Legno 6 mesi Lampi dorati impreziosiscono il paglierino. La raffinata coreografia di nespola, mango e pesca gialla si arricchisce di erbe officinali e di una bella nota gessosa. Avvolgente al palato, rivela un corpo forte, saporito e di grande equilibrio. Congedo di buona lunghezza e tratteggi fruttati.",Italy,,,
2,,,,,,,,,,,,,,,,,2023,2020,,Amphora Di Vecciano,,,Podere Vecciano,Romagna,,13,Grechetto gentile 100%,Faraona arrosto con salsa di frutti di bosco,,,86,nd,nd,,,,,14,8,,Acciaio 6,,,,Italy,,,
2,,,,,,,,,,,,,,,,,2023,2021,,Romagna Pagadebit Vigna Delle Rose,,,Podere Vecciano,Romagna,,13,Bombino bianco 100%,Gnocchi alla romana,,,86,nd,nd,,,,,14,8,,Acciaio 6,,,,Italy,,,
2,,,,,,,,,,,,,,,,,2023,2019,,Romagna Sangiovese Superiore Vignalmonte,,,Podere Vecciano,Romagna,,13,Sangiovese 100%,Anatra ai funghi,,,86,nd,nd,,,,,14,8,,Acciaio 6,,,,Italy,,,
2,,,,,,,,,,,,,,,,,2023,2020,,Terravolta,,,Podere Vecciano,Romagna,,13,Cabernet sauvignon 60% – Merlot 35% – Petit verdot 5%,Costolette di maiale alla brace,,,86,nd,nd,,,,,14,8,,Acciaio 6,,,,Italy,,,
2,,,,,,,,,,,,,,,,,2023,2021,,Romagna Albana Secco Campodora,,,Poderi dal Nespoli,Romagna,,9,Albana 100%,"Pasta, patate e cozze",,,91,nd,nd,,,,,12,20,,Acciaio 8 mesi,,,"Una briosa tonalità paglierino anticipa le fragranti percezioni di pesca, albicocca, papaya e quel tocco varietale di salvia. L’assaggio è segnato dalla trama acida, che dona energia, rinfresca e senza indugi regala un finale persistente giocato con l’aroma succoso dell’agrume.",Italy,,,
2,,,,,,,,,,,,,,,,,2023,2020,,Romagna Sangiovese Superiore Prugneto,,,Poderi dal Nespoli,Romagna,,9,Sangiovese 100%,e Legno 6 mesi Gnocchi al ragù,,,86,nd,nd,,,,,12,20,,Acciaio 8 mesi,,,,Italy,,,
2,,,,,,,,,,,,,,,,,2023,2021,,Romagna Pagadebit,,,Poderi dal Nespoli,Romagna,,9,Bombino bianco 95% – Sauvignon 5%,Linguine con asparagi e calamaretti,,,86,nd,nd,,,,,12,20,,Acciaio 8 mesi,,,,Italy,,,
2,,,,,,,,,,,,,,,,,2023,2021,,Romagna Sangiovese So Free,,,Poderi dal Nespoli,Romagna,,9,Sangiovese 100%,Involtini di vitello lardellati,,,86,nd,nd,,,,,12,20,,Acciaio 8 mesi,,,,Italy,,,
2,,,,,,,,,,,,,,,,,2023,2019,,Romagna Sangiovese Superiore Il Nespoli Riserva,,,Poderi dal Nespoli,Romagna,,9,Sangiovese 100%,Filetto di maiale lardellato,,,86,nd,nd,,,,,12,20,,Acciaio 8 mesi,,,,Italy,,,
2,,,,,,,,,,,,,,,,,2023,2021,,Trebbiano Biologico,,,Poderi dal Nespoli,Romagna,,9,Trebbiano 100%,Tortelli di zucca e salvia,,,86,nd,nd,,,,,12,20,,Acciaio 8 mesi,,,,Italy,,,
2,,,,,,,,,,,,,,,,,2023,2018,,Romagna Sangiovese Superiore Poggiogirato Riserva,,,Poggio della Dogana,Romagna,,21,Sangiovese 100%,Filetto di maiale lardellato,,,91,nd,nd,,,,,,2,,Legno 12 mesi e,,,"Cemento 12 mesi Rosso rubino con riflessi granato. Ventaglio di nobili riconoscimenti: ciliegia e piccoli frutti neri, rosa appassita, uno stretto intreccio tra chiodi di garofano e noce moscata. Avvincente al palato, tannino in linea con la partitura fresco-sapida e allungo su refoli di frutta rossa.",Italy,,,
2,,,,,,,,,,,,,,,,,2023,2020,,Romagna Sangiovese Brisighella Arlesiana,,,Poggio della Dogana,Romagna,,21,Sangiovese 95% – Ciliegiolo 5%,Pappardelle con sugo di capriolo,,,89,nd,nd,,,,,,2,,Legno 12 mesi e,,,,Italy,,,
2,,,,,,,,,,,,,,,,,2023,2021,,Romagna Trebbiano Nubivago,,,Poggio della Dogana,Romagna,,21,Trebbiano 100%,mesi e Cemento 6 mesi Crostini con baccalà mantecato,,,86,nd,nd,,,,,,2,,Legno 12 mesi e,,,,Italy,,,
2,,,,,,,,,,,,,,,,,2023,2020,,Romagna Sangiovese Superiore I Quattro Bastioni,,,Poggio della Dogana,Romagna,,21,Sangiovese 100%,Straccetti di cavallo,,,82,nd,nd,,,,,,2,,Legno 12 mesi e,,,,Italy,,,
2,,,,,,,,,,,,,,,,,2023,2017,,Bursôn Selezione,,,Randi,Romagna,,15,Uva Longanesi 100%,Cinghiale in umido,,,86,nd,nd,,,,,12,10,,Acciaio 12 mesi,,,"e Legno 24 mesi Impenetrabile e profondo rosso fitto. Naso eccellente e intenso: ginepro, china, susine e more di gelso. Sorso potente, concentrato e ricco di estratti. Rientra nella tipologia la sua robusta dotazione tannica e l’esuberante freschezza. La chiusura è lenta e piena di sensazioni aromatiche.",Italy,,,
2,,,,,,,,,,,,,,,,,2023,2021,,Rambèla,,,Randi,Romagna,,15,Famoso 100%,Risotto con seppie e burrata,,,86,nd,nd,,,,,12,10,,Acciaio 12 mesi,,,,Italy,,,
2,,,,,,,,,,,,,,,,,2023,2018,,Romagna Sangiovese Predappio Vitignano Riserva,,,Rocca le Caminate,Romagna,,15,Sangiovese 95% – Merlot 5%,Capriolo in salmì con polenta di grano saraceno,,,86,nd,nd,,,,,14,1,,Acciaio 36 mesi e,,,"Legno 18 mesi Granato dalla lucente trasparenza. Ciliegia sotto spirito, rosa essiccata e nocciola tostata compongono un quadro che non manca della sobrietà delle bacche di ginepro. Lunghi rimandi olfattivi al palato, fresco ed equilibrato, tannini smussati e succosi, chiosa con aromi di frutta macerata in alcol.",Italy,,,
2,,,,,,,,,,,,,,,,,2023,2019,,Casalino,,,Rocca le Caminate,Romagna,,15,Merlot 100%,Filetto di manzo in crosta alle erbette,,,82,nd,nd,,,,,14,1,,Acciaio 36 mesi e,,,,Italy,,,
2,,,,,,,,,,,,,,,,,2023,2020,,Romagna Sangiovese Ronco Dei Ciliegi,,,Ronchi di Castelluccio,Romagna,,52,Sangiovese 100%,Petto d’anatra laccato al miele,,,91,nd,nd,,,,,13,2,,Legno 10 mesi,,,"Rosso rubino luminoso. All’olfatto si rivela in punta di piedi: piccoli frutti rossi, violetta, toni di muschio, rabarbaro e chiodi di garofano. Rotondo al palato, gustoso, una raffinata trama tannica accompagna un finale bilanciato da un bel nerbo e da aromi di frutti rossi.",Italy,,,
2,,,,,,,,,,,,,,,,,2023,2021,,Romagna Sangiovese Le More,,,Ronchi di Castelluccio,Romagna,,52,Sangiovese 100%,Coda di rospo gratinata,,,89,nd,nd,,,,,13,2,,Legno 10 mesi,,,,Italy,,,
2,,,,,,,,,,,,,,,,,2023,2020,,Romagna Sangiovese Buco Del Prete,,,Ronchi di Castelluccio,Romagna,,52,Sangiovese 100%,Piccione al forno con cipollotti,,,86,nd,nd,,,,,13,2,,Legno 10 mesi,,,,Italy,,,
2,,,,,,,,,,,,,,,,,2023,2021,,Lunaria,,,Ronchi di Castelluccio,Romagna,,52,Sauvignon 100%,Linguine allo scoglio,,,86,nd,nd,,,,,13,2,,Legno 10 mesi,,,,Italy,,,
2,,,,,,,,,,,,,,,,,2023,2020,,Forli Bianco Sottovento,,,Ronchi di Castelluccio,Romagna,,52,Trebbiano 60% – Sauvignon 40%,Ravioli di ricotta e spinaci,,,82,nd,nd,,,,,13,2,,Legno 10 mesi,,,,Italy,,,
2,,,,,,,,,,,,,,,,,2023,2019,,Romagna Sangiovese Predappio San Joves,,,Sadivino,Romagna,,11,Sangiovese 100%,Quaglie alla cacciatora,,,89,nd,nd,,,,,14,5,,Acciaio 6 mesi e,,,"Legno 12 mesi Riflessi granato abbelliscono il cremisi. Ouverture in pompa magna: ciliegia e frutti di bosco, poi una spolverata di pepe nero, chiodi di garofano e tracce di caffè. Il sorso risulta pieno, di buona struttura. L’ordito tannico integrato, supportato dalla freschezza vibrante porta un allungo persistente.",Italy,,,
2,,,,,,,,,,,,,,,,,2023,2018,,Romagna Sangiovese Predappio Maestroso Riserva,,,Sadivino,Romagna,,11,Sangiovese 100%,Filetto di manzo in crosta alle erbette,,,86,nd,nd,,,,,14,5,,Acciaio 6 mesi e,,,,Italy,,,
2,,,,,,,,,,,,,,,,,2023,2018,,Romagna Sangiovese Superiore La Solfatara Riserva,,,Sadivino,Romagna,,11,Sangiovese 100%,Stracotto d'asino,,,86,nd,nd,,,,,14,5,,Acciaio 6 mesi e,,,,Italy,,,
2,,,,,,,,,,,,,,,,,2023,2020,,Sauvignon,,,Sadivino,Romagna,,11,Sauvignon 100%,Zuppetta di piselli e vongole,,,86,nd,nd,,,,,14,5,,Acciaio 6 mesi e,,,,Italy,,,
2,,,,,,,,,,,,,,,,,2023,2018,,Merlot,,,Sadivino,Romagna,,11,Merlot 100%,Coniglio al forno con patate,,,82,nd,nd,,,,,14,5,,Acciaio 6 mesi e,,,,Italy,,,
2,,,,,,,,,,,,,,,,,2023,2020,,Sabbia Gialla,,,Cantina San Biagio Vecchio,Romagna,,20,Albana 100%,Acciaio 6 mesi e Cemento 6 mesi Carré di maiale con patate al forno,,,89,nd,nd,,,,,,7,,Acciaio,,,"6 mesi e Cemento 6 mesi Oro splendente. Spartito odoroso che raccoglie pompelmo, camomilla, tiglio e fiori di campo, poi un contraltare di sbuffi di zafferano. Sferico l’abbrivio, gustoso, corroborato da una vena agrumata e lievemente astringente. Lunga e saporita la durata gustativa con ricordi di frutta croccante. Linguine alla granseola e rosmarino. ROMAGNA SANGIOVESE PORCALOCA! 2020 Rosso Doc Sangiovese 100% Alc. 13,5% | € 10 | Bt. 6.000 | Ferm. Acciaio e Cemento | Mat.",Italy,,,
2,,,,,,,,,,,,,,,,,2023,2019,,1978,,,San Patrignano,Romagna,,15,Cabernet franc 100%,Beccacce allo spiedo,,,89,nd,nd,,,,,14,7,,Legno 4 mesi,,,"Rubino vivace. L’apertura olfattiva si palesa con tratti varietali: ribes, liquirizia, alloro e una leggera striatura di menta selvatica. Immediata l’idea di classe, con il frutto ben esposto e una fattura acida tonificante. Tannini precisi, calibrati, dolci e levigati. Persistenza senza forzature.",Italy,,,
2,,,,,,,,,,,,,,,,,2023,2019,,Romagna Sangiovese Superiore Avi Riserva,,,San Patrignano,Romagna,,15,Sangiovese 100%,24 mesi Nodini di cinta senese lardellati al forno,,,89,nd,nd,,,,,14,7,,Legno 4 mesi,,,,Italy,,,
2,,,,,,,,,,,,,,,,,2023,2020,,Aulente Rosso,,,San Patrignano,Romagna,,15,Sangiovese 85% – altre varietà 15%,Legno 6 mesi Pappardelle con sugo di lepre,,,86,nd,nd,,,,,14,7,,Legno 4 mesi,,,,Italy,,,
2,,,,,,,,,,,,,,,,,2023,2020,,Colli Di Rimini Rosso Noi,,,San Patrignano,Romagna,,15,Sangiovese 70% – Cabernet sauvignon 15% – Merlot 15%,Carré di maiale affumicato,,,86,nd,nd,,,,,14,7,,Legno 4 mesi,,,,Italy,,,
2,,,,,,,,,,,,,,,,,2023,2021,,Aulente Bianco,,,San Patrignano,Romagna,,15,Chardonnay 70% – Sauvignon 30%,Fritto di paranza,,,86,nd,nd,,,,,14,7,,Legno 4 mesi,,,,Italy,,,
2,,,,,,,,,,,,,,,,,2023,2019,,Colli Di Rimini Rosso Montepirolo,,,San Patrignano,Romagna,,15,Cabernet sauvignon 85% – Merlot 10% – Cabernet franc 5%,Tagliata al pepe verde,,,86,nd,nd,,,,,14,7,,Legno 4 mesi,,,,Italy,,,
2,,,,,,,,,,,,,,,,,2023,2020,,Romagna Sangiovese Superiore Carbognano,,,Tenuta Carbognano,Romagna,,10,Sangiovese 100%,Entrecôte alla griglia con scaglie di formaggio,,,89,nd,nd,,,,,,9,,Cemento 3 mesi,,,"Veste rosso rubino con screziature porpora. Naso ben definito dalle origini varietali, ciliegia croccante, prugna e viola, seguiti da un accento di liquirizia. Al palato la tessitura acida rinvigorisce il corpo e il tannino rotondo dona eleganza, in un lungo duetto che trova epilogo su toni fruttati.",Italy,,,
2,,,,,,,,,,,,,,,,,2023,2019,,Romagna Sangiovese Superiore Amen Riserva,,,Tenuta Carbognano,Romagna,,10,Sangiovese 100%,Lombata di vitello su letto di cipolline saltate,,,86,nd,nd,,,,,,9,,Cemento 3 mesi,,,,Italy,,,
2,,,,,,,,,,,,,,,,,2023,2021,,Colli Romagna Centrale Trebbiano Vigna Cavaliere Bianco,,,Tenuta Casali,Romagna,,13,Trebbiano 100%,Tacchinella ripiena su letto di patate,,,91,nd,nd,,,,,14,6,,Acciaio 6 mesi,,,"Paglierino cangiante. Impronta olfattiva tinta di giovinezza e intensità: un mazzo di fiori di campo, magnolia, gelsomino, poi pesca bianca, agrume e salvia. Assaggio di carattere, saporito, pervaso da una vena acida che invoglia la beva. Il sapido finale lascia spazio ai ricordi di pesca.",Italy,,,
2,,,,,,,,,,,,,,,,,2023,2019,,Romagna Sangiovese Superiore San Vicinio Quartosole Riserva,,,Tenuta Casali,Romagna,,13,Sangiovese 100%,Piccione al forno con cipollotti,,,89,nd,nd,,,,,14,6,,Acciaio 6 mesi,,,,Italy,,,
2,,,,,,,,,,,,,,,,,2023,2019,,Romagna Sangiovese Superiore Vigna Baruccia,,,Tenuta Casali,Romagna,,13,Sangiovese 100%,10 mesi e Legno 6 mesi Carré di maiale al forno con mele renette,,,89,nd,nd,,,,,14,6,,Acciaio 6 mesi,,,,Italy,,,
2,,,,,,,,,,,,,,,,,2023,2019,,Colli Romagna Centrale Cabernet Sauvignon Vigna Damianus Riserva,,,Tenuta Casali,Romagna,,13,Cabernet sauvignon 100%,Legno 12 mesi Strudel di porcini e zucca con crema al Parmigiano,,,89,nd,nd,,,,,14,6,,Acciaio 6 mesi,,,,Italy,,,
2,,,,,,,,,,,,,,,,,2023,2021,,Famoso,,,Tenuta Casali,Romagna,,13,Famoso 100%,Risotto con gamberi di fiume e piselli,,,89,nd,nd,,,,,14,6,,Acciaio 6 mesi,,,,Italy,,,
2,,,,,,,,,,,,,,,,,2023,2021,,Romagna Albana Secco Valleripa,,,Tenuta Casali,Romagna,,13,Albana 100%,Ravioli di patate e baccalà,,,86,nd,nd,,,,,14,6,,Acciaio 6 mesi,,,,Italy,,,
2,,,,,,,,,,,,,,,,,2023,2020,,Romagna Sangiovese Bertinoro Torre Di Roversano,,,Tenuta Il Plino,Romagna,,15,Sangiovese 90% – Cabernet sauvignon 10%,Filetto al vino rosso e scalogno,,,91,nd,nd,,,,,14,1,,Legno 6 mesi,,,"Rosso rubino con riflessi violacei. Il ventaglio odoroso spazia tra prugne e more, fiori di violetta e iris, chiodi di garofano liquirizia e pepe nero. Il gusto è dominato da pienezza, il tannino ben cesellato supportato da freschezza porta un allungo dai piacevoli accenni di rosacee.",Italy,,,
2,,,,,,,,,,,,,,,,,2023,2019,,Romagna Albana Passito Mufato Del Plino,,,Tenuta Il Plino,Romagna,,15,Albana 100%,Blu di capra,,,89,nd,nd,,,,,14,1,,Legno 6 mesi,,,,Italy,,,
2,,,,,,,,,,,,,,,,,2023,2018,,Romagna Sangiovese Naso Di Falco Riserva,,,Tenuta Il Plino,Romagna,,15,Sangiovese 85% – Cabernet sauvignon 15%,Filetto di maiale lardellato,,,89,nd,nd,,,,,14,1,,Legno 6 mesi,,,,Italy,,,
2,,,,,,,,,,,,,,,,,2023,2020,,Romagna Albana Secco Interra,,,Tenuta La Viola,Romagna,,23,Albana 100%,Pollo alle mandorle e curcuma,,,89,nd,nd,,,,,14,6,,Legno 14 mesi,,,,Italy,,,
2,,,,,,,,,,,,,,,,,2023,2020,,Romagna Sangiovese Bertinoro Il Colombarone,,,Tenuta La Viola,Romagna,,23,Sangiovese 100%,Legno 6 mesi e Cemento 6 mesi Pappardelle con sugo di lepre,,,89,nd,nd,,,,,14,6,,Legno 14 mesi,,,,Italy,,,
2,,,,,,,,,,,,,,,,,2023,2020,,Romagna Sangiovese Bertinoro Interra,,,Tenuta La Viola,Romagna,,23,Sangiovese 100%,Costata di manzo alla griglia,,,86,nd,nd,,,,,14,6,,Legno 14 mesi,,,,Italy,,,
2,,,,,,,,,,,,,,,,,2023,2021,,Romagna Albana Secco Frangipane,,,Tenuta La Viola,Romagna,,23,Albana 100%,Cemento 6 mesi Filetto di branzino gratinato,,,86,nd,nd,,,,,14,6,,Legno 14 mesi,,,,Italy,,,
2,,,,,,,,,,,,,,,,,2023,2021,,Romagna Sangiovese Superiore Oddone,,,Tenuta La Viola,Romagna,,23,Sangiovese 100%,Carré di maiale al forno con mele renette,,,82,nd,nd,,,,,14,6,,Legno 14 mesi,,,,Italy,,,
2,,,,,,,,,,,,,,,,,2023,2016,,Colli D’Imola Rosso Dracone Riserva,,,Tenuta Palazzona di Maggio,Romagna,,30,Cabernet franc 45% – Merlot 45% – Petit verdot 10%,Costoletta di vitello alla milanese,,,86,nd,nd,,,,,14,2,,Acciaio 5 mesi e,,,"Legno 24 mesi Rubino di ottima consistenza. Un profilo olfattivo di qualità che dona cenni di ribes, rabarbaro, bacche di ginepro, fiori essiccati, spezie e more di rovo. Assaggio appagante, tornito e spigliato, dal tannino energico. Con pseudocalore contrapposto alla freschezza che conduce al succoso frutto.",Italy,,,
2,,,,,,,,,,,,,,,,,2023,2018,,Colli D’Imola Rosso Dracone,,,Tenuta Palazzona di Maggio,Romagna,,30,Merlot 50% – Cabernet franc 38% – Petit verdot 12%,Legno 18 mesi Tacchinella ripiena su letto di patate,,,86,nd,nd,,,,,14,2,,Acciaio 5 mesi e,,,,Italy,,,
2,,,,,,,,,,,,,,,,,2023,2021,,Colli D’Imola Chardonnay Maleto,,,Tenuta Palazzona di Maggio,Romagna,,30,Chardonnay 100%,Rombo al forno ai sapori mediterranei,,,82,nd,nd,,,,,14,2,,Acciaio 5 mesi e,,,,Italy,,,
2,,,,,,,,,,,,,,,,,2023,2021,,Aspro,,,Tenuta Palazzona di Maggio,Romagna,,30,Sangiovese 100%,Timballo di riso e gamberi,,,82,nd,nd,,,,,14,2,,Acciaio 5 mesi e,,,,Italy,,,
2,,,,,,,,,,,,,,,,,2023,2020,,Ulziano,,,Tenuta Palazzona di Maggio,Romagna,,30,Sangiovese 90% – Ciliegiolo 10%,Caciocavallo podolico,,,82,nd,nd,,,,,14,2,,Acciaio 5 mesi e,,,,Italy,,,
2,,,,,,,,,,,,,,,,,2023,2019,,Romagna Sangiovese Predappio Dante 1872 Riserva,,,Tenuta Piccolo Brunelli,Romagna,,17,Sangiovese 100%,Filetto di capriolo ai mirtilli,,,91,nd,nd,,,,,,1,,Legno 12 mesi,,,"Rosso granato vivo. Dispiega uno sfaccettato spettro odoroso, con ricordi di frutti di bosco, violetta, erbe aromatiche, chiodi di garofano e tabacco. Il sorso è caratterizzato dall’intreccio fresco-sapido, oltre che da tannino di ottima fattura. Disinvolto e durevole, propone una chiosa di frutti rossi.",Italy,,,
2,,,,,,,,,,,,,,,,,2023,2020,,Romagna Sangiovese Predappio Cesco 1938,,,Tenuta Piccolo Brunelli,Romagna,,17,Sangiovese 100%,Filetto di maiale alla senape,,,89,nd,nd,,,,,,1,,Legno 12 mesi,,,,Italy,,,
2,,,,,,,,,,,,,,,,,2023,2020,,Romagna Sangiovese Superiore Pietro 1904,,,Tenuta Piccolo Brunelli,Romagna,,17,Sangiovese 100%,Manzo brasato con funghi,,,89,nd,nd,,,,,,1,,Legno 12 mesi,,,,Italy,,,
2,,,,,,,,,,,,,,,,,2023,2021,,Anna,,,Tenuta Piccolo Brunelli,Romagna,,17,Chardonnay 60% – Riesling 40%,Fiori di zucca ripieni di ricotta e acciughe,,,82,nd,nd,,,,,,1,,Legno 12 mesi,,,,Italy,,,
2,,,,,,,,,,,,,,,,,2023,2017,,Santa Lucia Extra Brut Blanc De Noir,,,Tenuta Santa Lucia,Romagna,,20,Sangiovese 100%,Risotto alla pescatora,,,89,nd,nd,,,,,14,13,,Acciaio 6 mesi |,,,"46 mesi sui lieviti Una catenella durevole inonda il paglierino di luce. Pompelmo, tarassaco, fiori di campo e piccoli frutti rossi raccontano un naso ricco che chiude su sensazioni di lieviti. Cremoso il palato, dai tratti fresco-sapidi gustosi che si fanno preludio di una persistenza giocata sulle erbe aromatiche.",Italy,,,
2,,,,,,,,,,,,,,,,,2023,2021,,Famous,,,Tenuta Santa Lucia,Romagna,,20,Famoso 100%,Cotolette di pollo con melanzane e provola,,,89,nd,nd,,,,,14,13,,Acciaio 6 mesi |,,,,Italy,,,
2,,,,,,,,,,,,,,,,,2023,2020,,Paride Sangiovese,,,Tenuta Santa Lucia,Romagna,,20,Sangiovese 100%,000 Pollo fritto,,,89,nd,nd,,,,,14,13,,Acciaio 6 mesi |,,,,Italy,,,
2,,,,,,,,,,,,,,,,,2023,2021,,Romagna Albana Secco Albarara,,,Tenuta Santa Lucia,Romagna,,20,Albana 100%,Mortadella Bologna,,,86,nd,nd,,,,,14,13,,Acciaio 6 mesi |,,,,Italy,,,
2,,,,,,,,,,,,,,,,,2023,2020,,Romagna Albana Secco Amorosa,,,Tenuta Uccellina,Romagna,,11,Albana 100%,Rombo al forno ai sapori mediterranei,,,89,nd,nd,,,,,13,1,,Acciaio 6 mesi,,,"Color oro di magnifica stoffa. Racconti di frutta gialla, rosmarino, lavanda, ginestra e iodio si susseguono in un olfatto sapiente. Bocca gustosa e salina caratterizzata da leggera astringenza e da freschezza incisiva bilanciata da una gradevole alcolicità. Convincente il ritorno di erbe aromatiche.",Italy,,,
2,,,,,,,,,,,,,,,,,2023,2021,,Rambéla,,,Tenuta Uccellina,Romagna,,11,Famoso 100%,Battuto di gamberi rossi di Sicilia,,,89,nd,nd,,,,,13,1,,Acciaio 6 mesi,,,,Italy,,,
2,,,,,,,,,,,,,,,,,2023,2020,,Romagna Sangiovese Superiore Clivo Del Re,,,Tenuta Uccellina,Romagna,,11,Sangiovese 100%,Legno 8 mesi Stracotto d'asino,,,89,nd,nd,,,,,13,1,,Acciaio 6 mesi,,,,Italy,,,
2,,,,,,,,,,,,,,,,,2023,2020,,Romagna Trebbiano Hermes,,,Tenuta Uccellina,Romagna,,11,Trebbiano 100%,"6 mesi Riso, cozze e zafferano",,,86,nd,nd,,,,,13,1,,Acciaio 6 mesi,,,,Italy,,,
2,,,,,,,,,,,,,,,,,2023,2019,,Romagna Sangiovese Superiore Ghineo Riserva,,,Tenuta Uccellina,Romagna,,11,Sangiovese 100%,Arista di maiale con salsa di prugne,,,82,nd,nd,,,,,13,1,,Acciaio 6 mesi,,,,Italy,,,
2,,,,,,,,,,,,,,,,,2023,2021,,Nanì,,,Tenuta Villa Rovere,Romagna,,9,Sauvignon 100%,Filetto di branzino gratinato,,,86,nd,nd,,,,,,7,,Acciaio 6 mesi e,,,"Legno 6 mesi Giallo paglierino lucente. Regala riverberi di erbe aromatiche quali salvia e rosmarino, pesca gialla matura, poi stuzzicanti ricordi di mango. Al palato è morbido, rivela acidità e sapidità subito bilanciate da un ideale pseudocalore. Si congeda aggraziato su appunti di frutta tropicale.",Italy,,,
2,,,,,,,,,,,,,,,,,2023,2018,,Pirro,,,Tenuta Villa Rovere,Romagna,,9,Merlot 100%,Filetto di scottona in sfoglia,,,86,nd,nd,,,,,,7,,Acciaio 6 mesi e,,,,Italy,,,
2,,,,,,,,,,,,,,,,,2023,2020,,Tito,,,Tenuta Villa Rovere,Romagna,,9,Cabernet sauvignon 85% – Syrah 10% – Centesimino 5%,wineryname Tenuta Villa Rovere (2004) wineryname,,,82,nd,nd,,,,,,7,,Acciaio 6 mesi e,,,,Italy,,,
2,,,,,,,,,,,,,,,,,2023,2020,,Giulì,,,Tenuta Villa Rovere,Romagna,,9,,,,,82,nd,nd,,,,,,7,,Acciaio 6 mesi e,,,,Italy,,,
