Entry,Ref,OLDRS,RANK,RS,RAWQP,QPRANK,QP,RANK2,RS2,RAWQP2,QP2,RANK3,RS3,RAWQP3,QP3,RawAvg,RatingYear,Vintage,Qterms,FullName,AppellationLevel,AppellationName,WineryName,Region,EvaluationAvg,Price,Grapes,Pairing,ScoreAvg,EvaluationAIS,ScoreAIS,EvaluationGR,ScoreGR,SLC,TLC,WineTypeIT,WineType,Alcohol,Bottles,AgingMonths,AgingTypeIT,AgingType,Notes,Tasting Notes,Country,VintageNV,Method,Sweetness
2,,,,,,,,,,,,,,,,,2023,2020,,Santa Paolina 17,,,Accattoli,Marche,,22,Montepulciano 80% – Cabernet sauvignon 20%,Tagliata al pepe verde,,,89,nd,nd,,,,,13,1,,Acciaio 12 mesi,,,"Rosso rubino fitto con riflessi granato. Olfatto piacevolmente complesso, su ricordi di geranio, rosa rossa, alloro, chiodi di garofano, visciola, amarena e ribes. Il sorso ampio e bilanciato evidenzia un tannino in evoluzione e un’apprezzabile morbidezza. Lungo epilogo fruttato.",Italy,,,
2,,,,,,,,,,,,,,,,,2023,2021,,Rosso Del Monte,,,Accattoli,Marche,,22,Montepulciano 50% – Merlot 30% – Cabernet sauvignon 20%,Carré di maiale con patate al forno,,,89,nd,nd,,,,,13,1,,Acciaio 12 mesi,,,,Italy,,,
2,,,,,,,,,,,,,,,,,2023,2021,,Amphorae,,,Accattoli,Marche,,22,Cabernet sauvignon 50% – Petit verdot 50%,Straccetti di vitello al rosmarino,,,86,nd,nd,,,,,13,1,,Acciaio 12 mesi,,,,Italy,,,
2,,,,,,,,,,,,,,,,,2023,2021,,Rosso Piceno Il Poggio Infinito,,,Accattoli,Marche,,22,Montepulciano 50% – Sangiovese 50%,Tartare di manzo,,,82,nd,nd,,,,,13,1,,Acciaio 12 mesi,,,,Italy,,,
2,,,,,,,,,,,,,,,,,2023,2021,,Miracolo,,,Accattoli,Marche,,22,Maceratino 100%,Insalata di mare,,,82,nd,nd,,,,,13,1,,Acciaio 12 mesi,,,,Italy,,,
2,,,,,,,,,,,,,,,,,2023,2021,,Colli Maceratesi Ribona,,,Accattoli,Marche,,22,Maceratino 100%,Spiedo di seppioline ai ferri,,,82,nd,nd,,,,,13,1,,Acciaio 12 mesi,,,,Italy,,,
2,,,,,,,,,,,,,,,,,2023,2019,,Isra,,,Maria Letizia Allevi,Marche,,90,Alicante 100%,Capriolo con salsa di ribes rosso,,,91,nd,nd,,,,,14,0,,Legno 24 mesi,,,"Rubino luminoso. Corteo olfattivo sontuoso, articolato tra resina, radici amare, spezie dolci penetranti. Etereo di iodio e goudron, poi tabacco biondo e tutto il floreale e la frutta rossa percepibili. In bocca è carnoso, dominio di morbidezza, calore alcolico e tannino vellutato. Equilibrio e armonia totali.",Italy,,,
2,,,,,,,,,,,,,,,,,2023,2019,,Offida Rosso Mida,,,Maria Letizia Allevi,Marche,,90,Montepulciano 100%,Involtini di vitello lardellati,,,89,nd,nd,,,,,14,0,,Legno 24 mesi,,,,Italy,,,
2,,,,,,,,,,,,,,,,,2023,2021,,Offida Pecorino Mida,,,Maria Letizia Allevi,Marche,,90,Pecorino 100%,Tortelli di zucca e salvia,,,86,nd,nd,,,,,14,0,,Legno 24 mesi,,,,Italy,,,
2,,,,,,,,,,,,,,,,,2023,2016,,Arsi,,,Maria Letizia Allevi,Marche,,90,,,,,91,nd,nd,,,,,14,0,,Legno 24 mesi,,,,Italy,,,
2,,,,,,,,,,,,,,,,,2023,2016,,Offida Rosso Mida,,,Maria Letizia Allevi,Marche,,90,,,,,89,nd,nd,,,,,14,0,,Legno 24 mesi,,,,Italy,,,
2,,,,,,,,,,,,,,,,,2023,2019,,Rosso Conero Primo Di Tre,,,Angeli di Varano,Marche,,13,Montepulciano 100%,Pluma di maialino Bellota con cipolle caramellate,,,89,nd,nd,,,,,12,9,,Acciaio 12 mesi,,,"Rosso rubino luminoso. Profumi di amarena, more e rosa con tratti di cannella. In bocca è intenso e avvolgente, con una tannicità energica ma gradevole e una decisa freschezza che fanno presagire un ottimo potenziale evolutivo. Lunga persistenza costellata da aromi fruttati e di pepe nero.",Italy,,,
2,,,,,,,,,,,,,,,,,2023,2021,,Fuorilegge,,,Angeli di Varano,Marche,,13,Sauvignon 50% – Verdicchio 50%,Carpaccio di crostacei su mela verde,,,86,nd,nd,,,,,12,9,,Acciaio 12 mesi,,,,Italy,,,
2,,,,,,,,,,,,,,,,,2023,2021,,Pinkonero,,,Angeli di Varano,Marche,,13,Montepulciano 100%,Speck dell’Alto Adige,,,82,nd,nd,,,,,12,9,,Acciaio 12 mesi,,,,Italy,,,
2,,,,,,,,,,,,,,,,,2023,2018,,Offida Rosso Barricadiero,,,Aurora,Marche,,22,Montepulciano 100%,Filetto al vino rosso e scalogno,,,89,nd,nd,,,,,14,2,,Legno 24 mesi,,,"Impenetrabile cremisi, molto compatto. Si annuncia con tostature di cacao, poi subentrano confetture di prugne e more, liquirizia e vaniglia, buccia di pomodoro e arancia sanguinella. Sorso materico, caldo, tannico, eppure fresco e sapido. Amabile l’indugiare sulla spezia.",Italy,,,
2,,,,,,,,,,,,,,,,,2023,2019,,Rosso Piceno Superiore,,,Aurora,Marche,,22,Montepulciano 70% – Sangiovese 30%,Fesa di vitello al latte,,,86,nd,nd,,,,,14,2,,Legno 24 mesi,,,,Italy,,,
2,,,,,,,,,,,,,,,,,2023,2020,,Fiobbo,,,Aurora,Marche,,22,Pecorino 100%,e Legno 11 mesi Bucatini all'amatriciana,,,86,nd,nd,,,,,14,2,,Legno 24 mesi,,,,Italy,,,
2,,,,,,,,,,,,,,,,,2023,2021,,Falerio,,,Aurora,Marche,,22,Trebbiano 50% – Passerina 30% – Pecorino 20%,Linguine alla granseola e rosmarino,,,86,nd,nd,,,,,14,2,,Legno 24 mesi,,,,Italy,,,
2,,,,,,,,,,,,,,,,,2023,2021,,Rosso Piceno,,,Aurora,Marche,,22,Montepulciano 50% – Sangiovese 40% –,Gnocchi al ragù,,,86,nd,nd,,,,,14,2,,Legno 24 mesi,,,,Italy,,,
2,,,,,,,,,,,,,,,,,2023,2021,,Rosato,,,Aurora,Marche,,22,Ciliegiolo 60% – Montepulciano 40%,Tagliere di salumi,,,82,nd,nd,,,,,14,2,,Legno 24 mesi,,,,Italy,,,
2,,,,,,,,,,,,,,,,,2023,2018,,Verdicchio Di Matelica Noi 150 Riserva,,,Belisario,Marche,,25,Verdicchio 100%,Pesce spada gratinato,,,91,nd,nd,,,,,13,6,,Legno 24 mesi,,,"Oro luminoso. Miele, nespola e camomilla sono i protagonisti, seguiti da cenni di vaniglia e tracce salmastre. All’assaggio ha un’ottima struttura, con una squisita e maestosa alcolicità ben bilanciata dalla verve acida. Lunga e coinvolgente la chiosa costellata da aromi di mandorla tostata.",Italy,,,
2,,,,,,,,,,,,,,,,,2023,2019,,Verdicchio Di Matelica Cambrugiano Riserva,,,Belisario,Marche,,25,Verdicchio 100%,Acciaio 5 mesi Risotto alla granseola,,,89,nd,nd,,,,,13,6,,Legno 24 mesi,,,"e Legno 12 mesi Ricciola al forno con capperi e pomodori ciliegino. VERDICCHIO DI MATELICA VIGNETI B. 2021 Bianco Doc Verdicchio 100% Alc. 13,5% | € 12 | Bt. 50.000 | Ferm. Acciaio | Mat.",Italy,,,
2,,,,,,,,,,,,,,,,,2023,2021,,Colli Maceratesi Ribona Mareggiata Di Ribona,,,Belisario,Marche,,25,Maceratino 100%,Seppie ripiene su crema di ceci,,,86,nd,nd,,,,,13,6,,Legno 24 mesi,,,,Italy,,,
2,,,,,,,,,,,,,,,,,2023,2021,,Verdicchio Di Matelica Del Cerro,,,Belisario,Marche,,25,Verdicchio 100%,"Pasta, patate e cozze",,,86,nd,nd,,,,,13,6,,Legno 24 mesi,,,,Italy,,,
2,,,,,,,,,,,,,,,,,2023,2021,,Verdicchio Di Matelica Valbona,,,Belisario,Marche,,25,Verdicchio 100%,Ravioli di patate e baccalà,,,82,nd,nd,,,,,13,6,,Legno 24 mesi,,,,Italy,,,
2,,,,,,,,,,,,,,,,,2023,2021,,Colli Maceratesi Ribona,,,Boccadigabbia,Marche,,10,Maceratino 100%,Lasagnette con ragù di coniglio e crema di piselli,,,91,nd,nd,,,,,13,7,,Acciaio 4 mesi,,,"Brillante giallo sfumato di verde. Allude alle erbe aromatiche, racconta di fiori bianchi di sambuco e gelsomino, frutti tropicali e agrumi, poi toni di mandorla amara e minerali. Fresco, di buona sapidità e perfetto equilibrio. La lunga chiusura richiama gradevoli linee di armellina.",Italy,,,
2,,,,,,,,,,,,,,,,,2023,2017,,Cabernet Sauvignon Akronte,,,Boccadigabbia,Marche,,10,Cabernet sauvignon 100%,Legno 16 mesi Cinghiale in umido,,,89,nd,nd,,,,,13,7,,Acciaio 4 mesi,,,,Italy,,,
2,,,,,,,,,,,,,,,,,2023,2017,,Merlot Pix,,,Boccadigabbia,Marche,,10,Merlot 100%,Legno 16 mesi Filetto di vitello alla Rossini,,,89,nd,nd,,,,,13,7,,Acciaio 4 mesi,,,,Italy,,,
2,,,,,,,,,,,,,,,,,2023,2018,,Rosso Piceno,,,Boccadigabbia,Marche,,10,Montepulciano 60% – Sangiovese 40%,e Legno 10 mesi Tagliatelle al ragù,,,89,nd,nd,,,,,13,7,,Acciaio 4 mesi,,,,Italy,,,
2,,,,,,,,,,,,,,,,,2023,2021,,Pinot Nero Rosèo,,,Boccadigabbia,Marche,,10,Pinot nero 100%,Pizza con bufala e pomodorini,,,86,nd,nd,,,,,13,7,,Acciaio 4 mesi,,,,Italy,,,
2,,,,,,,,,,,,,,,,,2023,2019,,Verdicchio Dei Castelli Di Jesi Classico Superiore Oinochoe,,,Boccafosca,Marche,,11,Verdicchio 100%,Linguine allo scoglio,,,86,nd,nd,,,,,13,20,,Acciaio 12 mesi,,,"Giallo sole di buona compattezza. Ouverture erbacea con cenni odorosi di timo e limone. In successione compaiono pomacee, frutti tropicali, melone, anice e finocchietto. Il sorso è fresco, sapido e bilanciato. Sfocia in una buona persistenza ammandorlata.",Italy,,,
2,,,,,,,,,,,,,,,,,2023,2019,,Lacrima Di Morro D’Alba Superiore Superbo,,,Boccafosca,Marche,,11,Lacrima 100%,Gnocchi al ragù,,,86,nd,nd,,,,,13,20,,Acciaio 12 mesi,,,,Italy,,,
2,,,,,,,,,,,,,,,,,2023,2020,,Rosso Piceno Rubus,,,Boccafosca,Marche,,11,Montepulciano 70% – Sangiovese 30%,Risotto con le quaglie,,,86,nd,nd,,,,,13,20,,Acciaio 12 mesi,,,,Italy,,,
2,,,,,,,,,,,,,,,,,2023,2021,,Verdicchio Dei Castelli Di Jesi Classico Stellaria,,,Boccafosca,Marche,,11,Verdicchio 100%,Insalata di mare,,,82,nd,nd,,,,,13,20,,Acciaio 12 mesi,,,,Italy,,,
2,,,,,,,,,,,,,,,,,2023,2020,,Lacrima Di Morro D’Alba Nerium,,,Boccafosca,Marche,,11,Lacrima 100%,Salame felino,,,82,nd,nd,,,,,13,20,,Acciaio 12 mesi,,,,Italy,,,
2,,,,,,,,,,,,,,,,,2023,2020,,Verdicchio Di Matelica Vertis,,,Borgo Paglianetto,Marche,,19,Verdicchio 100%,Branzino al sale su letto di patate,,,86,nd,nd,,,,,13,20,,Acciaio 8 mesi,,,"Paglierino dai riflessi verdolini. Al naso spicca subito la mandorla verde, poi mimosa, tiglio, anice e un rimando di asparago. Equilibrio in bocca tra il calore alcolico e la freschezza con chiusura speziata di pepe bianco.",Italy,,,
2,,,,,,,,,,,,,,,,,2023,2021,,Verdicchio Di Matelica Petrara,,,Borgo Paglianetto,Marche,,19,Verdicchio 100%,Risotto agli scampi,,,86,nd,nd,,,,,13,20,,Acciaio 8 mesi,,,,Italy,,,
2,,,,,,,,,,,,,,,,,2023,2017,,Verdicchio Di Matelica Jera Riserva,,,Borgo Paglianetto,Marche,,19,Verdicchio 100%,Ricciola al forno con capperi e pomodori ciliegino,,,86,nd,nd,,,,,13,20,,Acciaio 8 mesi,,,,Italy,,,
2,,,,,,,,,,,,,,,,,2023,2021,,Verdicchio Di Matelica Terravignata,,,Borgo Paglianetto,Marche,,19,Verdicchio 100%,Cartoccio di pescatrice agli agrumi,,,86,nd,nd,,,,,13,20,,Acciaio 8 mesi,,,,Italy,,,
2,,,,,,,,,,,,,,,,,2023,2012,,Verdicchio Di Matelica Jera Riserva,,,Borgo Paglianetto,Marche,,19,,,,,91,nd,nd,,,,,13,20,,Acciaio 8 mesi,,,,Italy,,,
2,,,,,,,,,,,,,,,,,2023,2017,,Verdicchio Di Matelica Vertis,,,Borgo Paglianetto,Marche,,19,,,,,89,nd,nd,,,,,13,20,,Acciaio 8 mesi,,,,Italy,,,
2,,,,,,,,,,,,,,,,,2023,2020,,Verdicchio Dei Castelli Di Jesi Suprino,,,Broccanera,Marche,,14,Verdicchio 100%,Filetti di scorfano con carciofi,,,89,nd,nd,,,,,13,6,,Acciaio 6 mesi,,,"Giallo limone con filigrana oro. Sentori di mughetto, camomilla, mandorla tostata, vaniglia, zafferano, ananas e banana. In bocca si schiude in tutta la sua morbidezza, segue un amabile intreccio tra freschezza e sapidità. Vino di corpo, si congeda lento su aromi di mandorla.",Italy,,,
2,,,,,,,,,,,,,,,,,2023,2018,,Asco,,,Broccanera,Marche,,14,Merlot 50% – Syrah 50%,Brasato di manzo al vino rosso,,,89,nd,nd,,,,,13,6,,Acciaio 6 mesi,,,,Italy,,,
2,,,,,,,,,,,,,,,,,2023,2016,,Verdicchio Dei Castelli Di Jesi Spumante Dosaggio Zero,,,Broccanera,Marche,,14,Verdicchio 100%,60 mesi sui lieviti Risotto alla parmigiana,,,86,nd,nd,,,,,13,6,,Acciaio 6 mesi,,,,Italy,,,
2,,,,,,,,,,,,,,,,,2023,2021,,Scosso,,,Broccanera,Marche,,14,Verdicchio 100%,Verdure pastellate,,,82,nd,nd,,,,,13,6,,Acciaio 6 mesi,,,,Italy,,,
2,,,,,,,,,,,,,,,,,2023,2019,,Cana,,,Broccanera,Marche,,14,Verdicchio 100%,Torta salata alle zucchine e origano,,,82,nd,nd,,,,,13,6,,Acciaio 6 mesi,,,,Italy,,,
2,,,,,,,,,,,,,,,,,2023,2020,,Castelli Di Jesi Verdicchio Classico San Nicolò Riserva,,,Brunori,Marche,,14,Verdicchio 100%,Coda di rospo gratinata,,,89,nd,nd,,,,,14,1,,Cemento 12 mesi,,,"Giallo paglierino fitto fitto e impreziosito da screziature dorate. Albicocca candita, salvia e rosmarino con macchia mediterranea e mirto accompagnano al gusto, che si rivela caldo, glicerico ma bilanciato dalla presenza di una giusta componente fresco-sapida. Di buona struttura. Finale di albicocca.",Italy,,,
2,,,,,,,,,,,,,,,,,2023,2021,,Verdicchio Dei Castelli Di Jesi Classico Superiore San Nicolò,,,Brunori,Marche,,14,Verdicchio 100%,Spaghetti con vongole e bottarga,,,86,nd,nd,,,,,14,1,,Cemento 12 mesi,,,,Italy,,,
2,,,,,,,,,,,,,,,,,2023,2021,,Lacrima Di Morro D’Alba Alborada,,,Brunori,Marche,,14,Lacrima 100%,Carré di maiale al forno con mele renette,,,86,nd,nd,,,,,14,1,,Cemento 12 mesi,,,,Italy,,,
2,,,,,,,,,,,,,,,,,2023,2021,,Verdicchio Dei Castelli Di Jesi Classico Le Gemme,,,Brunori,Marche,,14,Verdicchio 100%,Filetti di pesce persico al burro e timo,,,86,nd,nd,,,,,14,1,,Cemento 12 mesi,,,,Italy,,,
2,,,,,,,,,,,,,,,,,2023,2020,,Verdicchio Dei Castelli Di Jesi Spumante Brut,,,Brunori,Marche,,14,Verdicchio 100%,Trofie al pesto,,,82,nd,nd,,,,,14,1,,Cemento 12 mesi,,,,Italy,,,
2,,,,,,,,,,,,,,,,,2023,2019,,Colli Pesaresi Rosso Balón,,,Bruscia,Marche,,14,Sangiovese 70% – altre varietà 30%,Fettuccine ai funghi porcini,,,89,nd,nd,,,,,13,2,,   Acciaio    7    mesi    e,,,,Italy,,,
2,,,,,,,,,,,,,,,,,2023,2019,,Bianchello Del Metauro Superiore Lubác,,,Bruscia,Marche,,14,Bianchello 100%,e Legno 2 mesi Coniglio in umido alle erbe aromatiche,,,86,nd,nd,,,,,13,2,,   Acciaio    7    mesi    e,,,,Italy,,,
2,,,,,,,,,,,,,,,,,2023,2021,,Bianchello Del Metauro Superiore Mo Leone,,,Bruscia,Marche,,14,Bianchello 100%,Risotto ai frutti di mare,,,86,nd,nd,,,,,13,2,,   Acciaio    7    mesi    e,,,,Italy,,,
2,,,,,,,,,,,,,,,,,2023,2021,,Túf Senza Solfiti Aggiunti,,,Bruscia,Marche,,14,Sangiovese 100%,Coppa piacentina,,,86,nd,nd,,,,,13,2,,   Acciaio    7    mesi    e,,,,Italy,,,
2,,,,,,,,,,,,,,,,,2023,2019,,Castelli Di Jesi Verdicchio Classico Villa Bucci Riserva,,,Bucci,Marche,,62,Verdicchio 100%,Rollè di cernia con patate al rosmarino,,,91,nd,nd,,,,,13,9,,Legno 18 mesi,,,"Paglierino. All’olfatto mostra eleganza, pulizia e complessità. Si riconoscono sambuco, basilico, anice, mela cotogna, cedro e lime. Al palato è di spiccata personalità, si ripetono lentamente tutte le sensazioni catturate al naso. Un vino teso, verticale, dalla sapidità importante e dalle ottime performance evolutive.",Italy,,,
2,,,,,,,,,,,,,,,,,2023,2021,,Verdicchio Dei Castelli Di Jesi Classico Superiore,,,Bucci,Marche,,62,Verdicchio 100%,Carpaccio di crostacei su mela verde,,,86,nd,nd,,,,,13,9,,Legno 18 mesi,,,,Italy,,,
2,,,,,,,,,,,,,,,,,2023,2021,,Lacrima Di Morro D’Alba,,,Buscareto,Marche,,9,Lacrima 100%,Carré di maiale con patate al forno,,,89,nd,nd,,,,,14,25,,Acciaio 6 mesi,,,"Manto rosso porpora di pregiata stoffa, impenetrabile. Estremamente fine al naso, offre un ventaglio di fragranze che spaziano dalla vaniglia al petalo di rosa, cui si aggiungono suggestioni di ciliegia e di foglia di geranio. Al gusto il tannino è vellutato e il sorso rotondo. Finale di viola.",Italy,,,
2,,,,,,,,,,,,,,,,,2023,2019,,Bisaccione,,,Buscareto,Marche,,9,Montepulciano 70% – Cabernet sauvignon 30%,Filetto di manzo in crosta alle erbette,,,89,nd,nd,,,,,14,25,,Acciaio 6 mesi,,,,Italy,,,
2,,,,,,,,,,,,,,,,,2023,2020,,Verdicchio Dei Castelli Di Jesi Ammazzaconte,,,Buscareto,Marche,,9,Verdicchio 100%,e Legno 12 mesi Tortelli di zucca e salvia,,,86,nd,nd,,,,,14,25,,Acciaio 6 mesi,,,,Italy,,,
2,,,,,,,,,,,,,,,,,2023,2021,,Verdicchio Dei Castelli Di Jesi,,,Buscareto,Marche,,9,Verdicchio 100%,Risotto agli asparagi e frutti di mare,,,86,nd,nd,,,,,14,25,,Acciaio 6 mesi,,,,Italy,,,
2,,,,,,,,,,,,,,,,,2023,2019,,Lacrima Di Morro D’Alba Superiore Compagnia,,,Buscareto,Marche,,9,Lacrima 100%,Legno 8 mesi Cotechino e lenticchie,,,86,nd,nd,,,,,14,25,,Acciaio 6 mesi,,,,Italy,,,
2,,,,,,,,,,,,,,,,,2023,2021,,Denan,,,Cantina Bastianelli,Marche,,13,Alicante 40% – Merlot 30% – Sangiovese 30%,Coppa piacentina,,,86,nd,nd,,,,,,3,,Acciaio 6 mesi,,,"Colore rosa cerasuolo limpido. Fini nuance di geranio, ciclamino, mandarino, fragola, uva spina. Gemma speziata di chiodi di garofano. L’assaggio è seducente, caldo, ma rivela anche grande freschezza e buona sapidità. Il lungo epilogo ricorda l’arancia amara.",Italy,,,
2,,,,,,,,,,,,,,,,,2023,2021,,Malvasia Bianca Di Candia Cretico,,,Cantina Bastianelli,Marche,,13,Malvasia bianca di Candia 100%,Robiola di Roccaverano,,,86,nd,nd,,,,,,3,,Acciaio 6 mesi,,,,Italy,,,
2,,,,,,,,,,,,,,,,,2023,2021,,Falerio Pecorino Ribelle,,,Cantina Bastianelli,Marche,,13,Pecorino 100%,Spaghetti con mazzancolle e pomodorini,,,86,nd,nd,,,,,,3,,Acciaio 6 mesi,,,,Italy,,,
2,,,,,,,,,,,,,,,,,2023,2019,,Rosso Piceno Superiore Castellano,,,Cantina dei Colli Ripani,Marche,,18,Montepulciano 60% – Sangiovese 40%,Quaglie alla cacciatora,,,89,nd,nd,,,,,14,8,,Legno 18 mesi,,,"Rosso rubino dai lampi granato. Sfumature evolute di prugna rossa e di vaniglia si muovono tra lo smalto e il balsamico e chiudono sui toni ferrosi. Sapido e con discreta freschezza, il tannino è vivo ma suadente, con un equilibrio centrato. La chiusura è mentolata e sa di visciola in confettura.",Italy,,,
2,,,,,,,,,,,,,,,,,2023,2017,,Diavolo E Vento,,,Cantina dei Colli Ripani,Marche,,18,Montepulciano 85% – Cabernet sauvignon 15%,Ravioli al sugo di chianina e tartufo nero,,,86,nd,nd,,,,,14,8,,Legno 18 mesi,,,,Italy,,,
2,,,,,,,,,,,,,,,,,2023,2021,,Falerio Pecorino,,,Cantina dei Colli Ripani,Marche,,18,Pecorino 100%,Cotoletta di tonno al sesamo,,,86,nd,nd,,,,,14,8,,Legno 18 mesi,,,,Italy,,,
2,,,,,,,,,,,,,,,,,2023,2021,,Offida Passerina Lajella,,,Cantina dei Colli Ripani,Marche,,18,Passerina 100%,"Frittura di calamari, gamberi e zucchine",,,86,nd,nd,,,,,14,8,,Legno 18 mesi,,,,Italy,,,
2,,,,,,,,,,,,,,,,,2023,2021,,Offida Pecorino Mercantino,,,Cantina dei Colli Ripani,Marche,,18,Pecorino 100%,Spaghetti con vongole veraci,,,82,nd,nd,,,,,14,8,,Legno 18 mesi,,,,Italy,,,
2,,,,,,,,,,,,,,,,,2023,2019,,Castelli Di Jesi Verdicchio Classico Crisio Riserva,,,Casalfarneto,Marche,,20,Verdicchio 100%,Ravioli di pesce con sugo di canestrelli,,,91,nd,nd,,,,,15,6,,Acciaio 12 mesi,,,"Paglierino luminoso. Apre, dapprima timido, con un cespuglio di fiori di acacia e di lavanda. Poi lime e mentuccia. All’assaggio, il rapporto tra morbidezza e freschezza permette il raggiungimento dell’equilibrio. Nel retrogusto emerge un cenno di mandorla e di biscotti al burro.",Italy,,,
2,,,,,,,,,,,,,,,,,2023,2019,,Cimaio,,,Casalfarneto,Marche,,20,Verdicchio 100%,mesi e Legno 6 mesi Storico Ribelle,,,89,nd,nd,,,,,15,6,,Acciaio 12 mesi,,,,Italy,,,
2,,,,,,,,,,,,,,,,,2023,2020,,Verdicchio Dei Castelli Di Jesi Classico Superiore Grancasale,,,Casalfarneto,Marche,,20,Verdicchio 100%,Acciaio 6 mesi e Legno 6 mesi Bocconcini di rana pescatrice in crosta di mandorle,,,89,nd,nd,,,,,15,6,,Acciaio 12 mesi,,,,Italy,,,
2,,,,,,,,,,,,,,,,,2023,2021,,Verdicchio Dei Castelli Di Jesi Classico Superiore Fontevecchia,,,Casalfarneto,Marche,,20,Verdicchio 100%,Spiedo di seppioline ai ferri,,,86,nd,nd,,,,,15,6,,Acciaio 12 mesi,,,,Italy,,,
2,,,,,,,,,,,,,,,,,2023,2021,,Verdicchio Dei Castelli Di Jesi Classico Diego,,,Casalfarneto,Marche,,20,Verdicchio 100%,Linguine al sugo di totani e piselli,,,86,nd,nd,,,,,15,6,,Acciaio 12 mesi,,,,Italy,,,
2,,,,,,,,,,,,,,,,,2023,2020,,Otto Borghi,,,Casalfarneto,Marche,,20,Montepulciano 50% – Cabernet sauvignon 25% – Merlot 25%,Cosciotto di maiale farcito,,,86,nd,nd,,,,,15,6,,Acciaio 12 mesi,,,,Italy,,,
2,,,,,,,,,,,,,,,,,2023,2019,,Coriolano,,,Casalis Douhet,Marche,,10,Merlot 50% – Cabernet sauvignon 30% – Montepulciano 20%,,,,89,nd,nd,,,,,13,6,,   Acciaio    8    mesi    e,,,,Italy,,,
2,,,,,,,,,,,,,,,,,2023,2019,,Rosso Piceno Giulio Douhet,,,Casalis Douhet,Marche,,10,Montepulciano 60% – Sangiovese 40%,Legno 14 mesi Grigliata di carne con salsa barbecue,,,89,nd,nd,,,,,13,6,,   Acciaio    8    mesi    e,,,,Italy,,,
2,,,,,,,,,,,,,,,,,2023,2021,,Merlot Colosimo,,,Casalis Douhet,Marche,,10,Merlot 100%,Tagliata al pepe verde,,,86,nd,nd,,,,,13,6,,   Acciaio    8    mesi    e,,,,Italy,,,
2,,,,,,,,,,,,,,,,,2023,2021,,Colli Maceratesi Ribona Villa Casalis,,,Casalis Douhet,Marche,,10,Maceratino 100%,Risotto con gamberi di fiume e piselli,,,86,nd,nd,,,,,13,6,,   Acciaio    8    mesi    e,,,,Italy,,,
2,,,,,,,,,,,,,,,,,2023,2021,,Passerina Nuà,,,Casalis Douhet,Marche,,10,Passerina 100%,Linguine agli scampi,,,82,nd,nd,,,,,13,6,,   Acciaio    8    mesi    e,,,,Italy,,,
2,,,,,,,,,,,,,,,,,2023,2021,,Offida Pecorino Montemisio,,,"Castignano, Cantine dal 1960",Marche,,12,Pecorino 100%,Filetto di orata in crosta di mandorle e patate,,,89,nd,nd,,,,,13,120,,Acciaio 6 mesi,,,"Paglierino con mirabile venatura verdolina. Al naso esordisce timido con ginestra, biancospino e pesca matura. Seguono erbe aromatiche, dragoncello, erba tagliata e lime. Al palato sfoggia croccante freschezza, regala sapore e gustose sensazioni agrumate nell’avvincente chiusura sapida.",Italy,,,
2,,,,,,,,,,,,,,,,,2023,2021,,Offida Pecorino,,,"Castignano, Cantine dal 1960",Marche,,12,Pecorino 100%,Scampi alla griglia,,,86,nd,nd,,,,,13,120,,Acciaio 6 mesi,,,,Italy,,,
2,,,,,,,,,,,,,,,,,2023,2021,,Falerio Pecorino Destriero,,,"Castignano, Cantine dal 1960",Marche,,12,Pecorino 100%,Linguine allo scoglio,,,86,nd,nd,,,,,13,120,,Acciaio 6 mesi,,,,Italy,,,
2,,,,,,,,,,,,,,,,,2023,2021,,Offida Passerina,,,"Castignano, Cantine dal 1960",Marche,,12,Passerina 100%,Canapè di pasta sfoglia al formaggio,,,86,nd,nd,,,,,13,120,,Acciaio 6 mesi,,,,Italy,,,
2,,,,,,,,,,,,,,,,,2023,2020,,Rosso Piceno Superiore Destriero,,,"Castignano, Cantine dal 1960",Marche,,12,Montepulciano 50% – Sangiovese 50%,Legno 10 mesi Fettuccine al ragù d’agnello,,,86,nd,nd,,,,,13,120,,Acciaio 6 mesi,,,,Italy,,,
2,,,,,,,,,,,,,,,,,2023,2021,,Passerina,,,"Castignano, Cantine dal 1960",Marche,,12,Passerina 100%,Crespelle con asparagi e ricotta salata,,,86,nd,nd,,,,,13,120,,Acciaio 6 mesi,,,,Italy,,,
2,,,,,,,,,,,,,,,,,2023,2021,,Falerio Pecorino 003 Zerozerotre,,,[,Marche,,13,Pecorino 100%,Sogliola alla mugnaia,,,91,nd,nd,,,,,14,5,,Acciaio 6 mesi,,,"Verdolino smagliante. Biancospino, camomilla, foglie di tè verde, arancia, bergamotto. Folate salmastre. La succosa freschezza che si trasforma in un morbido abbraccio sorretto dalla bella componente alcolica. Ricco e avvolgente, è dotato di una lunga estensione che evidenzia rimandi agrumati.",Italy,,,
2,,,,,,,,,,,,,,,,,2023,2021,,Testamozza,,,[,Marche,,13,Syrah 45% – Terrano 30% – Sangiovese 25%,Rigatoni al ragù bianco di carne,,,89,nd,nd,,,,,14,5,,Acciaio 6 mesi,,,,Italy,,,
2,,,,,,,,,,,,,,,,,2023,2021,,Falerio Pecorino Gallicano,,,[,Marche,,13,Pecorino 100%,Acciaio 5 mesi 5 mesi sui lieviti Tartare di gamberi,,,89,nd,nd,,,,,14,5,,Acciaio 6 mesi,,,"Ravioli di magro con funghi chiodini. BE MY BABY EXTRA BRUT Rosato Metodo Martinotti Sangiovese 100% Alc. 12,5% | € 15 | Bt. 3.100 | Ferm. Terracotta | Mat.",Italy,,,
2,,,,,,,,,,,,,,,,,2023,2021,,Garofanata Extra Dry,,,[,Marche,,13,Garofanata 100%,5 mesi sui lieviti Crostini con burro e alici,,,86,nd,nd,,,,,14,5,,Acciaio 6 mesi,,,,Italy,,,
2,,,,,,,,,,,,,,,,,2023,2020,,Offida Pecorino Canapale Riserva,,,.,Marche,,40,Pecorino 100%,Asiago stravecchio,,,89,nd,nd,,,,,15,2,,Acciaio 6 mesi,,,"e Legno 6 mesi Dorato lucente. Incipit con percezioni di fieno e prato estivo; seguono camomilla, aghi di pino, frutta polpa gialla e agrumi canditi. Vaniglia e zucchero velo. Ben bilanciato al palato, morbidezza e freschezza si alternano per arrivare all’equilibrio. Lungheggia sui fiori di campo.",Italy,,,
2,,,,,,,,,,,,,,,,,2023,2021,,Offida Pecorino Canapale,,,.,Marche,,40,Pecorino 100%,Zuppa di pesce,,,86,nd,nd,,,,,15,2,,Acciaio 6 mesi,,,,Italy,,,
2,,,,,,,,,,,,,,,,,2023,2021,,Floralia,,,.,Marche,,40,Montepulciano 100%,Risotto con mazzancolle al profumo d'arancia,,,86,nd,nd,,,,,15,2,,Acciaio 6 mesi,,,,Italy,,,
2,,,,,,,,,,,,,,,,,2023,2021,,Offida Passerina Cimula,,,.,Marche,,40,Passerina 100%,Brie de Meaux,,,86,nd,nd,,,,,15,2,,Acciaio 6 mesi,,,,Italy,,,
2,,,,,,,,,,,,,,,,,2023,2017,,Primo Delia,,,.,Marche,,40,Cabernet 20% – Merlot 20% – Montepulciano 20% –,Acciaio 6 mesi e Legno 12 mesi Tagliatelle al ragù,,,86,nd,nd,,,,,15,2,,Acciaio 6 mesi,,,"Rosso Igt Cabernet 20%, Merlot 20%, Montepulciano 20%, Sangiovese 20%, Syrah 20% Alc. 15% | € 35 | Bt. 3.000 | Ferm. Acciaio | Mat. Centanni (2005)",Italy,,,
2,,,,,,,,,,,,,,,,,2023,2020,,Bianchello Del Metauro Superiore San Leone,,,Cignano,Marche,,14,Bianchello 100%,Linguine con bottarga e pomodori secchi,,,89,nd,nd,,,,,13,4,,Acciaio 8 mesi,,,"e Legno 8 mesi Omaggio alla mimosa. Un prato fiorito di gelsomino, zagara, ginestra, rosa gialla, poi mela Golden e pesca, infine vaniglia. Il sorso è giustamente fresco, goloso, equilibrato, ben strutturato e di apprezzabile estensione. Il finale è arricchito da appunti di melissa e salvia.",Italy,,,
2,,,,,,,,,,,,,,,,,2023,2019,,Colli Pesaresi Sangiovese Sottovento,,,Cignano,Marche,,14,Sangiovese 85% – Montepulciano 15%,e Legno 10 mesi Carré di maiale con patate al forno,,,86,nd,nd,,,,,13,4,,Acciaio 8 mesi,,,,Italy,,,
2,,,,,,,,,,,,,,,,,2023,2021,,Bianchello Del Metauro,,,Cignano,Marche,,14,Bianchello 100%,Acciaio 2 mesi 3 mesi sui lieviti Scampi alla griglia,,,82,nd,nd,,,,,13,4,,Acciaio 8 mesi,,,Seppie in umido con piselli. IRREQUIETO BRUT ROSÉ Rosato Metodo Martinotti Sangiovese 100% Alc. 12% | € 10 | Bt. 1.800 | Ferm. Acciaio | Mat.,Italy,,,
2,,,,,,,,,,,,,,,,,2023,2017,,Piceno Superiore Gotico,,,Ciù Ciù,Marche,,15,Montepulciano 70% – Sangiovese 30%,Filetto al vino rosso e scalogno,,,89,nd,nd,,,,,15,150,,Acciaio 6 mesi,,,"e Legno 12 mesi Rosso granato, quasi impenetrabile. Olfatto che gioca su toni cioccolatosi e tostati. Poi sottobosco, rosmarino, pepe nero e chiodi di garofano. Morbido all’assaggio, colpisce per l’elevata percezione alcolica. Struttura e trama tannica ben integrate, si allunga lentamente su riverberi balsamici.",Italy,,,
2,,,,,,,,,,,,,,,,,2023,2016,,Oppîdum,,,Ciù Ciù,Marche,,15,Montepulciano 100%,Acciaio 2 mesi 5 mesi sui lieviti Tartare di gamberi,,,89,nd,nd,,,,,15,150,,Acciaio 6 mesi,,,"Fiorentina alla brace. MERLETTAIE PECORINO BRUT Bianco Metodo Martinotti Pecorino 100% Alc. 12,5% | € 15 | Bt. 30.000 | Ferm. Acciaio | Mat.",Italy,,,
