Entry,Ref,OLDRS,RANK,RS,RAWQP,QPRANK,QP,RANK2,RS2,RAWQP2,QP2,RANK3,RS3,RAWQP3,QP3,RawAvg,RatingYear,Vintage,Qterms,FullName,AppellationLevel,AppellationName,WineryName,Region,EvaluationAvg,Price,Grapes,Pairing,ScoreAvg,EvaluationAIS,ScoreAIS,EvaluationGR,ScoreGR,SLC,TLC,WineTypeIT,WineType,Alcohol,Bottles,AgingMonths,AgingTypeIT,AgingType,Notes,Tasting Notes,Country,VintageNV,Method,Sweetness
2,,,,,,,,,,,,,,,,,2022,2022,,Oltrepò Pavese Metodo Classico Pinot Nero Brut Première Cuvée,,,Isimbarda,Lombardia,,14,Riesling renano 100%,Risotti di pesce,,,,nd,nd,,,,,13%,7,Acciaio 3 mesi,,,,,Italy,,,
2,,,,,,,,,,,,,,,,,2022,2022,,Oltrepò Pavese Metodo Classico Pinot Nero Brut Rosé Cruasé,,,Isimbarda,Lombardia,,18,,"Crostacei, molluschi o crudità",,,,nd,nd,,,,,12%,3,Acciaio 6 mesi | 36 mesi sui lieviti,,,,,Italy,,,
2,,,,,,,,,,,,,,,,,2022,2022,,Oltrepò Pavese Metodo Classico Pinot Nero Brut Blanc De Noir,,,Isimbarda,Lombardia,,19,Pinot nero 100%,Formaggi freschi o a pasta filata,,,,nd,nd,,,,,12%,3,Acciaio 6 mesi | 36 mesi sui lieviti,,,,,Italy,,,
2,,,,,,,,,,,,,,,,,2022,2020,,La Costa Brigante Bianco,,,La Costa,Lombardia,,20,Pinot nero 100%,,,,,nd,nd,,,,,12%,3,Acciaio 6 mesi | 36 mesi sui lieviti,,,,abbinamento Risotti di terra ettari 12  bottiglie 45.000 produzione olearia Sì proprietà Claudia Crippa conduzione enologica Luca Bennato conduzione agronomica Staff aziendale vendita diretta Sì  visita in azienda Sì,Italy,,,
2,,,,,,,,,,,,,,,,,2022,2018,,San Giobbe,,,La Costa,Lombardia,,13,,Ri- sotto alle erbe fini.,,,,nd,nd,,,,,"12,5%",6,Acciaio 7 mesi,,,,"Luminoso giallo verdolino, di buona consistenza. All’olfatto prevalenti sensazioni di mela verde si uniscono a richiami erbacei di fieno e di caramella alla menta. Sorso di gradevole sapidità e buon corpo. Ben centrata la corrispondenza gusto-olfattiva.",Italy,,,
2,,,,,,,,,,,,,,,,,2022,2017,,Incrediboll Extra Brut,,,La Costa,Lombardia,,20,Pinot nero 100%,Carni bianche o da cortile,,,,nd,nd,,,,,14%,7,Legno 12 mesi,,,,,Italy,,,
2,,,,,,,,,,,,,,,,,2022,2018,,Seriz,,,La Costa,Lombardia,,20,Riesling renano 100%,Piatti di pesce,,,,nd,nd,,,,,"12,5%",2,Acciaio 8 mesi | 30 mesi sui lieviti,,,,,Italy,,,
2,,,,,,,,,,,,,,,,,2022,2020,,Rosato,,,La Costa,Lombardia,,17,Merlot 70% – Syrah 30%,Salumi o insaccati,,,,nd,nd,,,,,14%,2,Legno 12 mesi,,,,,Italy,,,
2,,,,,,,,,,,,,,,,,2022,2018,,Brigante Rosso,,,La Costa,Lombardia,,13,Pinot nero 60% – Merlot 20% – Syrah 20%,Piatti di verdure,,,,nd,nd,,,,,12%,2,Acciaio 6 mesi,,,,,Italy,,,
2,,,,,,,,,,,,,,,,,2022,2013,,La Fiòca Franciacorta Dosaggio Zero Orazio,,,La Fiòca,Lombardia,,13,Merlot 100%,,,,,nd,nd,,,,,"13,5%",7,Acciaio 6 mesi,,,,abbinamento Carni rosse o selvaggina ettari 5  bottiglie 40.000 produzione olearia No proprietà Erina Turla e Massimiliano Gatti conduzione enologica Cesare Ferrari conduzione agronomica Giacomo Groppetti vendita diretta Sì  visita in azienda Sì,Italy,,,
2,,,,,,,,,,,,,,,,,2022,2022,,Franciacorta Brut Del Diavolo Allegro,,,La Fiòca,Lombardia,,40,,Tagliolini allo scoglio.,,,,nd,nd,,,,,"12,5%",2,Acciaio,,,,"6 mesi e Legno 6 mesi | 72 mesi sui lieviti Giallo paglierino con riflessi dorati, impreziositi da un fine perlage. Naso agrumato che gioca su limetta, pompelmo rosa e glicine. La bocca è ricca e articolata: piena, succosa, dove contrappunti  freschi  recitano  ancora  una  parte  importante.",Italy,,,
2,,,,,,,,,,,,,,,,,2022,2022,,Franciacorta Brut Rosé,,,La Fiòca,Lombardia,,27,Chardonnay 80% – Pinot nero 20%,Piatti di verdure,,,,nd,nd,,,,,"12,5%",20,Acciaio 6 mesi | 18 mesi sui lieviti,,,,,Italy,,,
2,,,,,,,,,,,,,,,,,2022,2014,,Franciacorta Dosaggio Zero Millesimato,,,La Fiòca,Lombardia,,28,Chardonnay 50% – Pinot nero 50%,"Crostacei, molluschi o crudità",,,,nd,nd,,,,,"12,5%",3,Acciaio 24 mesi | 24 mesi sui lieviti,,,,,Italy,,,
2,,,,,,,,,,,,,,,,,2022,2017,,Franciacorta Brut Satèn Del Diavolo Allegro,,,La Fiòca,Lombardia,,35,,,,,,nd,nd,,,,,"12,5%",4,Acciaio,,,,6 mesi e Legno 6 mesi | 60 mesi sui lieviti abbinamento Piatti di pesce,Italy,,,
2,,,,,,,,,,,,,,,,,2022,2022,,La Fiorita (92)  Franciacorta Brut Rosé,,,La Fiorita,Lombardia,,28,Chardonnay 100%,"Crostacei, molluschi o crudità",,,,nd,nd,,,,,"12,5%",8,Acciaio 6 mesi | 24 mesi sui lieviti,,,,,Italy,,,
2,,,,,,,,,,,,,,,,,2022,2022,,Franciacorta Dosaggio Zero,,,La Fiorita,Lombardia,,22,Pinot nero 60% – Chardonnay 40%,,,,,nd,nd,,,,,"12,5%",10,,,,,,Italy,,,
2,,,,,,,,,,,,,,,,,2022,2022,,Franciacorta Brut,,,La Fiorita,Lombardia,,20,Chardonnay 70% – Pinot nero 30%,,,,,nd,nd,,,,,"12,5%",20,,,,,,Italy,,,
2,,,,,,,,,,,,,,,,,2022,2016,,Franciacorta Dosaggio Zero Blanc De Blancs Calicanto,,,La Fiorita,Lombardia,,19,Chardonnay 70% – Pinot nero 30%,,,,,nd,nd,,,,,"12,5%",30,,,,,,Italy,,,
2,,,,,,,,,,,,,,,,,2022,2015,,Franciacorta Dosaggio Zero Zerozerosette+8,,,La Fiorita,Lombardia,,30,Chardonnay 100%,,,,,nd,nd,,,,,"12,5%",6,,,,,,Italy,,,
2,,,,,,,,,,,,,,,,,2022,2022,,Franciacorta Brut Satèn,,,La Fiorita,Lombardia,,35,Chardonnay 70% – Pinot nero 30%,,,,,nd,nd,,,,,"12,5%",5,,,,,,Italy,,,
2,,,,,,,,,,,,,,,,,2022,2022,,L,,,La Fiorita,Lombardia,,22,Chardonnay 100%,,,,,nd,nd,,,,,"12,5%",30,,,,,,Italy,,,
2,,,,,,,,,,,,,,,,,2022,2022,,La Gerla Di Zanotti Marialuisa Franciacorta Dosaggio Zero Vitae,,,La Gerla Di Zanotti,Lombardia,,,,,,,,nd,nd,,,,,,,,,,,,Italy,,,
2,,,,,,,,,,,,,,,,,2022,2022,,Franciacorta Brut,,,La Gerla Di Zanotti,Lombardia,,19,,,,,,nd,nd,,,,,"12,5%",1,,,,,,Italy,,,
2,,,,,,,,,,,,,,,,,2022,2022,,Franciacorta Brut Rosé,,,La Gerla Di Zanotti,Lombardia,,14,Chardonnay 80% – Pinot bianco 20%,,,,,nd,nd,,,,,12%,6,,,,,,Italy,,,
2,,,,,,,,,,,,,,,,,2022,2022,,Franciacorta Brut Satèn,,,La Gerla Di Zanotti,Lombardia,,16,Pinot nero 80% – Chardonnay 20%,,,,,nd,nd,,,,,12%,1,,,,,,Italy,,,
2,,,,,,,,,,,,,,,,,2022,2012,,La Montina (91)  Franciacorta Pas Dosé Baiana Riserva,,,La Montina,Lombardia,,15,Chardonnay 100%,,,,,nd,nd,,,,,12%,3,,,,,,Italy,,,
2,,,,,,,,,,,,,,,,,2022,2022,,Franciacorta Extra Brut,,,La Montina,Lombardia,,40,Chardonnay 55% – Pinot nero 45%,,,,,nd,nd,,,,,12%,16,,,,,,Italy,,,
2,,,,,,,,,,,,,,,,,2022,2015,,Franciacorta Brut Millesimato,,,La Montina,Lombardia,,27,Chardonnay 75% – Pinot nero 25%,,,,,nd,nd,,,,,12%,28,,,,,,Italy,,,
2,,,,,,,,,,,,,,,,,2022,2022,,Franciacorta Brut Satèn,,,La Montina,Lombardia,,30,Chardonnay 70% – Pinot nero 30%,,,,,nd,nd,,,,,12%,8,,,,,,Italy,,,
2,,,,,,,,,,,,,,,,,2022,2022,,Franciacorta Brut,,,La Montina,Lombardia,,27,Chardonnay 100%,,,,,nd,nd,,,,,12%,81,,,,,,Italy,,,
2,,,,,,,,,,,,,,,,,2022,2022,,Franciacorta Demi Sec Rosé,,,La Montina,Lombardia,,25,Chardonnay 85% – Pinot nero 15%,,,,,nd,nd,,,,,12%,91,,,,,,Italy,,,
2,,,,,,,,,,,,,,,,,2022,2015,,La Perla Valtellina Superiore Elisa Riserva,,,La Perla,Lombardia,,24,Chardonnay 60% – Pinot nero 40%,,,,,nd,nd,,,,,12%,75,,,,,,Italy,,,
2,,,,,,,,,,,,,,,,,2022,2016,,Valtellina Superiore La Mossa,,,La Perla,Lombardia,,27,Nebbiolo 100%,Tagliere  di  bitto  con confettura di frutti rossi.,,,,nd,nd,,,,,14%,3,Acciaio 5 mesi e Legno 48 mesi,,,,"Luminoso  rosso  granato.  Le  tracce  terziarie  emergono  già  alla prima  olfazione  e  accompagnano  spezie  dolci,  frutta  a  bacca rossa e ricordi balsamici. Gusto morbido e di grande garbo, rivela un tannino presente ma delicato e una vena sapida che alleggerisce  il  sorso.  Pregevole  nella  chiusura.",Italy,,,
2,,,,,,,,,,,,,,,,,2022,2022,,La Perla Extra Brut,,,La Perla,Lombardia,,20,Nebbiolo 100%,Carni rosse o selvaggina,,,,nd,nd,,,,,13%,9,Acciaio 5 mesi e Legno 36 mesi,,,,,Italy,,,
2,,,,,,,,,,,,,,,,,2022,2017,,La Piotta L Oltrepò Pavese Metodo Classico Pinot Nero Nature,,,La Piotta,Lombardia,,20,Pignola 100%,,,,,nd,nd,,,,,"12,5%",4,,,,,,Italy,,,
2,,,,,,,,,,,,,,,,,2022,2017,,Oltrepò Pavese Metodo Classico Pinot Nero Brut Rosé Luca Padroggi,,,La Piotta,Lombardia,,18,Pinot nero 100%,Crostini con burro di malga e alici di Menaica.,,,,nd,nd,,,,,12%,3,Acciaio 7 mesi | 30 mesi sui lieviti,,,,"Paglierino  compatto  con  bollicine  fini  e  numerose.  Il  naso  si esprime attraverso delicate allusioni di erba sfalciata, camomilla, tiglio, pesca bianca e pasta lievitata. L'assaggio è espressivo ed  equilibrato;  ottima  la  beva,  grazie  alla  sottile  sapidità.  Buona la persistenza floreale.",Italy,,,
2,,,,,,,,,,,,,,,,,2022,2017,,Pinot Nero Dell'Oltrepò Pavese Piota Luigi Padroggi,,,La Piotta,Lombardia,,18,Pinot nero 100%,"Crostacei, molluschi o crudità",,,,nd,nd,,,,,"12,5%",2,Acciaio 7 mesi | 24 mesi sui lieviti,,,,,Italy,,,
2,,,,,,,,,,,,,,,,,2022,2017,,89/90 Rosso,,,La Piotta,Lombardia,,17,Pinot nero 100%,Carni rosse o selvaggina,,,,nd,nd,,,,,"13,5%",800,Legno 12 mesi,,,,,Italy,,,
2,,,,,,,,,,,,,,,,,2022,2017,,Oltrepò Pavese Metodo Classico Pinot Nero Brut Talento,,,La Piotta,Lombardia,,14,Barbera 70% – Cabernet sauvignon 30%,Carni rosse o selvaggina,,,,nd,nd,,,,,14%,3,Legno 12 mesi,,,,,Italy,,,
2,,,,,,,,,,,,,,,,,2022,2020,,Bonarda Dell'Oltrepò Pavese Frizzante,,,La Piotta,Lombardia,,16,Pinot nero 100%,Primi piatti di pasta o pasta fresca ripiena,,,,nd,nd,,,,,12%,6,Acciaio 7 mesi | 24 mesi sui lieviti,,,,,Italy,,,
2,,,,,,,,,,,,,,,,,2022,2022,,La Rodola Fior Di Silvia,,,La Rodola,Lombardia,,8,,,,,,nd,nd,,,,,"12,5%",30,Acciaio 4 mesi,,,,"abbinamento Salumi o insaccati ettari 2,5  bottiglie 12.000 produzione olearia No proprietà Valter Pievani conduzione enologica Cesare Ferrari conduzione agronomica Valter Pievani vendita diretta Sì  visita in azienda Sì",Italy,,,
2,,,,,,,,,,,,,,,,,2022,2015,,Moscato Di Scanzo,,,La Rodola,Lombardia,,30,Moscato giallo 100%,Turta del Donizet.,,,,nd,nd,,,,,16%,500,Acciaio 12 mesi,,,,"Splendente oro antico. Profilo olfattivo di suadente complessità: mandarino e cedro candito, scorza d'arancia, miele di zagara, albicocca  disidratata,  pan  di  spagna.  Di  composta  e  gradevole dolcezza, regala un sorso caldo, ben sostenuto da delicata trama fresco-sapida.",Italy,,,
2,,,,,,,,,,,,,,,,,2022,2018,,La Versa Pinot Nero Dell'Oltrepò Pavese La Versa Riserva,,,La Versa,Lombardia,,40,Moscato di Scanzo 100%,"000.000 produzione olearia No proprietà Terre d'Oltrepò conduzione enologica Pietro Dilernia, Alessio Gaiaschi, Andrea Rossi conduzione agronomica Nicola Parisi vendita diretta Sì  visita in azienda Sì",,,,nd,nd,,,,,15%,1,Acciaio 48 mesi,,,,"abbinamento Pasticceria secca, torte o cioccolato ettari 45  bottiglie 4.",Italy,,,
2,,,,,,,,,,,,,,,,,2022,2018,,Oltrepò Pavese Riesling La Versa Riserva,,,La Versa,Lombardia,,22,Pinot nero 100%,Tartare di cavallo al radicchio rosso.,,,,nd,nd,,,,,13%,5,Legno 18 mesi,,,,"e  dolci  speziature  sono  impreziosite  da  cenni  di  cacao  amaro e  torrefazione.  La  bocca  ha  un  tannino  cesellato  e  carnoso.  Di buon equilibrio, chiude su estensioni di rabarbaro e una leggera affumicatura.",Italy,,,
2,,,,,,,,,,,,,,,,,2022,2019,,Lazzari Capriano Del Colle Bianco Superiore Bastian Contrario,,,Lazzari,Lombardia,,15,Riesling 100%,,,,,nd,nd,,,,,13%,5,,,,,,Italy,,,
2,,,,,,,,,,,,,,,,,2022,2018,,Adamah Extra Brut,,,Lazzari,Lombardia,,26,Trebbiano di Lugana 100%,Pollo alla mugnaia.,,,,nd,nd,,,,,15%,1,Legno 12 mesi,,,,"Tonalità che sfuma nell'oro, consistente. Esordio accattivante di fiori di zagara, pesca bianca e scorze di cedro candito. L'impronta al gusto è morbida e avvolgente, sorretta da una freschezza agrumata e da una lunga salinità che domina il finale, dove fanno capolino anche miele e spezie dolci.",Italy,,,
2,,,,,,,,,,,,,,,,,2022,2018,,Capriano Del Colle Rosso Riserva Degli Angeli,,,Lazzari,Lombardia,,16,Chardonnay 100%,Piatti di verdure,,,,nd,nd,,,,,"11,5%",3,Acciaio 6 mesi | 20 mesi sui lieviti,,,,,Italy,,,
2,,,,,,,,,,,,,,,,,2022,2018,,Capriano Del Colle Rosso Adagio,,,Lazzari,Lombardia,,21,,Carni rosse o selvaggina,,,,nd,nd,,,,,15%,7,Legno 12 mesi,,,,,Italy,,,
2,,,,,,,,,,,,,,,,,2022,2020,,Capriano Del Colle Marzemino Berzemì,,,Lazzari,Lombardia,,9,,,,,,nd,nd,,,,,"13,5%",14,,,,,,Italy,,,
2,,,,,,,,,,,,,,,,,2022,2020,,Capriano Del Colle Bianco Fausto,,,Lazzari,Lombardia,,10,Marzemino 100%,Carni bianche o da cortile,,,,nd,nd,,,,,"12,5%",8,Acciaio 6 mesi,,,,,Italy,,,
2,,,,,,,,,,,,,,,,,2022,2016,,Tenuta Le Fracce L (91)  Casteggio Bohemi Riserva,,,Tenuta Le Fracce,Lombardia,,10,Trebbiano di Lugana 100%,,,,,nd,nd,,,,,13%,10,Acciaio 6 mesi,,,,abbinamento Piatti di pesce o m b a r d i a ettari 40  bottiglie 120.000 produzione olearia No proprietà Tenuta Le Fracce conduzione enologica Roberto Gerbino conduzione agronomica Roberto Gerbino vendita diretta Sì  visita in azienda Sì,Italy,,,
2,,,,,,,,,,,,,,,,,2022,2020,,Oltrepò Pavese Riesling Landò,,,Tenuta Le Fracce,Lombardia,,30,,Tournedos alla Rossini.,,,,nd,nd,,,,,15%,2,Legno 48 mesi,,,,"Un  rubino  che  rotea  lento  nel  calice.  Dona  affilate  suggestioni di  amarena  e  mirtillo  susseguite  da  tocchi  eterei  e  speziati  di pepe  bianco  e  chiodi  di  garofano.  Opulento,  profondo  e  materico, esibisce un ordito tannico di pregevole fattura ben adattato alla parte glicerica. Si congeda su toni di tabacco.",Italy,,,
2,,,,,,,,,,,,,,,,,2022,2020,,Pinot Nero Dell'Oltrepò Pavese Moro,,,Tenuta Le Fracce,Lombardia,,18,Riesling renano 100%,Piatti di pesce,,,,nd,nd,,,,,"13,5%",8,Acciaio 6 mesi,,,,,Italy,,,
2,,,,,,,,,,,,,,,,,2022,2022,,Bussolera Brut Grand Rosé,,,Tenuta Le Fracce,Lombardia,,15,Pinot nero 100%,Carni bianche o da cortile,,,,nd,nd,,,,,13%,8,Acciaio 6 mesi,,,,,Italy,,,
2,,,,,,,,,,,,,,,,,2022,2017,,Aghatòs,,,Tenuta Le Fracce,Lombardia,,22,Pinot nero 100%,Risotti di terra,,,,nd,nd,,,,,13%,2,Acciaio 6 mesi | 48 mesi sui lieviti,,,,,Italy,,,
2,,,,,,,,,,,,,,,,,2022,2020,,Bonarda Dell'Oltrepò Pavese Frizzante Rubiosa,,,Tenuta Le Fracce,Lombardia,,25,Pinot bianco 100%,Primi piatti di pasta o pasta fresca ripiena,,,,nd,nd,,,,,13%,2,Acciaio 10 mesi e Legno 10 mesi,,,,,Italy,,,
2,,,,,,,,,,,,,,,,,2022,2012,,Le Marchesine Franciacorta Dosage Zéro Secolo Novo Riserva,,,Le Marchesine,Lombardia,,10,Croatina 100%,Salumi o insaccati,,,,nd,nd,,,,,"13,5%",40,Acciaio 4 mesi,,,,,Italy,,,
2,,,,,,,,,,,,,,,,,2022,2017,,Franciacorta Brut Rosé Millesimato Artio,,,Le Marchesine,Lombardia,,60,Chardonnay 100%,Risotto ai gam- beri rossi di Mazara.,,,,nd,nd,,,,,13%,1,Acciaio 6 mesi | 96 mesi sui lieviti,,,,"Splendente  giallo  dorato,  fine  e  prolungata  la  spuma.  La  frutta gialla  introduce  miele  d’acacia  e  fiori  freschi  di  zagara,  per  lasciare spazio a nuance di curry. L’assaggio è di corpo, con una cremosa effervescenza e un'invitante sapidità.",Italy,,,
2,,,,,,,,,,,,,,,,,2022,2016,,Franciacorta Extra Brut Blanc De Noir Nodens,,,Le Marchesine,Lombardia,,30,Chardonnay 50% – Pinot nero 50%,,,,,nd,nd,,,,,13%,40,,,,,,Italy,,,
2,,,,,,,,,,,,,,,,,2022,2013,,Franciacorta Brut Blanc De Blancs Millesimato Esus,,,Le Marchesine,Lombardia,,35,Pinot nero 100%,Piatti di pesce,,,,nd,nd,,,,,13%,13,Acciaio 6 mesi | 48 mesi sui lieviti,,,,,Italy,,,
2,,,,,,,,,,,,,,,,,2022,2017,,Franciacorta Brut Satèn Millesimato Brigantia,,,Le Marchesine,Lombardia,,35,Chardonnay 100%,Primi piatti di pasta o pasta fresca ripiena,,,,nd,nd,,,,,13%,9,Acciaio 6 mesi | 72 mesi sui lieviti,,,,,Italy,,,
2,,,,,,,,,,,,,,,,,2022,2022,,Franciacorta Extra Brut,,,Le Marchesine,Lombardia,,30,Chardonnay 100%,Piatti di verdure,,,,nd,nd,,,,,13%,53,Acciaio 6 mesi | 36 mesi sui lieviti,,,,,Italy,,,
2,,,,,,,,,,,,,,,,,2022,2022,,Franciacorta,,,Le Marchesine,Lombardia,,20,,Primi piatti di pasta o pasta fresca ripiena,,,,nd,nd,,,,,"12,5%",35,Acciaio 6 mesi | 24 mesi sui lieviti,,,,,Italy,,,
2,,,,,,,,,,,,,,,,,2022,2014,,Lo Sparviere Franciacorta Extra Brut Millesimato,,,Lo Sparviere,Lombardia,,,,,,,,nd,nd,,,,,,,,,,,,Italy,,,
2,,,,,,,,,,,,,,,,,2022,2022,,Franciacorta Brut Rosé Monique,,,Lo Sparviere,Lombardia,,35,Chardonnay 100%,,,,,nd,nd,,,,,"12,5%",10,,,,,,Italy,,,
2,,,,,,,,,,,,,,,,,2022,2015,,Franciacorta Brut Millesimato,,,Lo Sparviere,Lombardia,,29,Pinot nero 100%,Primi piatti di pasta o pasta fresca ripiena,,,,nd,nd,,,,,12%,12,Acciaio 24 mesi e Legno 24 mesi | 24 mesi sui lieviti,,,,,Italy,,,
2,,,,,,,,,,,,,,,,,2022,2022,,Franciacorta Brut Satèn,,,Lo Sparviere,Lombardia,,27,Chardonnay 100%,,,,,nd,nd,,,,,"12,5%",15,,,,,,Italy,,,
2,,,,,,,,,,,,,,,,,2022,2016,,Locatelli Caffi Valcalepio Rosso I Pilendrì,,,Locatelli Caffi,Lombardia,,27,Chardonnay 100%,Piatti di verdure,,,,nd,nd,,,,,12%,15,Acciaio 8 mesi e Legno 8 mesi | 24 mesi sui lieviti,,,,,Italy,,,
2,,,,,,,,,,,,,,,,,2022,2016,,Valcalepio Rosso I Cardinài,,,Locatelli Caffi,Lombardia,,15,Cabernet sauvignon 50% – Merlot 50%,Galletto con peperoni.,,,,nd,nd,,,,,13%,5,Acciaio 12 mesi e Legno 10 mesi,,,,"Rubino vivace. Profumi di viole e glicine, poi di ciliegie in confettura, quindi sbuffi di cacao amaro in polvere e di foglia di pomodoro. Il palato, morbido, richiama i frutti con un tannino gentile e conclude con lievi accenti mentolati e di liquirizia.",Italy,,,
2,,,,,,,,,,,,,,,,,2022,2017,,Terre Del Colleoni Spumante Brut Claudun,,,Locatelli Caffi,Lombardia,,25,Cabernet sauvignon 70% – Merlot 30%,Carni rosse o selvaggina,,,,nd,nd,,,,,"14,5%",2,Acciaio 20 mesi e Legno 30 mesi,,,,,Italy,,,
2,,,,,,,,,,,,,,,,,2022,2020,,Valcalepio Bianco,,,Locatelli Caffi,Lombardia,,22,,Piatti di pesce,,,,nd,nd,,,,,13%,1,Acciaio 9 mesi | 28 mesi sui lieviti,,,,,Italy,,,
2,,,,,,,,,,,,,,,,,2022,2017,,Mamete Prevostini L (91)  Valtellina Superiore Riserva,,,Mamete Prevostini,Lombardia,,8,,Piatti di verdure o m b a r d i a,,,,nd,nd,,,,,13%,9,Acciaio 10 mesi,,,,,Italy,,,
2,,,,,,,,,,,,,,,,,2022,2018,,Sforzato Di Valtellina Albareda,,,Mamete Prevostini,Lombardia,,29,Nebbiolo 100%,Cervo ai mirtilli.,,,,nd,nd,,,,,15%,6,Legno 30 mesi,,,,"Rubino dalle tonalità granato. Ai frutti di bosco seguono accenti di rosa canina e vaniglia, effluvi balsamici, cioccolato e ancora spezie dolci. L'assaggio è fresco, ottima la sapidità e di vigore il tannino, corpo vellutato e lungo finale.",Italy,,,
2,,,,,,,,,,,,,,,,,2022,2018,,Valtellina Superiore Inferno La Cruus,,,Mamete Prevostini,Lombardia,,52,Nebbiolo 100%,Formaggi stagionati o erborinati,,,,nd,nd,,,,,"15,5%",8,Legno 10 mesi,,,,,Italy,,,
2,,,,,,,,,,,,,,,,,2022,2019,,Valtellina Superiore Sassella San Lorenzo,,,Mamete Prevostini,Lombardia,,25,Nebbiolo 100%,Risotti di terra,,,,nd,nd,,,,,14%,7,Legno 12 mesi,,,,,Italy,,,
2,,,,,,,,,,,,,,,,,2022,2018,,Marchese Adorno Pinot Nero Dell'Oltrepò Pavese Rile Nero,,,Marchese Adorno,Lombardia,,38,Nebbiolo 100%,,,,,nd,nd,,,,,14%,4,Legno 10 mesi,,,,abbinamento Carni rosse o selvaggina ettari 60  bottiglie 140.000 produzione olearia No proprietà Marcello Cattaneo Adorno conduzione enologica Francesco Cervetti conduzione agronomica Paolo Fiocchi vendita diretta Sì  visita in azienda Sì,Italy,,,
2,,,,,,,,,,,,,,,,,2022,2022,,Marchese Adorno Brut Nature,,,Marchese Adorno,Lombardia,,40,Pinot nero 100%,Tortelli ai porcini con sugo di brasato.,,,,nd,nd,,,,,14%,1,Acciaio 3 mesi e Legno 15 mesi,,,,"Rubino profondo e vivido. Preludio floreale di peonia e rosa in appassimento, cui seguono prugna in confettura, pepe nero, cenni tostati  e  balsamici.  Ingresso  fine  e  signorile,  ricamo  tannico  di spessore. Il finale è lungo e ricco di frutta, liquirizia, e tratti affumicati.",Italy,,,
2,,,,,,,,,,,,,,,,,2022,2020,,Dama D'Oro,,,Marchese Adorno,Lombardia,,40,Pinot nero 100%,,,,,nd,nd,,,,,12%,2,,,,,,Italy,,,
2,,,,,,,,,,,,,,,,,2022,2022,,Marchiopolo Franciacorta Brut,,,Marchiopolo,Lombardia,,15,Pinot grigio 100%,,,,,nd,nd,,,,,13%,3,Acciaio 4 mesi,,,,abbinamento Primi piatti di pasta o pasta fresca ripiena ettari 13  bottiglie 50.000 produzione olearia No proprietà Roberta Garbin conduzione enologica Roberto Pepe conduzione agronomica Staff aziendale vendita diretta Sì  visita in azienda Sì,Italy,,,
2,,,,,,,,,,,,,,,,,2022,2022,,Franciacorta Dosaggio Zero Pas Operé,,,Marchiopolo,Lombardia,,23,Chardonnay 85% – Pinot nero 15%,Polpo grigliato su crema di piselli.,,,,nd,nd,,,,,"12,5%",3,Acciaio 6 mesi | 20 mesi sui lieviti,,,,"Paglierino  brillante,  effervescenza  fine  e  duratura.  L'elegante bouquet apre su ricordi tropicali e agrumati, seguiti da fiori gialli, spezie dolci e da una leggera tostatura. In bocca è cremoso e ben bilanciato; l'ottima sinergia tra freschezza e sapidità è particolarmente invitante.",Italy,,,
2,,,,,,,,,,,,,,,,,2022,2018,,Martilde Oltrepò Pavese Barbera,,,Martilde,Lombardia,,26,Chardonnay 85% – Pinot nero 15%,,,,,nd,nd,,,,,"12,5%",3,Acciaio 6 mesi | 34 mesi sui lieviti,,,,abbinamento Risotti di terra ettari 8  bottiglie 25.000 produzione olearia No proprietà Antonella Tacci conduzione enologica Giuseppe Zatti conduzione agronomica Antonella Tacci vendita diretta Sì  visita in azienda Sì,Italy,,,
2,,,,,,,,,,,,,,,,,2022,2020,,Dedica,,,Martilde,Lombardia,,9,Barbera 100%,Fagiano in umido con polenta.,,,,nd,nd,,,,,14%,6,Acciaio 12 mesi,,,,"Veste rosso rubino con riflessi granato. Profumi di ciliegia e prugna abbracciano tocchi balsamici e speziature di pepe nero. Impatto gustativo di grande espressività e coerenza, ben modulato dalla decisa acidità e da una composta struttura tannica. Si congeda lentamente su aromi di violetta.",Italy,,,
2,,,,,,,,,,,,,,,,,2022,2022,,"La Strega, La Gazza E Il Pioppo",,,Martilde,Lombardia,,13,Malvasia di Candia aromatica 100%,Salumi o insaccati,,,,nd,nd,,,,,"12,5%",2,Acciaio 6 mesi,,,,,Italy,,,
2,,,,,,,,,,,,,,,,,2022,2019,,Nina,,,Martilde,Lombardia,,18,Barbera 100%,Carni rosse o selvaggina,,,,nd,nd,,,,,15%,2,Acciaio 4 mesi e Legno 24 mesi,,,,,Italy,,,
2,,,,,,,,,,,,,,,,,2022,2020,,Piume,,,Martilde,Lombardia,,9,Pinot nero 100%,Carni bianche o da cortile,,,,nd,nd,,,,,13%,3,Acciaio 8 mesi,,,,,Italy,,,
2,,,,,,,,,,,,,,,,,2022,2022,,Marzaghe Franciacorta Dosaggio Zero Superno,,,Marzaghe,Lombardia,,10,Malvasia di Candia aromatica 100%,,,,,nd,nd,,,,,"12,5%",2,Acciaio 6 mesi,,,,"abbinamento Salumi o insaccati ettari 9,5  bottiglie 45.000 produzione olearia No proprietà Marcello Lamberti conduzione enologica Cesare Ferrari conduzione agronomica Giuseppe Turrini vendita diretta Sì  visita in azienda Sì",Italy,,,
2,,,,,,,,,,,,,,,,,2022,1935,,Franciacorta Brut Lm,,,Marzaghe,Lombardia,,34,,Pla- teau di cruditè di mare.,,,,nd,nd,,,,,"12,5%",5,Acciaio,,,,"8 mesi e Legno 5 mesi | 60 mesi sui lieviti Giallo  paglierino  fitto  e  vivace.  Sensazioni  di  frutta  estiva:  pesca, albicocca e nespola, che anticipano un insieme di fiori gialli, maggiorana e sfumature mellite. Interessante la dualità tra morbidezza e freschezza per un assaggio cremoso e invitante.",Italy,,,
2,,,,,,,,,,,,,,,,,2022,2022,,Franciacorta Brut Satèn Premier,,,Marzaghe,Lombardia,,17,Chardonnay 100%,Risotti di pesce,,,,nd,nd,,,,,"12,5%",8,Acciaio 8 mesi | 24 mesi sui lieviti,,,,,Italy,,,
2,,,,,,,,,,,,,,,,,2022,2022,,Franciacorta Brut Treha,,,Marzaghe,Lombardia,,24,Chardonnay 100%,Piatti di verdure,,,,nd,nd,,,,,"12,5%",10,Acciaio 8 mesi | 48 mesi sui lieviti,,,,,Italy,,,
2,,,,,,,,,,,,,,,,,2022,2022,,L,,,Marzaghe,Lombardia,,20,Chardonnay 100%,Carni bianche o da cortile o m b a r d i a,,,,nd,nd,,,,,"12,5%",18,Acciaio 8 mesi | 36 mesi sui lieviti,,,,,Italy,,,
2,,,,,,,,,,,,,,,,,2022,2015,,Massussi Luigi Franciacorta Extra Brut Cuvée Del Lago,,,Massussi Luigi,Lombardia,,,,,,,,nd,nd,,,,,,,,,,,,Italy,,,
2,,,,,,,,,,,,,,,,,2022,2011,,Franciacorta Brut Nature Rosé Annemaríe Cuvée Riserva,,,Massussi Luigi,Lombardia,,31,,Rana pescatrice al forno con patate.,,,,nd,nd,,,,,"12,5%",3,Acciaio 9 mesi e Legno 9 mesi | 50 mesi sui lieviti,,,,"Un campo di mimose, animato da fine e persistente perlage. L'alternarsi di piccola pasticceria e fiori di camomilla, apre un olfatto in cui susina gialla e frutta tropicale invitano al sorso. Cremoso e di buon equilibrio, con la tensione fresco-sapida che lascia intuire qualche cenno di evoluzione nel finale.",Italy,,,
2,,,,,,,,,,,,,,,,,2022,2017,,Medolago Albani Valcalepio Rosso I Due Lauri Riserva,,,Medolago Albani,Lombardia,,37,,Risotti di terra,,,,nd,nd,,,,,"12,5%",2,Acciaio 9 mesi e Legno 9 mesi | 100 mesi sui lieviti,,,,,Italy,,,
2,,,,,,,,,,,,,,,,,2022,2022,,Medolago Albani Brut,,,Medolago Albani,Lombardia,,15,Cabernet sauvignon 50% – Merlot 50%,Straccetti di manzo in umido.,,,,nd,nd,,,,,"13,5%",7,Legno 12 mesi,,,,"Intrigante  rubino  dai  riflessi granato. Intenso  e invitante  l'olfatto: soffi balsamici fanno da cornice a fragole e visciole selvatiche, fino a sfociare in un profondo finale di pepe nero. Sapidità e tannicità accattivanti sostengono un assaggio fine, di corpo e in pieno equilibrio.",Italy,,,
2,,,,,,,,,,,,,,,,,2022,2019,,Valcalepio Rosso,,,Medolago Albani,Lombardia,,15,Chardonnay 90% – Pinot nero 10%,Risotti di pesce,,,,nd,nd,,,,,"12,5%",20,Acciaio 8 mesi | 24 mesi sui lieviti,,,,,Italy,,,
2,,,,,,,,,,,,,,,,,2022,2022,,Medolago Albani Brut Rosé,,,Medolago Albani,Lombardia,,7,,Primi piatti di pasta o pasta fresca ripiena,,,,nd,nd,,,,,"13,5%",70,Legno 3 mesi,,,,,Italy,,,
2,,,,,,,,,,,,,,,,,2022,2020,,Valcalepio Bianco,,,Medolago Albani,Lombardia,,15,Pinot grigio 100%,Piatti di pesce,,,,nd,nd,,,,,"12,5%",5,Acciaio 8 mesi | 24 mesi sui lieviti,,,,,Italy,,,
2,,,,,,,,,,,,,,,,,2022,2022,,Mirabella Pinot Bianco Demetra Brut Nature,,,Mirabella,Lombardia,,7,Chardonnay 80% – Pinot grigio 20%,Piatti di pesce,,,,nd,nd,,,,,"12,5%",30,Acciaio 3 mesi,,,,,Italy,,,
2,,,,,,,,,,,,,,,,,2022,2015,,Franciacorta Brut Nature Millesimato Demetra,,,Mirabella,Lombardia,,29,Pinot bianco 100%,,,,,nd,nd,,,,,"12,5%",3,,,,,,Italy,,,
2,,,,,,,,,,,,,,,,,2022,2022,,Franciacorta Brut Rosé,,,Mirabella,Lombardia,,30,,,,,,nd,nd,,,,,"12,5%",7,,,,,,Italy,,,
2,,,,,,,,,,,,,,,,,2022,2022,,Franciacorta Brut Blanc De Blancs Edea,,,Mirabella,Lombardia,,26,,,,,,nd,nd,,,,,"12,5%",60,,,,,,Italy,,,
2,,,,,,,,,,,,,,,,,2022,2022,,Franciacorta Brut Satèn,,,Mirabella,Lombardia,,21,Chardonnay 80% – Pinot bianco 20%,,,,,nd,nd,,,,,"12,5%",200,,,,,,Italy,,,
