Entry,Ref,OLDRS,RANK,RS,RAWQP,QPRANK,QP,RANK2,RS2,RAWQP2,QP2,RANK3,RS3,RAWQP3,QP3,RawAvg,RatingYear,Vintage,Qterms,FullName,AppellationLevel,AppellationName,WineryName,Region,EvaluationAvg,Price,Grapes,Pairing,ScoreAvg,EvaluationAIS,ScoreAIS,EvaluationGR,ScoreGR,SLC,TLC,WineTypeIT,WineType,Alcohol,Bottles,AgingMonths,AgingTypeIT,AgingType,Notes,Tasting Notes,Country,VintageNV,Method,Sweetness
2,,,,,,,,,,,,,,,,,2023,2019,,Colli Maceratesi Ribona Spumante Dosaggio Zero,,,Fontezoppa,Marche,,21,Maceratino 100%,Fritto di paranza,,,89,nd,nd,,,,,12,3,,Legno 18 mesi,,,"Giallo sole, intenso. Fitto perlage. Un prato di ginestre, gelsomini, camomilla, poi prugna gialla, mela e giuggiola. Accenni di crosta di pane e lieviti. La bollicina croccante conferisce al gusto bella freschezza. Sapido e morbido, sfocia lentamente su aromi di frutta esotica.",Italy,,,
2,,,,,,,,,,,,,,,,,2023,2019,,Serrapetrona Morò,,,Fontezoppa,Marche,,21,Vernaccia nera 100%,Acciaio 12 mesi 3 mesi sui lieviti Sfogliatelle Santa Rosa,,,89,nd,nd,,,,,12,3,,Legno 18 mesi,,,"Brasato di manzo al vino rosso. VERNACCIA DI SERRAPETRONA SELEZIONE FABRINI DOLCE Rosso Docg Metodo Martinotti Dolce Vernaccia nera 100% Alc. 12,5% | € 14 | Bt. 40.000 | Ferm. Acciaio | Mat.",Italy,,,
2,,,,,,,,,,,,,,,,,2023,2020,,Serrapetrona Pepato,,,Fontezoppa,Marche,,21,Vernaccia nera 100%,Straccetti di cavallo,,,86,nd,nd,,,,,12,3,,Legno 18 mesi,,,,Italy,,,
2,,,,,,,,,,,,,,,,,2023,2021,,Colli Maceratesi Ribona Altabella,,,Fontezoppa,Marche,,21,Maceratino 100%,Risotto agli asparagi e provola affumicata,,,86,nd,nd,,,,,12,3,,Legno 18 mesi,,,,Italy,,,
2,,,,,,,,,,,,,,,,,2023,2019,,Castelli Di Jesi Verdicchio Classico Serra Fiorese Riserva,,,Garofoli,Marche,,20,Verdicchio 100%,Branzino al forno con erbe aromatiche,,,89,nd,nd,,,,,14,6,,Legno 11 mesi,,,"Giallo paglierino con bagliori dorati. Profumi immediati di ginestra, zagara, pesca gialla e mandorla tostata; seguono anice e zenzero. Assaggio incentrato su potente espressione calorica, tempestivamente ingentilita da briosi e vibranti toni sapidi. Epilogo con echi ammandorlati e agrumati.",Italy,,,
2,,,,,,,,,,,,,,,,,2023,2019,,Conero Grosso Agontano Riserva,,,Garofoli,Marche,,20,Montepulciano 100%,Stinco di maiale al forno in pancetta affumicata,,,86,nd,nd,,,,,14,6,,Legno 11 mesi,,,,Italy,,,
2,,,,,,,,,,,,,,,,,2023,2019,,Verdicchio Dei Castelli Di Jesi Spumante Brut,,,Garofoli,Marche,,20,Verdicchio 100%,Cotoletta di tonno al sesamo,,,86,nd,nd,,,,,14,6,,Legno 11 mesi,,,,Italy,,,
2,,,,,,,,,,,,,,,,,2023,2018,,Verdicchio Dei Castelli Di Jesi Spumante Pas Dosé,,,Garofoli,Marche,,20,Verdicchio 100%,Crostini con burro e salmone,,,86,nd,nd,,,,,14,6,,Legno 11 mesi,,,,Italy,,,
2,,,,,,,,,,,,,,,,,2023,2020,,Verdicchio Dei Castelli Di Jesi Classico Superiore Podium,,,Garofoli,Marche,,20,Verdicchio 100%,Capitone in umido,,,86,nd,nd,,,,,14,6,,Legno 11 mesi,,,,Italy,,,
2,,,,,,,,,,,,,,,,,2023,2019,,Garofoli Brut Rosé,,,Garofoli,Marche,,20,Montepulciano 100%,Tortelli di branzino con salsa d'astice,,,86,nd,nd,,,,,14,6,,Legno 11 mesi,,,,Italy,,,
2,,,,,,,,,,,,,,,,,2023,2018,,Lacrima Di Morro D’Alba Superiore Luigino,,,Piergiovanni Giusti,Marche,,14,Lacrima 100%,Tacchino stufato con peperoni e radicchio,,,86,nd,nd,,,,,11,2,,Acciaio 18 mesi,,,"Carminio di buona consistenza. Debutta con incredibili slanci di confetture di frutti rossi, mora di gelso e ribes nero, cannella e liquirizia. Al palato è fresco, sapido con un tannino cesellato ancora percettibile, bilanciato dal volume alcolico. La chiusura è giocata sui toni di frutti e spezie.",Italy,,,
2,,,,,,,,,,,,,,,,,2023,2021,,Lacrima Di Morro D’Alba 9,,,Piergiovanni Giusti,Marche,,14,Lacrima 100%,Rigatoni al ragù bianco di carne,,,86,nd,nd,,,,,11,2,,Acciaio 18 mesi,,,,Italy,,,
2,,,,,,,,,,,,,,,,,2023,2021,,Le Rose Di Settembre,,,Piergiovanni Giusti,Marche,,14,Lacrima 100%,Acciaio 4 mesi 4 mesi sui lieviti Insalata di mare,,,86,nd,nd,,,,,11,2,,Acciaio 18 mesi,,,Lasagne di verdure. BOLLAROSA BRUT Rosato Metodo Martinotti Lacrima 100% Alc. 12% | € 10 | Bt. 10.000 | Ferm. Acciaio | Mat.,Italy,,,
2,,,,,,,,,,,,,,,,,2023,2021,,Lacrima Di Morro D’Alba,,,Piergiovanni Giusti,Marche,,14,Lacrima 100%,Risotto ai finferli,,,86,nd,nd,,,,,11,2,,Acciaio 18 mesi,,,,Italy,,,
2,,,,,,,,,,,,,,,,,2023,2021,,Anima Rosa,,,Piergiovanni Giusti,Marche,,14,Lacrima 100%,wineryname Piergiovanni Giusti (1930) wineryname,,,82,nd,nd,,,,,11,2,,Acciaio 18 mesi,,,,Italy,,,
2,,,,,,,,,,,,,,,,,2023,2017,,Lacrima Di Morro D’Alba,,,Piergiovanni Giusti,Marche,,14,,,,,86,nd,nd,,,,,11,2,,Acciaio 18 mesi,,,,Italy,,,
2,,,,,,,,,,,,,,,,,2023,2021,,Osso Extra Brut,,,Gobbi & Mannocchi,Marche,,18,Montepulciano 65% – Sangiovese 35%,Tartare di gamberi,,,89,nd,nd,,,,,12,3,,Acciaio 12 mesi,,,"Rosa tenue, fini bollicine. Profuma di mandarino e glicine, con nuance di lievito e allusioni di mandorla e ribes. Bocca squisita e di buona struttura, con una sferzante acidità arricchita dalla carezzevole effervescenza. Aromi di arancia sanguinella nell’intrigante chiosa.",Italy,,,
2,,,,,,,,,,,,,,,,,2023,2020,,Offida Pecorino Ethos Poderi Dei Colli,,,Gobbi & Mannocchi,Marche,,18,Pecorino 100%,Bocconcini di rana pescatrice in crosta di mandorle,,,86,nd,nd,,,,,12,3,,Acciaio 12 mesi,,,,Italy,,,
2,,,,,,,,,,,,,,,,,2023,2021,,Offida Pecorino Poderi Dei Colli,,,Gobbi & Mannocchi,Marche,,18,Pecorino 100%,Seppie in umido con piselli,,,86,nd,nd,,,,,12,3,,Acciaio 12 mesi,,,,Italy,,,
2,,,,,,,,,,,,,,,,,2023,2018,,Offida Rosso Rigò Poderi Dei Colli,,,Gobbi & Mannocchi,Marche,,18,Montepulciano 100%,Stinco di maiale al forno in pancetta affumicata,,,86,nd,nd,,,,,12,3,,Acciaio 12 mesi,,,,Italy,,,
2,,,,,,,,,,,,,,,,,2023,2021,,Offida Passerina Poderi Dei Colli,,,Gobbi & Mannocchi,Marche,,18,Passerina 100%,Branzino al cartoccio,,,86,nd,nd,,,,,12,3,,Acciaio 12 mesi,,,,Italy,,,
2,,,,,,,,,,,,,,,,,2023,2020,,Sangiovese Sasso Di Corva,,,Gobbi & Mannocchi,Marche,,18,Sangiovese 100%,Faraona ripiena con salsa tartufata,,,82,nd,nd,,,,,12,3,,Acciaio 12 mesi,,,,Italy,,,
2,,,,,,,,,,,,,,,,,2023,2019,,Guerriero Della Terra,,,Guerrieri,Marche,,24,Montepulciano 90% – Sangiovese 10%,Lepre alla cacciatora,,,91,nd,nd,,,,,15,14,,Legno 12 mesi,,,"Rosso rubino. Ouverture balsamica, eucalipto, fiori appassiti, intreccio di humus, polvere di caffè, tabacco dolce. Cenno di goudron, poi frutti rossi sotto spirito. La beva è sferica, accarezzata dall’alcol e dal tannino serico. Freschezza succosa e totale equilibrio. Lungheggia su confettura di more.",Italy,,,
2,,,,,,,,,,,,,,,,,2023,2019,,Colli Pesaresi Sangiovese Galileo Riserva,,,Guerrieri,Marche,,24,Sangiovese 90% – Montepulciano 10%,Guancia di vitello in umido,,,89,nd,nd,,,,,15,14,,Legno 12 mesi,,,,Italy,,,
2,,,,,,,,,,,,,,,,,2023,2020,,Guerriero Nero,,,Guerrieri,Marche,,24,Montepulciano 40% – Sangiovese 40% – Cabernet sauvignon 20%,Ravioli al sugo di chianina e tartufo nero,,,89,nd,nd,,,,,15,14,,Legno 12 mesi,,,,Italy,,,
2,,,,,,,,,,,,,,,,,2023,2021,,Bianchello Del Metauro Superiore Celso,,,Guerrieri,Marche,,24,Bianchello 100%,Cemento 3 mesi Linguine all'astice,,,86,nd,nd,,,,,15,14,,Legno 12 mesi,,,,Italy,,,
2,,,,,,,,,,,,,,,,,2023,2020,,Guerriero Bianco,,,Guerrieri,Marche,,24,Bianchello 90% – Verdicchio 10%,Legno 4 mesi Filetto di dentice in crosta di patate,,,82,nd,nd,,,,,15,14,,Legno 12 mesi,,,,Italy,,,
2,,,,,,,,,,,,,,,,,2023,2019,,Lu Kont,,,Il Conte Villa Prandone,Marche,,35,Montepulciano 100%,Capriolo con salsa di ribes rosso,,,91,nd,nd,,,,,14,6,,Legno 15 mesi e,,,"Cemento 15 mesi Rosso cremisi vivace. Naso sfaccettato e vigoroso: confettura di ribes rosso, viola essiccata, vaniglia, cardamomo, china. Rinfrescanti bacche di ginepro e alloro. Sorso morbido e rotondo nonostante l’incessante, fitta e dissetante trama tannica. Interminabile progressione gustativa.",Italy,,,
2,,,,,,,,,,,,,,,,,2023,2019,,Merlot Ix Prandone,,,Il Conte Villa Prandone,Marche,,35,Merlot 100%,Cemento 15 mesi Filetto di manzo in crosta alle erbette,,,86,nd,nd,,,,,14,6,,Legno 15 mesi e,,,,Italy,,,
2,,,,,,,,,,,,,,,,,2023,2020,,Piceno Superiore Marinus,,,Il Conte Villa Prandone,Marche,,35,Montepulciano 70% – Sangiovese 30%,Guanciale di vitello alle erbe aromatiche,,,86,nd,nd,,,,,14,6,,Legno 15 mesi e,,,,Italy,,,
2,,,,,,,,,,,,,,,,,2023,2019,,Zipolo,,,Il Conte Villa Prandone,Marche,,35,Montepulciano 70% – Merlot 15% – Sangiovese 15%,Reale di vitello alla senape antica,,,86,nd,nd,,,,,14,6,,Legno 15 mesi e,,,,Italy,,,
2,,,,,,,,,,,,,,,,,2023,2021,,Offida Pecorino Navicchio,,,Il Conte Villa Prandone,Marche,,35,Pecorino 100%,Pesce spada gratinato,,,86,nd,nd,,,,,14,6,,Legno 15 mesi e,,,,Italy,,,
2,,,,,,,,,,,,,,,,,2023,2021,,Falerio Pecorino Aurato,,,Il Conte Villa Prandone,Marche,,35,Pecorino 100%,Tagliolini all'astice,,,86,nd,nd,,,,,14,6,,Legno 15 mesi e,,,,Italy,,,
2,,,,,,,,,,,,,,,,,2023,2019,,Il Pollenza,,,Il Pollenza,Marche,,67,Cabernet sauvignon 90% – Cabernet franc 7% – Petit verdot 3%,Beccacce allo spiedo,,,89,nd,nd,,,,,14,15,,Legno 14 mesi,,,"Rubino impenetrabile. Esemplare il naso, di piccoli frutti neri, di vaniglia e stilla vegetale di peperone. Regala sensazioni di tartufo nero e tabacco dolce. Tannicità, alcol e morbidezza si contendono la supremazia permettendo all’assaggio di arrivare all’equilibrio. Finale di piccoli frutti neri.",Italy,,,
2,,,,,,,,,,,,,,,,,2023,2018,,Pius Ix Mastai,,,Il Pollenza,Marche,,67,Sauvignon 100%,Acciaio 14 mesi e Cemento 14 mesi Tarte Tatin di mele,,,86,nd,nd,,,,,14,15,,Legno 14 mesi,,,,Italy,,,
2,,,,,,,,,,,,,,,,,2023,2019,,Cabernet Franc Cosmino,,,Il Pollenza,Marche,,67,Cabernet franc 100%,Filetto di manzo in crosta alle erbette,,,86,nd,nd,,,,,14,15,,Legno 14 mesi,,,,Italy,,,
2,,,,,,,,,,,,,,,,,2023,2021,,Colli Maceratesi Ribona Angera,,,Il Pollenza,Marche,,67,Maceratino 100%,Vastedda della Valle del Belice,,,86,nd,nd,,,,,14,15,,Legno 14 mesi,,,,Italy,,,
2,,,,,,,,,,,,,,,,,2023,2021,,Sauvignon Blanc Brianello,,,Il Pollenza,Marche,,67,Sauvignon 100%,Vellutata di zucca e porri,,,82,nd,nd,,,,,14,15,,Legno 14 mesi,,,,Italy,,,
2,,,,,,,,,,,,,,,,,2023,2019,,Porpora,,,Il Pollenza,Marche,,67,Montepulciano 60% – Merlot 20% – Sangiovese 20%,Trippa in umido,,,82,nd,nd,,,,,14,15,,Legno 14 mesi,,,,Italy,,,
2,,,,,,,,,,,,,,,,,2023,2018,,Conero Folle Riserva,,,La Calcinara,Marche,,14,Montepulciano 100%,,,,89,nd,nd,,,,,14,20,,   Legno    5    mesi    e,,,,Italy,,,
2,,,,,,,,,,,,,,,,,2023,2020,,Rosso Conero Il Cacciatore Di Sogni,,,La Calcinara,Marche,,14,Montepulciano 100%,Legno 18 mesi Gulasch di cervo con patate stufate,,,89,nd,nd,,,,,14,20,,   Legno    5    mesi    e,,,,Italy,,,
2,,,,,,,,,,,,,,,,,2023,2018,,Conero Terra Calcinara Riserva,,,La Calcinara,Marche,,14,Montepulciano 90% – Sangiovese 10%,Costolette di maiale alla brace,,,86,nd,nd,,,,,14,20,,   Legno    5    mesi    e,,,,Italy,,,
2,,,,,,,,,,,,,,,,,2023,2021,,Clochard,,,La Calcinara,Marche,,14,Verdicchio 90% – Chardonnay 5% – Malvasia 5%,Cemento 4 mesi Garganelli freschi con gamberi di fiume,,,86,nd,nd,,,,,14,20,,   Legno    5    mesi    e,,,,Italy,,,
2,,,,,,,,,,,,,,,,,2023,2021,,Mun,,,La Calcinara,Marche,,14,Montepulciano 100%,Brodetto all'anconetana,,,86,nd,nd,,,,,14,20,,   Legno    5    mesi    e,,,,Italy,,,
2,,,,,,,,,,,,,,,,,2023,2016,,Chardonnay Adagio,,,La Collina delle Fate,Marche,,22,Chardonnay 100%,Pesce spada gratinato,,,89,nd,nd,,,,,13,35,,Legno 8 mesi,,,"Splendente oro verde, luminosissimo. Sinfonie speziate di vaniglia e liquirizia si fondono refoli di frutti tropicali maturi quali ananas e maracuja, fiori gialli, mimosa. Delicate sfumature di pietra focaia. Sorso snello, rinfrescante, voluminoso, equilibrato, con la chiusura decisamente sapida.",Italy,,,
2,,,,,,,,,,,,,,,,,2023,2016,,Pinot Nero Arte Sìa,,,La Collina delle Fate,Marche,,22,Pinot nero 100%,Coniglio alla cacciatora,,,86,nd,nd,,,,,13,35,,Legno 8 mesi,,,,Italy,,,
2,,,,,,,,,,,,,,,,,2023,2016,,M’Arte Brut,,,La Collina delle Fate,Marche,,22,Chardonnay 80% – Pinot nero 20%,48 mesi sui lieviti Polpo alla Luciana,,,86,nd,nd,,,,,13,35,,Legno 8 mesi,,,,Italy,,,
2,,,,,,,,,,,,,,,,,2023,2015,,Chardonnay Alcaico,,,La Collina delle Fate,Marche,,22,Chardonnay 100%,Pecorino di Pienza,,,86,nd,nd,,,,,13,35,,Legno 8 mesi,,,,Italy,,,
2,,,,,,,,,,,,,,,,,2023,2017,,Moscato Sauvignon Passito Estasi,,,La Montata,Marche,,18,Moscato 50% – Sauvignon 50%,Pasticceria napoletana,,,91,nd,nd,,,,,13,2,,Acciaio 36 mesi,,,"Ambrato lucente e consistente. Ventaglio inebriante di profumi: buccia d’arancia candita, zafferano, cera d’api, uvetta, albicocca matura, mandorla e dattero. Assaggio soavemente dolce, morbido ma fresco e sapido: tutto in ottimo equilibrio. L’interminabile persistenza lo fa apprezzare anche da solo.",Italy,,,
2,,,,,,,,,,,,,,,,,2023,2020,,Pico,,,La Montata,Marche,,18,Sauvignon 50% – Moscato 40% – Trebbiano 10%,Petto d'anatra all'arancia,,,86,nd,nd,,,,,13,2,,Acciaio 36 mesi,,,,Italy,,,
2,,,,,,,,,,,,,,,,,2023,2020,,Bruni 54,,,La Montata,Marche,,18,Incrocio Bruni 54 100%,Risotto con gamberi di fiume e piselli,,,86,nd,nd,,,,,13,2,,Acciaio 36 mesi,,,,Italy,,,
2,,,,,,,,,,,,,,,,,2023,2021,,Verdicchio Dei Castelli Di Jesi Classico Superiore La Staffa,,,La Staffa,Marche,,13,Verdicchio 100%,Piovra arrostita,,,89,nd,nd,,,,,13,30,,Cemento 6 mesi,,,"Mat. Cemento 6 mesi Screziature verdoline nel sipario paglierino. Prologo: pesca gialla, ananas, acacia; atto primo: suggestioni marine che riconducono alla salina sobrietà dell’alga. Atto secondo: la freschezza si fa protagonista del bel corpo. Epilogo: aromi erbacei suggerire piacevolezza di beva.",Italy,,,
2,,,,,,,,,,,,,,,,,2023,2019,,Castelli Di Jesi Verdicchio Classico Rincrocca Riserva,,,La Staffa,Marche,,13,Verdicchio 100%,Parmigiano Reggiano Riserva,,,86,nd,nd,,,,,13,30,,Cemento 6 mesi,,,,Italy,,,
2,,,,,,,,,,,,,,,,,2023,2021,,Euphoria,,,La Staffa,Marche,,13,Montepulciano 100%,Battuto di gamberi rossi di Sicilia,,,86,nd,nd,,,,,13,30,,Cemento 6 mesi,,,,Italy,,,
2,,,,,,,,,,,,,,,,,2023,2019,,Conero Aretè Riserva,,,Lanari,Marche,,28,Montepulciano 100%,Fagiano arrosto,,,89,nd,nd,,,,,14,1,,Acciaio 12 mesi e,,,"Legno 15 mesi Rubino dai lampi appena violacei. Profilo olfattivo che, inizialmente, rimanda alla vaniglia e poi vira verso sensazioni floreali di rosa rossa. Percezioni balsamiche. Dal corpo muscoloso ma agile e dal tannino vellutato, ben integrato con le altre componenti. La risacca aromatica è floreale e speziata.",Italy,,,
2,,,,,,,,,,,,,,,,,2023,2019,,Conero Fibbio Riserva,,,Lanari,Marche,,28,Montepulciano 100%,Legno 12 mesi Tordi in salmì,,,89,nd,nd,,,,,14,1,,Acciaio 12 mesi e,,,,Italy,,,
2,,,,,,,,,,,,,,,,,2023,2021,,Rosso Conero,,,Lanari,Marche,,28,Montepulciano 100%,Filetto di maiale lardellato,,,86,nd,nd,,,,,14,1,,Acciaio 12 mesi e,,,,Italy,,,
2,,,,,,,,,,,,,,,,,2023,2021,,Solosara,,,Lanari,Marche,,28,Trebbiano 34% – Malvasia 33% – Verdicchio 33%,Risi e bisi,,,86,nd,nd,,,,,14,1,,Acciaio 12 mesi e,,,,Italy,,,
2,,,,,,,,,,,,,,,,,2023,2015,,Piceno Superiore Nero Di Vite,,,Le Caniette,Marche,,32,Montepulciano 45% – Sangiovese 45% – Grenache 10%,Carré di maiale alle prugne,,,89,nd,nd,,,,,14,4,,Acciaio 24 mesi e,,,"Legno 24 mesi Rosso granato fitto. Fragranze signorili di rabarbaro, echinacea, glicine e narciso. Ancora, legno secco, cumino e zafferano, anguria e visciola. In bocca esordisce caldo e sapido; bella freschezza e tannino calibrato. Buon equilibrio. Finale inedito, porta con sé tracce di frutta cotta.",Italy,,,
2,,,,,,,,,,,,,,,,,2023,2018,,Piceno Superiore Morellone,,,Le Caniette,Marche,,32,Montepulciano 70% – Sangiovese 30%,e Legno 24 mesi Brasato di lepre con riduzione di vino rosso,,,89,nd,nd,,,,,14,4,,Acciaio 24 mesi e,,,,Italy,,,
2,,,,,,,,,,,,,,,,,2023,2018,,Grenache Cinabro,,,Le Caniette,Marche,,32,Grenache 100%,Filetto di scottona in sfoglia,,,89,nd,nd,,,,,14,4,,Acciaio 24 mesi e,,,,Italy,,,
2,,,,,,,,,,,,,,,,,2023,2020,,Piceno Rosso Bello,,,Le Caniette,Marche,,32,Montepulciano 50% – Sangiovese 50%,Acciaio 14 mesi 14 mesi sui lieviti Cappesante scottate allo zenzero,,,86,nd,nd,,,,,14,4,,Acciaio 24 mesi e,,,"Bracioline di maiale al calvados. SINOPIA EXTRA BRUT Rosato Igt Metodo Martinotti Montepulciano 100% Alc. 12,5% | € 13 | Bt. 10.000 | Ferm. Acciaio | Mat.",Italy,,,
2,,,,,,,,,,,,,,,,,2023,2017,,Abate Pietro,,,Le Corti dei Farfensi,Marche,,30,Montepulciano 80% – Syrah 20%,Legno 14 mesi Spezzatino di manzo,,,89,nd,nd,,,,,14,10,,Legno 16 mesi,,,"Rubino, di consistenza. Uno sciame di profumi che circonda: prima un cenno di cumino, poi spazio alla marasca e al geranio, ancora tratti di ceralacca, tabacco e goudron. Il sorso è avvolgente e il tannino in piena evoluzione è fine. L’acidità sottolinea la predisposizione essere stappato anche tra svariati anni. Capriolo con salsa di ribes rosso. ROSSO PICENO SUPERIORE S. IOSEPH 2019 Rosso Dop Montepulciano 50%, Sangiovese 50% Alc. 14,5% | € 20 | Bt. 20.000 | Mat.",Italy,,,
2,,,,,,,,,,,,,,,,,2023,2019,,Sangiovese Clos,,,Le Corti dei Farfensi,Marche,,30,Sangiovese 100%,Agnolotti al piccione con sugo d'arrosto,,,86,nd,nd,,,,,14,10,,Legno 16 mesi,,,,Italy,,,
2,,,,,,,,,,,,,,,,,2023,2018,,Cacinello,,,Le Senate,Marche,,24,Cabernet sauvignon 85% – Merlot 10% – Petit verdot 5%,Braciola di cervo con salsa di ribes,,,91,nd,nd,,,,,14,2,,Legno 12 mesi,,,"Barlumi violacei su cuore rubino. Pepe nero in evidenza. Poi l’invito di viola, mirtillo maturo, nocciola tostata, cacao, humus e cuoio. Assaggio di grande corpo, freschezza e morbidezza sono ben bilanciate e il tannino si integra millimetrico. Estensione asciutta e appagante.",Italy,,,
2,,,,,,,,,,,,,,,,,2023,2018,,Blu Velluto Spento,,,Le Senate,Marche,,24,Cabernet franc 100%,Beccacce allo spiedo,,,89,nd,nd,,,,,14,2,,Legno 12 mesi,,,,Italy,,,
2,,,,,,,,,,,,,,,,,2023,2020,,Barbula,,,Le Senate,Marche,,24,Merlot 95% – Cabernet sauvignon 5%,Stufato di daino,,,89,nd,nd,,,,,14,2,,Legno 12 mesi,,,,Italy,,,
2,,,,,,,,,,,,,,,,,2023,2021,,’Sciuccapanza,,,Le Senate,Marche,,24,Merlot 100%,Strudel di porcini e zucca con crema al parmigiano,,,86,nd,nd,,,,,14,2,,Legno 12 mesi,,,,Italy,,,
2,,,,,,,,,,,,,,,,,2023,2021,,Scirocco Da Mare,,,Le Senate,Marche,,24,Chardonnay 100%,Acciaio 6 mesi e Legno 6 mesi Baccalà mantecato,,,82,nd,nd,,,,,14,2,,Legno 12 mesi,,,Bianco Igt Chardonnay 100% Alc. 13% | € 16 | Bt. 2.400 | Ferm. Acciaio | Mat. wineryname Le Senate (2003) wineryname /,Italy,,,
2,,,,,,,,,,,,,,,,,2023,2014,,Cacinello,,,Le Senate,Marche,,24,,,,,89,nd,nd,,,,,14,2,,Legno 12 mesi,,,,Italy,,,
2,,,,,,,,,,,,,,,,,2023,2019,,Verdicchio Di Matelica Cavallo Riserva,,,Le Stroppigliose,Marche,,19,Verdicchio 100%,Filetto di branzino gratinato,,,86,nd,nd,,,,,14,1,,Acciaio 22 mesi,,,"Livrea giallo paglierino che vira verso l’oro. Fine all’olfatto, con citazioni di ginestra e cedro, didascalie di ghiaia e crosta di pane. L’ingresso è caldo e sapido, con un spinta acida non indifferente. Il retrogusto resta fedele al naso, si aggiunge una leggera tostatura nel setale.",Italy,,,
2,,,,,,,,,,,,,,,,,2023,2019,,Pietra Maula,,,Le Stroppigliose,Marche,,19,Sangiovese 75% – Merlot 15% – Barbera 5% – Pinot nero 5%,Legno 2 mesi Pasta alla Norma,,,86,nd,nd,,,,,14,1,,Acciaio 22 mesi,,,,Italy,,,
2,,,,,,,,,,,,,,,,,2023,2020,,Verdicchio Di Matelica Arpía,,,Le Stroppigliose,Marche,,19,Verdicchio 100%,Filetti di trota al vapore con maionese,,,86,nd,nd,,,,,14,1,,Acciaio 22 mesi,,,,Italy,,,
2,,,,,,,,,,,,,,,,,2023,2018,,Cabernet Sauvignon Cerì,,,Le Vigne di Clementina Fabi,Marche,,12,Cabernet sauvignon 100%,Tagliata al pepe verde,,,89,nd,nd,,,,,13,3,,Legno 12 mesi,,,"Impenetrabile rubino. Naso ricco e aristocratico, composto da ciliegia e amarena in sciroppo, movimentato da spolverate di cacao e carruba fino briose pungenze speziate. Abbrivio convincente, appagante, il tannino dialoga con l’alcool pervadendo il sorso equilibrato e decisamente esteso.",Italy,,,
2,,,,,,,,,,,,,,,,,2023,2020,,Offida Pecorino Cerì,,,Le Vigne di Clementina Fabi,Marche,,12,Pecorino 100%,Ravioli di pesce con sugo di canestrelli,,,89,nd,nd,,,,,13,3,,Legno 12 mesi,,,,Italy,,,
2,,,,,,,,,,,,,,,,,2023,2020,,Rosso Piceno Cerì,,,Le Vigne di Clementina Fabi,Marche,,12,Montepulciano 85% – Sangiovese 15%,Filetto di cervo ai mirtilli,,,89,nd,nd,,,,,13,3,,Legno 12 mesi,,,,Italy,,,
2,,,,,,,,,,,,,,,,,2023,2018,,Syrah,,,Le Vigne di Clementina Fabi,Marche,,12,Syrah 100%,Acciaio 4 mesi 12 mesi sui lieviti Frittura di rane e verdure croccanti,,,86,nd,nd,,,,,13,3,,Legno 12 mesi,,,Petto di germano reale al balsamico. TERRE DI OFFIDA PASSERINA SPUMANTE BRUT 12 Bianco Doc Metodo Martinotti Passerina 100% Alc. 13% | € 15 | Bt. 3.300 | Ferm. Acciaio | Mat.,Italy,,,
2,,,,,,,,,,,,,,,,,2023,2021,,Offida Passerina Cerì,,,Le Vigne di Clementina Fabi,Marche,,12,Passerina 100%,Soufflé con pecorino e crema di patate,,,82,nd,nd,,,,,13,3,,Legno 12 mesi,,,,Italy,,,
2,,,,,,,,,,,,,,,,,2023,2018,,Verdicchio Dei Castelli Di Jesi Poggio Casalta,,,Libenzi,Marche,,13,Verdicchio 100%,Sauté di cozze,,,86,nd,nd,,,,,14,4,,Acciaio 6 mesi,,,"Brillante paglierino. Netti i toni ammandorlati e i tratti floreali di sambuco e biancospino. La successione offre il vegetale di finocchietto e il fruttato di prugna gialla e pompelmo. Ottimo il palato, fresco e caldo, in buon equilibrio. La chiusura è sapida e lunga.",Italy,,,
2,,,,,,,,,,,,,,,,,2023,2020,,Rosso Conero Zizzero,,,Libenzi,Marche,,13,Montepulciano 100%,Pappardelle al ragù di cinghiale,,,86,nd,nd,,,,,14,4,,Acciaio 6 mesi,,,,Italy,,,
2,,,,,,,,,,,,,,,,,2023,2019,,Rosso Piceno Rubideo,,,Libenzi,Marche,,13,Montepulciano 80% – Sangiovese 20%,Petto d'anatra alle prugne,,,82,nd,nd,,,,,14,4,,Acciaio 6 mesi,,,,Italy,,,
2,,,,,,,,,,,,,,,,,2023,2020,,Sauvignon Primo Latere,,,Libenzi,Marche,,13,Sauvignon 100%,"Minestra di riso, patate, porri, sedano e speck",,,82,nd,nd,,,,,14,4,,Acciaio 6 mesi,,,,Italy,,,
2,,,,,,,,,,,,,,,,,2023,2021,,Verdicchio Dei Castelli Di Jesi Baccaloro,,,Libenzi,Marche,,13,Verdicchio 100%,Risotto ai frutti di mare,,,82,nd,nd,,,,,14,4,,Acciaio 6 mesi,,,,Italy,,,
2,,,,,,,,,,,,,,,,,2023,2017,,Rosso Conero Zizzero,,,Libenzi,Marche,,13,,,,,89,nd,nd,,,,,14,4,,Acciaio 6 mesi,,,,Italy,,,
2,,,,,,,,,,,,,,,,,2023,2014,,Torrile,,,Libenzi,Marche,,13,,,,,86,nd,nd,,,,,14,4,,Acciaio 6 mesi,,,,Italy,,,
2,,,,,,,,,,,,,,,,,2023,2019,,Colli Pesaresi Sangiovese Goccione,,,Roberto Lucarelli,Marche,,15,Sangiovese 100%,Costine d’agnello in crosta di noci,,,89,nd,nd,,,,,13,12,,Legno 18 mesi,,,"Cromia rubino dai solchi granato. Frequenza olfattiva giocata su toni fruttati e floreali, ciliegia e ciclamino, e su incisive tracce balsamiche che si aprono al pepe nero e al tabacco. La personalità del tannino, ancora aggressiva, fa emergere una singolare freschezza e una lieve sapidità.",Italy,,,
2,,,,,,,,,,,,,,,,,2023,2020,,Bianchello Del Metauro Superiore Rocho,,,Roberto Lucarelli,Marche,,15,Bianchello 100%,e Legno 12 mesi Maltagliati con fiori di zucca e gamberetti,,,89,nd,nd,,,,,13,12,,Legno 18 mesi,,,,Italy,,,
2,,,,,,,,,,,,,,,,,2023,2020,,Colli Pesaresi Focara Pinot Nero Focara Blanc De Noir,,,Roberto Lucarelli,Marche,,15,Pinot nero 100%,Legno 12 mesi Bocconcini di rana pescatrice in crosta di mandorle,,,86,nd,nd,,,,,13,12,,Legno 18 mesi,,,,Italy,,,
2,,,,,,,,,,,,,,,,,2023,2021,,Bianchello Del Metauro La Ripe,,,Roberto Lucarelli,Marche,,15,Bianchello 100%,Rotolo di tacchino alle mele ed erbe aromatiche,,,86,nd,nd,,,,,13,12,,Legno 18 mesi,,,,Italy,,,
2,,,,,,,,,,,,,,,,,2023,2021,,Collemare,,,Roberto Lucarelli,Marche,,15,Chardonnay 50% – Sauvignon 50%,e Legno 6 mesi Frittata di erbette,,,86,nd,nd,,,,,13,12,,Legno 18 mesi,,,,Italy,,,
2,,,,,,,,,,,,,,,,,2023,2020,,Lacrima Di Morro D’Alba Superiore Guardengo,,,Lucchetti,Marche,,16,Lacrima 100%,Maialino in agrodolce,,,86,nd,nd,,,,,14,10,,Acciaio 6 mesi,,,"Splendido rosso porpora. Intriganti emozioni di viola, amarena, geranio, visciola, peperone verde. Leggere elegie pepate. Sorso imperniato su tannino avvolgente ma ben inserito nell’abbraccio calorico. Lungo epilogo dagli echi balsamici e vegetali.",Italy,,,
2,,,,,,,,,,,,,,,,,2023,2020,,Verdicchio Dei Castelli Di Jesi Classico Superiore Vigna Vittoria,,,Lucchetti,Marche,,16,Verdicchio 100%,Rombo al forno ai sapori mediterranei,,,86,nd,nd,,,,,14,10,,Acciaio 6 mesi,,,,Italy,,,
2,,,,,,,,,,,,,,,,,2023,2021,,Verdicchio Dei Castelli Di Jesi Classico Birbacció,,,Lucchetti,Marche,,16,Verdicchio 100%,Linguine alla granseola e rosmarino,,,86,nd,nd,,,,,14,10,,Acciaio 6 mesi,,,,Italy,,,
2,,,,,,,,,,,,,,,,,2023,2021,,Lacrima Di Morro D’Alba Fiore,,,Lucchetti,Marche,,16,Lacrima 100%,Zampone e lenticchie,,,82,nd,nd,,,,,14,10,,Acciaio 6 mesi,,,,Italy,,,
2,,,,,,,,,,,,,,,,,2023,2015,,Tusiano,,,Lumavite,Marche,,25,Montepulciano 100%,Capriolo ai porcini,,,91,nd,nd,,,,,15,1,,Legno 24 mesi,,,"Rosso rubino esemplare. Ammalia con l’unicità di liquirizia, amarena matura, garofano ed eucalipto. Magnifiche scie di frutta rossa in confettura e trame eteree di smalto. Palato finissimo, tannini setosi e rotondi, dal mirabile equilibrio gustativo e tattile. Si congeda da fuoriclasse.",Italy,,,
2,,,,,,,,,,,,,,,,,2023,2016,,Vidacilius,,,Lumavite,Marche,,25,Montepulciano 50% – Sangiovese 30% – Syrah 20%,Costata di manzo alla griglia,,,86,nd,nd,,,,,15,1,,Legno 24 mesi,,,,Italy,,,
2,,,,,,,,,,,,,,,,,2023,2020,,Bianko,,,Macondo,Marche,,90,Trebbiano 60% – Pecorino 40%,lorenzocatasta@gmail,,,91,nd,nd,,,,,14,2,,Legno 18 mesi,,,"Oro brillante. Variegati profumi che spaziano dalla vaniglia al miele d’acacia, dalla frutta tropicale matura alle zeste di agrumi essiccate. Seguono tabacco biondo, erbe mediterranee e pietra focaia. Perfetto il connubio tra le morbidezze e la sferzante sapida acidità. Chiusura balsamica e minerale. Coniglio in umido alle erbe aromatiche. Via Colle Bruno, 2 63064 Cupra Marittima (AP) T. 348 2922890 | M.com",Italy,,,
